name,phone,address,city,state,zip_code,email,website,category,license_number,license_type,license_expiry,types_of_work,bbb_rating,google_rating,review_count,bbb_profile_url,source
KMPlumbingHeatingCoolingLLC,(515) 344-2703,12045 NE 68th St,Bondurant,IA,50035,,,Plumbing and Heating,,,,,,,,https://www.bbb.org/us/ia/bondurant/profile/plumbing-and-heating/km-plumbing-heating-cooling-llc-0664-32136565,BBB
Kness Heating & Cooling LLC,(815) 499-1234,106 4th Ave,Sterling,IL,61081,,,"Heating and Air Conditioning, Air Conditioning Contractors, Air Duct Cleaning",,,,,A+,,,https://www.bbb.org/us/il/sterling/profile/heating-and-air-conditioning/kness-heating-cooling-llc-0654-1000114894,BBB
Knights Construction Company Inc,(641) 220-4083,1928 Mission Ave,New Hampton,IA,50659,,,"New Construction, Roofing Contractors, General Contractor",,,,,A+,,,https://www.bbb.org/us/ia/new-hampton/profile/new-construction/knights-construction-company-inc-0664-32081982,BBB
"Knuth Construction, Inc.",(515) 210-2425,10127 W 100th St N,Rhodes,IA,50234,,,"General Contractor, Roofing Contractors, Construction Services",,,,,A+,,,https://www.bbb.org/us/ia/rhodes/profile/general-contractor/knuth-construction-inc-0664-29000481,BBB
Kohles & Bach Heating & Cooling,(515) 278-2900,5185 NW Beaver Dr,Johnston,IA,50131,,,"Heating and Air Conditioning, Air Conditioning Contractors, Air Conditioning Repair",,,,,A+,,,https://www.bbb.org/us/ia/johnston/profile/heating-and-air-conditioning/kohles-bach-heating-cooling-0664-101746,BBB
KohlesMechanicalInc,(515) 270-9000,5765 Columbine Dr,Johnston,IA,50131,,,Mechanical Contractors,,,,,,,,https://www.bbb.org/us/ia/johnston/profile/mechanical-contractors/kohles-mechanical-inc-0664-32068215,BBB
Kona Construction Services,(406) 599-6395,1801 W Euclid Ave,Indianola,IA,50125,,,"Construction Services, General Contractor, Handyman",,,,,A+,,,https://www.bbb.org/us/ia/indianola/profile/construction-services/kona-construction-services-0664-32030984,BBB
KoskiMechanical,(319) 377-6434,4616 Indian Creek Rd,Marion,IA,52302,,,Heating Contractors,,,,,,,,https://www.bbb.org/us/ia/marion/profile/heating-contractors/koski-mechanical-0664-32137940,BBB
Kriens Plumbing andMechanicalCorp,(515) 288-8688,2110 Wakonda View Dr,Des Moines,IA,50321,,,"Plumber, Plumbing Renovation, Mechanical Contractors",,,,,A+,,,https://www.bbb.org/us/ia/des-moines/profile/plumber/kriens-plumbing-and-mechanical-corp-0664-3000591,BBB
KRM Development LLC,(515) 419-3680,10640 Justin Dr,Urbandale,IA,50322,,,"Home Builders, Roofing Contractors, General Contractor",,,,,A+,,,https://www.bbb.org/us/ia/urbandale/profile/home-builders/krm-development-llc-0664-32038340,BBB
Krob F J & CO Elevator,(319) 938-2216,210 Market Ave # 1,Rowley,IA,52329,,,Mechanical Contractors,,,,,,,,https://www.bbb.org/us/ia/rowley/profile/mechanical-contractors/krob-f-j-co-elevator-0664-32087162,BBB
Kruse Equipment Operating LLC,(563) 599-5570,17423 Mels CT,Dubuque,IA,52001,,,Mechanical Contractors,,,,,,,,https://www.bbb.org/us/ia/dubuque/profile/mechanical-contractors/kruse-equipment-operating-llc-0664-32090777,BBB
"Kucirek Engineering, Inc.",(402) 951-0022,7587 Main St,Ralston,NE,68127,,,"Mechanical Contractors, Architect",,,,,A+,,,https://www.bbb.org/us/ne/ralston/profile/mechanical-contractors/kucirek-engineering-inc-0714-104002628,BBB
Kuenster Heating & Air,(319) 656-4351,104 S G Ave,Kalona,IA,52247,,,"Heating and Air Conditioning, Air Conditioning Contractors, Heating Contractors",,,,,A+,,,https://www.bbb.org/us/ia/kalona/profile/heating-and-air-conditioning/kuenster-heating-air-0664-32033758,BBB
"Kuppinger Concrete & Construction, Inc.",(641) 430-3993,850 N Illinois Ave,Mason City,IA,50401,,,"General Contractor, Construction Services, Concrete Contractors",,,,,A+,,,https://www.bbb.org/us/ia/mason-city/profile/general-contractor/kuppinger-concrete-construction-inc-0664-32053209,BBB
KvideraMechanicalInc,(712) 943-6699,PO Box 250,Salix,IA,51052,,,Mechanical Contractors,,,,,,,,https://www.bbb.org/us/ia/salix/profile/mechanical-contractors/kvidera-mechanical-inc-0664-32070220/addressId/28871,BBB
KW's Floor Care,,55735 Buttermilk Ave,Knox City,MO,63446,,,"Carpet and Rug Cleaners, Home Improvement, Remodel Contractors",,,,,,,,https://www.bbb.org/us/mo/knox-city/profile/carpet-and-rug-cleaners/kws-floor-care-0734-1000006828,BBB
L & C Builders LLC,(319) 240-6077,2303 150th St,New Hampton,IA,50659,,,"General Contractor, Roofing Contractors, Siding Contractors",,,,,A+,,,https://www.bbb.org/us/ia/new-hampton/profile/general-contractor/l-c-builders-llc-0664-32048942,BBB
L & LHeating&CoolingService & Repair,(319) 823-0598,906 L Ave,Grundy Center,IA,50638,,,Plumbing and Heating,,,,,,,,https://www.bbb.org/us/ia/grundy-center/profile/plumbing-and-heating/l-l-heating-cooling-service-repair-0664-32135884,BBB
L & M Ethanol Maintenance Contracting Inc,(515) 955-2010,3830 Maple Dr,Fort Dodge,IA,50501,,,"Plant Maintenance Shutdown Contractor, Mechanical Contractors, Power Plant Equipment Repair",,,,,A+,,,https://www.bbb.org/us/ia/fort-dodge/profile/plant-maintenance-shutdown-contractor/l-m-ethanol-maintenance-contracting-inc-0664-32074527,BBB
"Lambasio, Inc.",(309) 341-1802,401 E Berrien St,Galesburg,IL,61401,,,"Plumber, Heating and Air Conditioning, Excavating Contractors",,,,,A+,,,https://www.bbb.org/us/il/galesburg/profile/plumber/lambasio-inc-0724-17000612,BBB
"LamoniHeating,Cooling&Plumbing",(641) 784-3344,139 N Linden St,Lamoni,IA,50140,,,Heating and Air Conditioning,,,,,,,,https://www.bbb.org/us/ia/lamoni/profile/heating-and-air-conditioning/lamoni-heatingcooling-plumbing-0664-32027008,BBB
"Langel'sPlumbing,Heating, Air Conditioning & Well Service, Inc.",(712) 546-8562,735 6th St SW,Le Mars,IA,51031,,,"Plumber, Heating and Air Conditioning, Septic Tank Contractors",,,,,A+,,,https://www.bbb.org/us/ia/le-mars/profile/plumber/langels-plumbing-heating-air-conditioning-well-service-inc-0664-30550,BBB
"Langel'sPlumbing,Heating, Air Conditioning & Well Service, Inc.",(712) 722-1261,1419 S. Main Ave,Sioux Center,IA,51250,,,"Plumber, Heating and Air Conditioning, Septic Tank Contractors",,,,,A+,,,https://www.bbb.org/us/ia/sioux-center/profile/plumber/langels-plumbing-heating-air-conditioning-well-service-inc-0664-30550/addressId/91900,BBB
"Lantz Elite Carpentry & Construction, Inc.",(515) 554-3684,3000 Justin Dr Ste J,Urbandale,IA,50322,,,"Framing Contractors, General Contractor, Construction Services",,,,,A+,,,https://www.bbb.org/us/ia/urbandale/profile/framing-contractors/lantz-elite-carpentry-construction-inc-0664-32051777,BBB
Larew Kuper Co. Plumb Htg Clg Llc,(319) 337-9618,1611 Willow Creek Drive,Iowa City,IA,52246,,,Heating and Air Conditioning,,,,,,,,https://www.bbb.org/us/ia/iowa-city/profile/heating-and-air-conditioning/larew-kuper-co-plumb-htg-clg-llc-0664-32144492,BBB
"Larry Thomas Construction, LLC",(563) 499-7286,2323 N Birchwood Ave,Davenport,IA,52804,,,"General Contractor, Construction Services, Remodel Contractors",,,,,A+,,,https://www.bbb.org/us/ia/davenport/profile/general-contractor/larry-thomas-construction-llc-0664-32050302,BBB
Larry's Seamless Gutters And More,(515) 554-0994,915 E 28th St,Des Moines,IA,50317,,,"Roofing Contractors, General Contractor, Gutter Contractors",,,,,A+,,,https://www.bbb.org/us/ia/des-moines/profile/roofing-contractors/larrys-seamless-gutters-and-more-0664-32041544,BBB
Larrys Plumbing Heating & AC,(319) 478-2783,800 Crestview Dr,Traer,IA,50675,,,Air Conditioning Contractors,,,,,,,,https://www.bbb.org/us/ia/traer/profile/air-conditioning-contractor/larrys-plumbing-heating-ac-0664-32130769,BBB
Lazer Electric andPlumbing,(515) 263-0352,5703 NW 2nd St,Des Moines,IA,50313,,,Heating and Air Conditioning,,,,,B-,,,https://www.bbb.org/us/ia/des-moines/profile/heating-and-air-conditioning/lazer-home-services-0664-32029912,BBB
"LBA Air Conditioning,Heating, &Plumbing, Inc.",(913) 246-3468,6850 W 47th Ter,Shawnee,KS,66203,,,"Heating and Air Conditioning, Air Conditioning Contractors, Residential Air Conditioning Contractors",,,,,A+,,,https://www.bbb.org/us/ks/shawnee/profile/heating-and-air-conditioning/lba-air-conditioning-heating-plumbing-inc-0714-90070053,BBB
"LedomMechanical, LLC",(816) 894-9236,8380 Barkertown Rd,Odessa,MO,64076,,,"Mechanical Contractors, Painting Contractors, Handyman",,,,,A+,,,https://www.bbb.org/us/mo/odessa/profile/mechanical-contractors/ledom-mechanical-llc-0714-1000074336,BBB
Lee's SummitHeating&CoolingPlumbingElectrical,(816) 525-7218,1050 SE Century Dr,Lees Summit,MO,64081,,,"Heating and Air Conditioning, Plumber, Electrician",,,,,A+,,,https://www.bbb.org/us/mo/lees-summit/profile/heating-and-air-conditioning/lees-summit-heating-cooling-plumbing-electrical-0714-99070857,BBB
"Lee'sHeating,Cooling&Plumbing",(319) 504-9015,407 Bayard St,Waterloo,IA,50701,,,Residential Air Conditioning Contractors,,,,,,,,https://www.bbb.org/us/ia/waterloo/profile/residential-air-conditioning-contractors/lees-heating-cooling-plumbing-0664-32134013,BBB
"Legacy Heating and AC, LLC",(531) 263-1940,Fremont,Des Moines,IA,,,,"Heating and Air Conditioning, Air Conditioning Contractors, Air Conditioning Repair",,,,,A-,,,https://www.bbb.org/us/ne/fremont/profile/heating-and-air-conditioning/legacy-heating-and-ac-llc-0714-1000077833,BBB
"Legacy Restoration, LLC",(515) 325-5397,Ankeny,Des Moines,IA,,,,"Roofing Contractors, General Contractor, Siding Contractors",,,,,A+,,,https://www.bbb.org/us/ia/ankeny/profile/roofing-contractors/legacy-restoration-llc-0664-32147655/addressId/77117,BBB
Leichty & Son Construction Inc,(319) 256-5312,1548 Henry Washington St,Mount Pleasant,IA,52641,,,"General Contractor, Excavating Contractors",,,,,A+,,,https://www.bbb.org/us/ia/mount-pleasant/profile/general-contractor/leichty-son-construction-inc-0664-32044210,BBB
Lekwa Heating & Cooling LLC,(515) 460-2806,56330 130th St,Story City,IA,50248,,,"Heating and Air Conditioning, Ventilating Contractors",,,,,A+,,,https://www.bbb.org/us/ia/story-city/profile/heating-and-air-conditioning/lekwa-heating-cooling-llc-0664-32051545,BBB
Lenning Electric &HVAC,(515) 231-5475,3607 Blanshan Dr,Ames,IA,50010,,,Electrical Contractors,,,,,A+,,,https://www.bbb.org/us/ia/ames/profile/electrical-contractors/lenning-electric-hvac-0664-32057133,BBB
Lenz Heating and Cooling,(641) 782-0022,7641 Douglas Avenue,Urbandale,IA,50322,,,"Residential Air Conditioning Contractors, Heating and Air Conditioning, Air Conditioning Contractors",,,,,A+,,,https://www.bbb.org/us/ia/urbandale/profile/residential-air-conditioning-contractors/lenz-heating-and-cooling-0664-32046671,BBB
LenzMechanicalLLC,(641) 782-0022,7641 Douglas Avenue,Urbandale,IA,50322,,,"Residential Air Conditioning Contractors, Heating and Air Conditioning, Air Conditioning Contractors",,,,,A+,,,https://www.bbb.org/us/ia/urbandale/profile/residential-air-conditioning-contractors/lenz-heating-and-cooling-0664-32046671,BBB
LeonPlumbingHeating&Cooling,(641) 572-0990,1401 NE Poplar St,Leon,IA,50144,,,Air Conditioning Contractors,,,,,A+,,,https://www.bbb.org/us/ia/leon/profile/air-conditioning-contractor/leon-plumbing-heating-cooling-0664-32149854,BBB
Level Up Remodeling & Renovation,(515) 817-7970,7711 Hickman Rd,Urbandale,IA,50322,,,"Remodel Contractors, Bathroom Remodel, Kitchen Remodel",,,,,A+,,,https://www.bbb.org/us/ia/urbandale/profile/remodel-contractors/level-up-remodeling-renovation-0664-32131187,BBB
LewisMechanical,(402) 870-1175,4586 Crest Ridge Loop,Blair,NE,68008,,,"Mechanical Contractors, Welding, Steel Erectors",,,,,,,,https://www.bbb.org/us/ne/blair/profile/mechanical-contractors/lewis-mechanical-0714-300182288,BBB
"Liberty Homes, Inc.",(402) 669-2909,1951 Jennings Ave,Council Blfs,IA,51503,,,"Home Builders, General Contractor, Construction Services",,,,,A+,,,https://www.bbb.org/us/ia/council-blfs/profile/home-builders/liberty-homes-inc-0714-104009307,BBB
Liberty Plumbing Heating & AC,(816) 781-1469,604 S Leonard St,Liberty,MO,64068,,,"Heating and Air Conditioning, Plumber, Air Conditioning Contractors",,,,,A+,,,https://www.bbb.org/us/mo/liberty/profile/heating-and-air-conditioning/liberty-plumbing-heating-ac-0714-1000031160,BBB
Lind's Home Center,(608) 654-7844,801 Main St.,Cashton,WI,54619,,,"Hardware Sales, Heating and Air Conditioning, Online Shopping",,,,,A+,,,https://www.bbb.org/us/wi/cashton/profile/hardware-sales/linds-home-center-0694-1000003369,BBB
LippertMechanicalService Corp.,(816) 241-4442,1215 W 12th St Ste 225,Kansas City,MO,64101,,,"Heating and Air Conditioning, Air Conditioning Contractors, Heating Contractors",,,,,A+,,,https://www.bbb.org/us/mo/kansas-city/profile/heating-and-air-conditioning/lippert-mechanical-service-corp-0714-99148310,BBB
Lj Roth Reconstruction Inc Dba MccoyPlumbing&Heating,(319) 254-2221,112 S Main Street,Olds,IA,52647,,,Heating and Air Conditioning,,,,,A+,,,https://www.bbb.org/us/ia/olds/profile/heating-and-air-conditioning/lj-roth-reconstruction-inc-dba-mccoy-plumbing-heating-0664-32144721,BBB
Loftus Heating & Air Conditioning,(712) 644-3260,PO Box 4,Logan,IA,51546,,,"Heating and Air Conditioning, Air Conditioning Contractors, Air Duct Cleaning",,,,,A+,,,https://www.bbb.org/us/ia/logan/profile/heating-and-air-conditioning/loftus-heating-air-conditioning-0714-104009571/addressId/42921,BBB
Lon's Plumbing & Heating Company,(319) 345-2711,516 Main St,Reinbeck,IA,50669,,,"Plumber, Heating and Air Conditioning, Pumping Contractors",,,,,A+,,,https://www.bbb.org/us/ia/reinbeck/profile/plumber/lons-plumbing-heating-company-0664-29000705,BBB
Lonestar Carpet & Flooring LLC,(507) 304-3867,Mankato,Marshalltown,IA,,,,"Flooring Contractors, Hardwood Floor Contractors, Carpet Installation",,,,,A+,,,https://www.bbb.org/us/mn/mankato/profile/flooring-contractors/lonestar-carpet-flooring-llc-0704-1000045293,BBB
LoomisPlumbing&Heating,(563) 422-5869,211 S Vine St,West Union,IA,52175,,,"Plumber, Heating and Air Conditioning, Major Appliance Services",,,,,A+,,,https://www.bbb.org/us/ia/west-union/profile/plumber/loomis-plumbing-heating-0664-32023319,BBB
"Lott's Home Improvement, L.L.C.",(641) 781-9525,1254 240th St,Creston,IA,50801,,,"General Contractor, Roofing Contractors, Construction Services",,,,,A+,,,https://www.bbb.org/us/ia/creston/profile/general-contractor/lotts-home-improvement-llc-0664-32158656,BBB
Lozier Heating and Cooling Inc,(515) 267-1000,536 S 19th St,West Des Moines,IA,50265,,,"Heating and Air Conditioning, Residential Air Conditioning Contractors, Heating Contractors",,,,,A+,,,https://www.bbb.org/us/ia/west-des-moines/profile/heating-and-air-conditioning/lozier-heating-and-cooling-inc-0664-101851,BBB
LTMechanical,(563) 547-1777,Larry Trende,Cresco,IA,52136,,,Mechanical Contractors,,,,,,,,https://www.bbb.org/us/ia/cresco/profile/mechanical-contractors/lt-mechanical-0664-32082610,BBB
Ludemann Construction,(402) 813-9122,Omaha,Waukee,IA,,,,"Roofing Contractors, Construction Services, Concrete Contractors",,,,,A+,,,https://www.bbb.org/us/ne/omaha/profile/roofing-contractors/ludemann-construction-0714-300076902,BBB
Luiken's Mechanical LLC,(507) 332-7802,1001 Division St W,Faribault,MN,55021,,,"Plumbing and Heating, Plumber, Heating and Air Conditioning",,,,,A+,,,https://www.bbb.org/us/mn/faribault/profile/plumbing-and-heating/luikens-mechanical-llc-0704-96126195,BBB
Luxury Remodeling,(641) 521-0110,1500 W 12th St S,Newton,IA,50208,,,"Kitchen Remodel, General Contractor, Bathroom Remodel",,,,,A+,,,https://www.bbb.org/us/ia/newton/profile/kitchen-remodel/luxury-remodeling-0664-32098136,BBB
M & P Heating & AC,(217) 964-2987,2330 Highway 96 N,Ursa,IL,62376,,,"Heating and Air Conditioning, Air Conditioning Contractors, Air Duct Cleaning",,,,,A+,,,https://www.bbb.org/us/il/ursa/profile/heating-and-air-conditioning/m-p-heating-ac-0734-1000046189,BBB
M & W ProPlumbing&HeatingInc,(319) 239-2033,9206 Eldora Rd,Hudson,IA,50643,,,Heating and Air Conditioning,,,,,A+,,,https://www.bbb.org/us/ia/hudson/profile/heating-and-air-conditioning/m-w-pro-plumbing-heating-inc-0664-32025068,BBB
M and AMechanicalCorporation,(815) 273-7000,228 Chicago Ave,Savanna,IL,61074,,,"Heating and Air Conditioning, Air Conditioning Contractors, Air Conditioning Repair",,,,,A+,,,https://www.bbb.org/us/il/savanna/profile/heating-and-air-conditioning/river-cities-heating-air-conditioning-and-refrigeration-0654-1000048094,BBB
M MMechanicalServices,(641) 426-6797,1938 Windfall Ave,Charles City,IA,50616,,,Air Conditioning Contractors,,,,,,,,https://www.bbb.org/us/ia/charles-city/profile/air-conditioning-contractor/m-m-mechanical-services-0664-32132448,BBB
M.D. Air Services,(402) 213-1918,Blair,Des Moines,IA,,,,"Heating and Air Conditioning, Air Conditioning Contractors, Air Conditioning Repair",,,,,A+,,,https://www.bbb.org/us/ne/blair/profile/heating-and-air-conditioning/md-air-services-0714-135002402,BBB
"M2 Construction, LLC",(515) 210-0324,12356 150th Ave,Indianola,IA,50125,,,"General Contractor, Construction Services, Siding Contractors",,,,,A+,,,https://www.bbb.org/us/ia/indianola/profile/general-contractor/m2-construction-llc-0664-32158922,BBB
"Maas Restoration, LLC",(612) 227-5809,114 S Main St,Medford,MN,55049,,,"Construction Services, Roofing Contractors, Home Builders",,,,,A+,,,https://www.bbb.org/us/mn/medford/profile/construction-services/maas-restoration-llc-0704-96385642,BBB
Magee Construction Company,(319) 277-0100,1705 Waterloo Rd,Cedar Falls,IA,50613,,,"Home Builders, Roofing Contractors, General Contractor",,,,,A+,,,https://www.bbb.org/us/ia/cedar-falls/profile/home-builders/magee-construction-company-0664-4000909,BBB
Magruder Construction LLC,(319) 530-9107,4525 580th St SE,Lone Tree,IA,52755,,,"Home Builders, General Contractor, Construction Services",,,,,A+,,,https://www.bbb.org/us/ia/lone-tree/profile/home-builders/magruder-construction-llc-0664-32048637,BBB
"Mainelli MechanicalContractors, Inc.",(402) 457-5501,8701 N 29th St,Omaha,NE,68112,,,"Mechanical Contractors, Plumber, Heating and Air Conditioning",,,,,A+,,,https://www.bbb.org/us/ne/omaha/profile/mechanical-contractors/mainelli-mechanical-contractors-inc-0714-104004887,BBB
Manning SeivertMechanicalContractorsInc,(515) 999-2597,1801 Sycamore St,Granger,IA,50109,,,"Mechanical Contractors, Building Contractors",,,,,A+,,,https://www.bbb.org/us/ia/granger/profile/mechanical-contractors/manning-seivert-mechanical-contractors-inc-0664-32058350,BBB
"ManningGeneralContractors, LLC",(816) 448-8208,1105 Fairway Drive,Richmond,MO,64085,,,"Residential Roofing, Roofing Contractors, Home Improvement",,,,,A+,,,https://www.bbb.org/us/mo/richmond/profile/residential-roofing/manning-roofing-0714-1000024065/addressId/286474,BBB
Mansons Renovation & Repair LLC,(573) 489-4753,771 E Camellia Ct,Columbia,MO,65202,,,"Remodel Contractors, General Contractor, Construction Services",,,,,A+,,,https://www.bbb.org/us/mo/columbia/profile/remodel-contractors/mansons-renovation-repair-llc-0734-1000028414,BBB
"Mapes-Hornig Homes, Inc.",(402) 510-8222,4874 County Road P39,Fort Calhoun,NE,68023,,,"Construction Services, General Contractor, Home Builders",,,,,A+,,,https://www.bbb.org/us/ne/fort-calhoun/profile/construction-services/mapes-hornig-homes-inc-0714-300030003,BBB
Mapleton Rooter &Plumbing,(712) 882-1816,810 Main Street,Mapleton,IA,51034,,,Heating and Air Conditioning,,,,,A+,,,https://www.bbb.org/us/ia/mapleton/profile/heating-and-air-conditioning/mapleton-rooter-plumbing-0664-32144598,BBB
MarickMechanical,(402) 571-9638,7525 D St,Omaha,NE,68124,,,"Air conditioning & Heating Contractors - Commercial, Plumbing Renovation, Commercial Air Conditioning Contractors",,,,,A+,,,https://www.bbb.org/us/ne/omaha/profile/air-conditioning-heating-contractors-commercial/marick-mechanical-0714-600002036,BBB
Mark Hughes Construction,(712) 527-1000,410 S Locust St,Glenwood,IA,51534,,,"Home Builders, General Contractor, Concrete Contractors",,,,,A+,,,https://www.bbb.org/us/ia/glenwood/profile/home-builders/mark-hughes-construction-0714-138000089,BBB
"Mark4 Construction, LLC",(816) 729-0904,Cameron,Centerville,IA,,,,"Home Builders, General Contractor, Home Improvement",,,,,A-,,,https://www.bbb.org/us/mo/cameron/profile/home-builders/mark4-construction-llc-0714-1000076855,BBB
"Marroquin Construction, LLC",(563) 605-7215,291 28th Ave SW,Cedar Rapids,IA,52404,,,"Siding Contractors, Roofing Contractors, General Contractor",,,,,A+,,,https://www.bbb.org/us/ia/cedar-rapids/profile/siding-contractors/marroquin-construction-llc-0664-32145264,BBB
Martinez Heating & Cooling,(641) 691-1232,304 Edgeland Dr,Marshalltown,IA,50158,,,Residential Air Conditioning Contractors,,,,,,,,https://www.bbb.org/us/ia/marshalltown/profile/residential-air-conditioning-contractors/martinez-heating-cooling-0664-32130896,BBB
Marv Smith ElectricPlumbing&Heating,(563) 534-7012,2660 150th St,Fort Atkinson,IA,52144,,,Heating and Air Conditioning,,,,,,,,https://www.bbb.org/us/ia/fort-atkinson/profile/heating-and-air-conditioning/marv-smith-electric-plumbing-heating-0664-32099030,BBB
"Master Plumbing, Heating & Cooling",(319) 315-0577,3111 1st Ave SE,Cedar Rapids,IA,52402,,,"Plumber, Heating and Air Conditioning, Bathroom Remodel",,,,,A+,,,https://www.bbb.org/us/ia/cedar-rapids/profile/plumber/master-plumbing-heating-cooling-0664-5004307,BBB
"MasterMechanicalService, Inc.",(402) 592-3600,306 E 1st St,Papillion,NE,68046,,,"Mechanical Contractors, Heating and Air Conditioning, Air Conditioning Contractors",,,,,A+,,,https://www.bbb.org/us/ne/papillion/profile/mechanical-contractors/master-mechanical-service-inc-0714-104008226,BBB
"MasterTech Plumbing, Heating and Cooling",(573) 777-3660,5150 Interstate 70 Dr SW,Columbia,MO,65203,,,"Heating and Air Conditioning, Plumber, Excavating Contractors",,,,,A+,,,https://www.bbb.org/us/mo/columbia/profile/heating-and-air-conditioning/mastertech-plumbing-heating-and-cooling-0734-110218357,BBB
MaurerMechanicalLLC,(515) 250-2395,1224 44th St,Des Moines,IA,50311,,,Air Conditioning Contractors,,,,,,,,https://www.bbb.org/us/ia/des-moines/profile/air-conditioning-contractor/maurer-mechanical-llc-0664-32137221,BBB
MavenMechanicalServices Inc.,(816) 716-3749,1520 Clay St,Kansas City,MO,64116,,,"Heating and Air Conditioning, Heating Contractors, Commercial Air Conditioning Contractors",,,,,A+,,,https://www.bbb.org/us/mo/kansas-city/profile/heating-and-air-conditioning/maven-mechanical-services-inc-0714-1000042862,BBB
"May Masonry, LLC",(515) 231-7488,3520 S Riverside Dr,Ames,IA,50010,,,"Mason Contractors, Construction Services, Chimney Repair",,,,,A+,,,https://www.bbb.org/us/ia/ames/profile/mason-contractors/may-masonry-llc-0664-32070474,BBB
Mayer Larry Plumbing & Repair,(641) 752-7576,208 W Grant St,Marshalltown,IA,50158,,,Air Conditioning Contractors,,,,,,,,https://www.bbb.org/us/ia/marshalltown/profile/air-conditioning-contractor/mayer-larry-plumbing-repair-0664-32130502,BBB
MC Trenching,(402) 651-6164,2905 Preston Pl,Logan,IA,51546,,,"Sewer Contractors, General Contractor, Septic Tank Contractors",,,,,A+,,,https://www.bbb.org/us/ia/logan/profile/sewer-contractors/mc-trenching-0714-300032661,BBB
MccannMechanicalInc,(319) 752-8928,820 Osborn St,Burlington,IA,52601,,,Heating Contractors,,,,,A+,,,https://www.bbb.org/us/ia/burlington/profile/heating-contractors/mccann-mechanical-inc-0664-32074872,BBB
McCarthy's One Hour Heating & Air Conditioning,(402) 983-5577,14302 C Cir,Omaha,NE,68144,,,"Heating and Air Conditioning, Air Conditioning Contractors, Air Duct Cleaning",,,,,A+,,,https://www.bbb.org/us/ne/omaha/profile/heating-and-air-conditioning/mccarthys-one-hour-heating-air-conditioning-0714-104000963,BBB
Mccartney Trim Corporation,(515) 240-8439,22351 360th St,De Soto,IA,50069,,,"Interior Contractors, General Contractor, Building Contractors",,,,,A+,,,https://www.bbb.org/us/ia/de-soto/profile/interior-contractors/mccartney-trim-corporation-0664-32070654,BBB
McDaniel Furnace & Sheet Metal,(816) 373-6370,2905 M 291 Frontage Rd,Independence,MO,64057,,,"Heating and Air Conditioning, Air Conditioning Contractors, Heating Contractors",,,,,A+,,,https://www.bbb.org/us/mo/independence/profile/heating-and-air-conditioning/mcdaniel-furnace-sheet-metal-0714-87050020,BBB
MCMechanicalLLC,(816) 903-4822,Kearney,Des Moines,IA,,,,"Heating and Air Conditioning, Air Conditioning Contractors, Air Conditioning Repair",,,,,A+,,,https://www.bbb.org/us/mo/kearney/profile/heating-and-air-conditioning/mc-mechanical-llc-0714-1000046731,BBB
"Mechanical ContractorsPlumbing,Heating,Cooling",(309) 944-4612,133 E. Exchange St.,Geneseo,IL,61254,,,"Mechanical Contractors, Plumber, Air Conditioning Contractors",,,,,A+,,,https://www.bbb.org/us/il/geneseo/profile/mechanical-contractors/wirth-inc-mechanical-contractors-plumbing-heating-cooling-0724-90011560,BBB
Mechanical& Building Repair Inc,(563) 381-4337,PO Box 267,Buffalo,IA,52728,,,Building Contractors,,,,,,,,https://www.bbb.org/us/ia/buffalo/profile/building-contractors/mechanical-building-repair-inc-0664-32068997,BBB
MechanicalAir Systems CO,(641) 423-7032,2417 S Federal,Mason City,IA,50401,,,Mechanical Contractors,,,,,,,,https://www.bbb.org/us/ia/mason-city/profile/mechanical-contractors/mechanical-air-systems-co-0664-32075273,BBB
MechanicalComfort Inc,(515) 232-2105,302 Sondrol Ave,Ames,IA,50010,,,Mechanical Contractors,,,,,,,,https://www.bbb.org/us/ia/ames/profile/mechanical-contractors/mechanical-comfort-inc-0664-32070477,BBB
MechanicalContractorsAssociation of Iowa,(515) 334-2616,3066 104th St,Urbandale,IA,50322,,,Air Conditioning Contractors,,,,,,,,https://www.bbb.org/us/ia/urbandale/profile/air-conditioning-contractor/mechanical-contractors-association-of-iowa-0664-32132442,BBB
MechanicalContractorsInc,(319) 234-3434,1920 N Raymond Road,Dewar,IA,50263,,,Heating and Air Conditioning,,,,,A+,,,https://www.bbb.org/us/ia/dewar/profile/heating-and-air-conditioning/mechanical-contractors-inc-0664-32145525,BBB
