name,phone,address,city,state,zip_code,email,website,category,license_number,license_type,license_expiry,types_of_work,bbb_rating,google_rating,review_count,bbb_profile_url,source
"Awesome Heating &AirConditioning, Inc.",(925) 989-7414,Livermore,Oakland,CA,,,,"Heating Contractors, Air Conditioning Contractors, Air Conditioning Repair",,,,,A+,,,https://www.bbb.org/us/ca/livermore/profile/heating-contractors/awesome-heating-air-conditioning-inc-1116-357590,BBB
Ayala's Color And Concepts,(415) 724-5175,350 San Jose Ave Ste 2,San Francisco,CA,94110,,,"Painting Contractors, General Contractor, Commercial Painting Contractors",,,,,A+,,,https://www.bbb.org/us/ca/san-francisco/profile/painting-contractors/ayalas-color-and-concepts-1116-77313,BBB
AyoobMechanicalInc,(650) 992-8281,480 Collins Ave # H,Colma,CA,94014,,,Mechanical Contractors,,,,,,,,https://www.bbb.org/us/ca/colma/profile/mechanical-contractors/ayoob-mechanical-inc-1116-908568,BBB
"B & BMechanicalServices, Inc.",(925) 931-0562,Pleasanton,Oakland,CA,,,,"Heating and Air Conditioning, Air Conditioning Contractors, Electrical Contractors",,,,,A+,,,https://www.bbb.org/us/ca/pleasanton/profile/heating-and-air-conditioning/b-b-mechanical-services-inc-1116-945334,BBB
B. A. MorrisonGeneralContractor,(510) 538-6451,2544 Castro Valley Blvd,Castro Valley,CA,94546,,,"Air Conditioning Contractors, General Contractor, Construction Services",,,,,A+,,,https://www.bbb.org/us/ca/castro-valley/profile/air-conditioning-contractor/b-a-morrison-general-contractor-1116-19140,BBB
BajaMechanicalInc.,(510) 672-7277,1515 Ohio Ave,Richmond,CA,94804,,,Mechanical Contractors,,,,,,,,https://www.bbb.org/us/ca/richmond/profile/mechanical-contractors/baja-mechanical-inc-1116-889367,BBB
Balcome Heating and Air LLC,,Sunnyvale,Oakland,CA,,,,"Heating and Air Conditioning, Heating Contractors",,,,,A+,,,https://www.bbb.org/us/ca/sunnyvale/profile/heating-and-air-conditioning/balcome-heating-and-air-llc-1216-1000044982,BBB
Barker Heating & Cooling,(925) 560-0280,7066 Las Positas Rd Ste G Unit G,Livermore,CA,94551,,,"Heating and Air Conditioning, General Contractor, Air Conditioning Contractors",,,,,A+,,,https://www.bbb.org/us/ca/livermore/profile/heating-and-air-conditioning/barker-heating-cooling-1116-28314,BBB
"Barker Heating &AirConditioning, LLC",(925) 560-0280,7066 Las Positas Rd Ste G Unit G,Livermore,CA,94551,,,"Heating and Air Conditioning, General Contractor, Air Conditioning Contractors",,,,,A+,,,https://www.bbb.org/us/ca/livermore/profile/heating-and-air-conditioning/barker-heating-cooling-1116-28314,BBB
Bay Area ComfortHVAC. Inc.,(925) 408-9397,Pittsburg,Oakland,CA,,,,"Heating and Air Conditioning, Air Conditioning Contractors, Heating Contractors",,,,,A+,,,https://www.bbb.org/us/ca/pittsburg/profile/heating-and-air-conditioning/bay-area-comfort-hvac-inc-1116-932019,BBB
Bay Area Contractor,(707) 690-7667,Walnut Creek,Oakland,CA,,,,"General Contractor, Construction",,,,,A+,,,https://www.bbb.org/us/ca/walnut-creek/profile/general-contractor/bay-area-contractor-1116-951968,BBB
Bay Area Plumbing & Heating,(650) 508-0522,1141 Truman St,Redwood City,CA,94061,,,"Plumber, Air Conditioning Contractors, Heating Contractors",,,,,A+,,,https://www.bbb.org/us/ca/redwood-city/profile/plumber/bay-area-plumbing-heating-1116-70665,BBB
Bay Area Remodels,(510) 681-3262,Richmond,Oakland,CA,,,,"General Contractor, Remodel Contractors, Remodeling",,,,,A+,,,https://www.bbb.org/us/ca/richmond/profile/general-contractor/bay-area-remodels-1116-927463,BBB
"Bay Counties Construction Services, Inc.",(415) 377-3362,Brisbane,Oakland,CA,,,,"General Contractor, Landscape Contractors, Gardener",,,,,A+,,,https://www.bbb.org/us/ca/brisbane/profile/general-contractor/bay-counties-construction-services-inc-1116-546554,BBB
"Bay Home Remodeling, Inc.",(415) 583-5060,Orinda,Oakland,CA,,,,"General Contractor, Landscape Contractors, Bathroom Remodel",,,,,A+,,,https://www.bbb.org/us/ca/orinda/profile/general-contractor/bay-home-remodeling-inc-1116-942307,BBB
"Bay One Builders, Inc.",(510) 908-2689,San Leandro,Oakland,CA,,,,"Painting Contractors, Roofing Contractors, General Contractor",,,,,A+,,,https://www.bbb.org/us/ca/san-leandro/profile/painting-contractors/bay-one-builders-inc-1116-936880,BBB
"Bayhill Heat &Air, Inc.",(650) 212-7600,1047 S Claremont St,San Mateo,CA,94402,,,"Air Conditioning Contractors, Heating Contractors, Furnace Repair",,,,,A+,,,https://www.bbb.org/us/ca/san-mateo/profile/air-conditioning-contractor/bayhill-heat-air-inc-1116-360924,BBB
"BaylineMechanical, Inc.",(415) 648-1225,310 Shaw Road Suite B,South San Francisco,CA,94080,,,Commercial Contractors,,,,,A+,,,https://www.bbb.org/us/ca/south-san-francisco/profile/commercial-contractors/bayline-mechanical-inc-1116-874322,BBB
"Bayside Mechanical, Inc.",(650) 578-9080,396 Hatch Dr,Foster City,CA,94404,,,"Air Conditioning Contractors, Heating and Air Conditioning, Heating Contractors",,,,,A+,,,https://www.bbb.org/us/ca/foster-city/profile/air-conditioning-contractor/bayside-mechanical-inc-1116-194889,BBB
"BayValleyMechanical, Inc.",(510) 557-8643,Hayward,Oakland,CA,,,,"Plumber, Heating and Air Conditioning, Bathroom Remodel",,,,,A+,,,https://www.bbb.org/us/ca/hayward/profile/plumber/bayvalley-mechanical-inc-1116-925999,BBB
BCCI Construction,(415) 817-5100,301 Howard St Ste 200,San Francisco,CA,94105,,,"General Contractor, Building Contractors",,,,,A+,,,https://www.bbb.org/us/ca/san-francisco/profile/general-contractor/bcci-construction-1116-15277,BBB
Bear Mechanical,(510) 461-4120,Hayward,Oakland,CA,,,,Heating and Air Conditioning,,,,,A+,,,https://www.bbb.org/us/ca/hayward/profile/heating-and-air-conditioning/bear-mechanical-1116-931644,BBB
Bell Brother's Heating and Air Inc,(916) 235-8866,3266 Investment Blvd,Hayward,CA,94545,,,"Heating and Air Conditioning, Plumber, Windows",,,,,A+,,,https://www.bbb.org/us/ca/hayward/profile/heating-and-air-conditioning/bell-brothers-heating-and-air-inc-1116-36155/addressId/177869,BBB
Bell Plumbing AndHeating,(650) 756-5100,1661 Southgate Ave,Daly City,CA,94015,,,"Plumber, Building Contractors, Residential Air Conditioning Contractors",,,,,A+,,,https://www.bbb.org/us/ca/daly-city/profile/plumber/economy-plumbing-sewer-drain-1116-548026,BBB
Bella Vista Diamond Interlocking Pavers,(925) 452-5000,San Pablo,Oakland,CA,,,,"Interlocking Pavers, Paving Contractors, Siding Contractors",,,,,A+,,,https://www.bbb.org/us/ca/san-pablo/profile/interlocking-pavers/bella-vista-diamond-interlocking-pavers-1116-965750,BBB
"Belmonte's Concrete Services, Inc.",(510) 261-8439,Oakland,Oakland,CA,,,,"Concrete Contractors, Driveway Installation, Custom Concrete",,,,,A+,,,https://www.bbb.org/us/ca/oakland/profile/concrete-contractors/belmontes-concrete-services-inc-1116-882055,BBB
Big Blue Construction,(510) 910-9379,El Cerrito,Oakland,CA,,,,"General Contractor, Excavating Contractors, Remodeling",,,,,A+,,,https://www.bbb.org/us/ca/el-cerrito/profile/general-contractor/big-blue-construction-1116-960624,BBB
BigAirPlumbing Heating & Cooling,(925) 667-3759,1000 Detroit Ave Ste W,Concord,CA,94518,,,"Air Conditioning Contractors, Heating Contractors, Plumbing Fixtures",,,,,A+,,,https://www.bbb.org/us/ca/concord/profile/air-conditioning-contractor/big-air-plumbing-heating-cooling-1116-51677,BBB
"Bill PeetHeating& Air Conditioning, Inc",(650) 967-0248,780 Yuba Dr,Mountain View,CA,94041,,,"Commercial Air Conditioning Contractors, Heating Contractors, Ductwork",,,,,A+,,,https://www.bbb.org/us/ca/mountain-view/profile/commercial-air-conditioning-contractors/bp-air-1216-213770,BBB
Bliss Building,(510) 759-1323,4132 Shafter Ave,Oakland,CA,94609,,,"General Contractor, Remodel Contractors, Construction",,,,,A+,,,https://www.bbb.org/us/ca/oakland/profile/general-contractor/bliss-building-1116-76667,BBB
Blown Away,(510) 890-5747,Hayward,Oakland,CA,,,,"Heating and Air Conditioning, Air Conditioning Contractors, Air Conditioning Repair",,,,,A-,,,https://www.bbb.org/us/ca/hayward/profile/heating-and-air-conditioning/blown-away-1116-971807,BBB
Blown Away Heating &AirConditioning,(510) 890-5747,Hayward,Oakland,CA,,,,"Heating and Air Conditioning, Air Conditioning Contractors, Air Conditioning Repair",,,,,A-,,,https://www.bbb.org/us/ca/hayward/profile/heating-and-air-conditioning/blown-away-1116-971807,BBB
Blue Dog Construction & Renovation,(510) 260-6058,Lafayette,Oakland,CA,,,,"Construction Services, General Contractor, Remodel Contractors",,,,,A+,,,https://www.bbb.org/us/ca/lafayette/profile/construction-services/blue-dog-construction-renovation-1116-308317,BBB
"Blue Mountain Construction Services, Inc.",(707) 451-8111,707 Aldridge Rd Ste B,Vacaville,CA,95688,,,"Building Contractors, Plumber, Heating and Air Conditioning",,,,,A+,,,https://www.bbb.org/us/ca/vacaville/profile/building-contractors/blue-mountain-construction-services-inc-1116-58399,BBB
"BluSky RestorationContractors, LLC",(510) 887-8500,23067 Bernhardt St,Hayward,CA,94545,,,"Fire and Water Damage Restoration, Roofing Contractors, General Contractor",,,,,A+,,,https://www.bbb.org/us/ca/hayward/profile/fire-water-damage-restoration/blusky-restoration-contractors-llc-1116-928382/addressId/148533,BBB
"Bodnar Heating &AirConditioning, Inc.",(650) 368-4408,1251 5th Ave,Redwood City,CA,94063,,,"Heating Contractors, Heating and Air Conditioning, Air Conditioning Contractors",,,,,A+,,,https://www.bbb.org/us/ca/redwood-city/profile/heating-contractors/bodnar-heating-air-conditioning-inc-1116-163176,BBB
BodnarHVAC,(650) 368-4408,1251 5th Ave,Redwood City,CA,94063,,,"Heating Contractors, Heating and Air Conditioning, Air Conditioning Contractors",,,,,A+,,,https://www.bbb.org/us/ca/redwood-city/profile/heating-contractors/bodnar-heating-air-conditioning-inc-1116-163176,BBB
BoiceGeneralContractorsdba The Workaholics,(510) 758-9675,San Pablo,Oakland,CA,,,,"Building Contractors, General Contractor, Bathroom Remodel",,,,,A+,,,https://www.bbb.org/us/ca/san-pablo/profile/building-contractors/boice-general-contractors-dba-the-workaholics-1116-12612,BBB
"BonneyPlumbing, Electrical,Heating& Air",(916) 461-9039,11101 Trade Center Dr,Rncho Cordova,CA,95670,,,"Electrical Contractors, Plumber, Heating and Air Conditioning",,,,,A+,,,https://www.bbb.org/us/ca/rncho-cordova/profile/electrical-contractors/bonney-plumbing-electrical-heating-air-1156-28001388,BBB
BossMechanical,(510) 812-4051,6255 Arlington Blvd,Suisun City,CA,94805,,,Drywall Contractors,,,,,A+,,,https://www.bbb.org/us/ca/suisun-city/profile/drywall-contractors/boss-mechanical-1116-977855,BBB
"Boudreau Plumbing & Heating, Inc.",(650) 366-5393,868 Warrington Ave,Redwood City,CA,94063,,,"Plumber, Air Conditioning Repair, Heating Contractors",,,,,A+,,,https://www.bbb.org/us/ca/redwood-city/profile/plumber/boudreau-plumbing-heating-inc-1116-65583,BBB
BPAir,(650) 967-0248,780 Yuba Dr,Mountain View,CA,94041,,,"Commercial Air Conditioning Contractors, Heating Contractors, Ductwork",,,,,A+,,,https://www.bbb.org/us/ca/mountain-view/profile/commercial-air-conditioning-contractors/bp-air-1216-213770,BBB
BradfordAir& Heating,(925) 455-4247,4049 First Street,Livermore,CA,94551,,,"Heating Contractors, Air Conditioning Contractors, Duct Cleaning",,,,,A+,,,https://www.bbb.org/us/ca/livermore/profile/heating-contractors/bradford-air-heating-1116-81734,BBB
"Brady Air Service, Inc.",(650) 742-9640,338 N Canal St Ste 6,South San Francisco,CA,94080,,,"Air Conditioning Contractors, Heating and Air Conditioning, Air Conditioning Repair",,,,,A+,,,https://www.bbb.org/us/ca/south-san-francisco/profile/air-conditioning-contractor/brady-air-service-inc-1116-67155,BBB
"Bridges Construction Services, Inc.",(510) 760-4725,2112 Placer Dr,San Leandro,CA,94578,,,"General Contractor, Excavating Contractors, Foundation Repair",,,,,A+,,,https://www.bbb.org/us/ca/san-leandro/profile/general-contractor/bridges-construction-services-inc-1116-154138,BBB
BroadwayMechanical-ContractorsInc,(510) 746-4000,873 81st Ave.,Oakland,CA,94621,,,Mechanical Contractors,,,,,A+,,,https://www.bbb.org/us/ca/oakland/profile/mechanical-contractors/broadway-mechanical-contractors-inc-1116-882443,BBB
"BrysonPlumbing,Heating& Air",(209) 941-2841,Stockton,Oakland,CA,,,,"Residential Air Conditioning Contractors, Heating and Air Conditioning, Duct Cleaning",,,,,A+,,,https://www.bbb.org/us/ca/stockton/profile/residential-air-conditioning-contractors/joe-bryson-hvac-1156-29000072,BBB
BT Construction Corp.,(510) 325-9211,Hayward,Oakland,CA,,,,"General Contractor, Roofing Contractors, Painting Contractors",,,,,A-,,,https://www.bbb.org/us/ca/hayward/profile/general-contractor/bt-construction-corp-1116-971523,BBB
"Building Efficiency, Inc.",(415) 831-4535,2037 Irving St Ste 213,San Francisco,CA,94122,,,"Energy, Heating and Air Conditioning, Insulation Contractors",,,,,A+,,,https://www.bbb.org/us/ca/san-francisco/profile/energy/building-efficiency-inc-1116-918582,BBB
"Buildrite Bay Area, Inc.",(415) 726-7957,El Sobrante,Oakland,CA,,,,"General Contractor, Roofing Contractors, Painting Contractors",,,,,A+,,,https://www.bbb.org/us/ca/el-sobrante/profile/general-contractor/buildrite-bay-area-inc-1116-942277,BBB
Buon Huasi,(925) 330-2025,Orinda,Oakland,CA,,,,"General Contractor, Bathroom Remodel, Remodel Contractors",,,,,A+,,,https://www.bbb.org/us/ca/orinda/profile/general-contractor/buon-huasi-1116-551478,BBB
Burkell Plumbing & Heating,(415) 332-3091,2000 Bridgeway,Sausalito,CA,94965,,,"Plumber, Heating and Air Conditioning, Air Conditioning Contractors",,,,,A+,,,https://www.bbb.org/us/ca/sausalito/profile/plumber/burkell-plumbing-heating-1116-35173/addressId/11293,BBB
"Burton Builders, LLC",(510) 949-7848,12488 San Pablo Ave,Richmond,CA,94805,,,"General Contractor, Building Contractors, Construction",,,,,A+,,,https://www.bbb.org/us/ca/richmond/profile/general-contractor/burton-builders-llc-1116-918741,BBB
BussMechanical,(916) 919-6556,PO Box 1394,Benicia,CA,94510,,,Mechanical Contractors,,,,,,,,https://www.bbb.org/us/ca/benicia/profile/mechanical-contractors/buss-mechanical-1116-900425,BBB
BussMechanicalServices of Ca,(707) 718-6255,794 Military E,Benicia,CA,94510,,,"Mechanical Contractors, Commercial Contractors, Commercial Plumber",,,,,,,,https://www.bbb.org/us/ca/benicia/profile/mechanical-contractors/buss-mechanical-services-of-ca-1156-90047067/addressId/161030,BBB
BussMechanicalServices of California Inc.,(707) 718-6255,794 Military E,Benicia,CA,94510,,,Flooring Contractors,,,,,A+,,,https://www.bbb.org/us/ca/benicia/profile/flooring-contractors/buss-mechanical-services-of-california-inc-1116-974394,BBB
BVMechanicalServices LLC,(510) 228-8601,2181 E 24th St,Oakland,CA,94606,,,"Air Conditioning Contractors, Air Duct Cleaning, Heating Contractors",,,,,A-,,,https://www.bbb.org/us/ca/oakland/profile/air-conditioning-contractor/bv-mechanical-services-llc-1116-970157,BBB
"C & DMechanical, Inc.",(707) 708-1889,1060 Grant St # 16,Benicia,CA,94510,,,"Heating and Air Conditioning, Air Conditioning Contractors, Air Conditioning Repair",,,,,A+,,,https://www.bbb.org/us/ca/benicia/profile/heating-and-air-conditioning/c-d-mechanical-inc-1116-960005,BBB
"C Watkins Construction, LLC",(925) 239-5694,1440 Broadway Ste 200,Oakland,CA,94612,,,"General Contractor, Building Contractors, Construction",,,,,A,,,https://www.bbb.org/us/ca/oakland/profile/general-contractor/c-watkins-construction-llc-1116-968749,BBB
CA Attic Solutions Inc,(408) 444-4455,380 Enterprise Pl # 101,Tracy,CA,95304,,,"Insulation Contractors, Heating and Air Conditioning, Air Conditioning Contractors",,,,,A,,,https://www.bbb.org/us/ca/tracy/profile/insulation-contractors/ca-attic-solutions-inc-1156-90101990,BBB
CABSHeating& Air Conditioning,(916) 905-1287,950 Riverside Pkwy Ste 70,W Sacramento,CA,95605,,,"Heating and Air Conditioning, Plumber, Electrician",,,,,A+,,,https://www.bbb.org/us/ca/w-sacramento/profile/heating-and-air-conditioning/cabs-heating-air-conditioning-1156-90062122,BBB
Cal Comfort,(510) 377-5662,Richmond,Oakland,CA,,,,"Heating and Air Conditioning, Air Conditioning Contractors, Air Duct Cleaning",,,,,A+,,,https://www.bbb.org/us/ca/richmond/profile/heating-and-air-conditioning/cal-comfort-1116-119143,BBB
Cal-StateHVAC,(650) 342-5556,San Mateo,Oakland,CA,,,,"Heating Contractors, Heating and Air Conditioning, Air Conditioning Contractors",,,,,A+,,,https://www.bbb.org/us/ca/san-mateo/profile/heating-contractors/cal-state-hvac-1116-391315,BBB
California Heating and Cooling,(800) 875-9577,1814 Verne Roberts Circle,Antioch,CA,94509,,,"Air Conditioning Contractors, Heating and Air Conditioning, Air Conditioning Repair",,,,,A+,,,https://www.bbb.org/us/ca/antioch/profile/air-conditioning-contractor/california-heating-and-cooling-1116-153269,BBB
Californiair Heating & AirConditioning,(408) 705-8761,San Jose,Oakland,CA,,,,"Heating and Air Conditioning, Air Conditioning Contractors, Air Conditioning Repair",,,,,A+,,,https://www.bbb.org/us/ca/san-jose/profile/heating-and-air-conditioning/californiair-heating-air-conditioning-1216-901575,BBB
CaliforniaPlumbing& RadiantHeatingInc.,(510) 444-3992,2601 Adeline St Ste 199,Oakland,CA,94607,,,Heating and Air Conditioning,,,,,A+,,,https://www.bbb.org/us/ca/oakland/profile/heating-and-air-conditioning/california-plumbing-radiant-heating-inc-1116-945866,BBB
CaliHVAC,(415) 598-8607,1717 Solano Way Ste 2,Clyde,CA,94520,,,"Heating and Air Conditioning, Air Conditioning Contractors, Air Conditioning Repair",,,,,A+,,,https://www.bbb.org/us/ca/clyde/profile/heating-and-air-conditioning/cali-hvac-1116-944188,BBB
CamilleriMechanical,(415) 860-3785,45 Bay Street,San Rafael,CA,94901,,,"Mechanical Contractors, Boiler Repair, Laundry Equipment",,,,,,,,https://www.bbb.org/us/ca/san-rafael/profile/mechanical-contractors/camilleri-mechanical-1116-204126,BBB
Canyon Design Build,(510) 482-0300,3630 Park Blvd,Oakland,CA,94610,,,"Building Contractors, General Contractor, Construction Services",,,,,A+,,,https://www.bbb.org/us/ca/oakland/profile/building-contractors/canyon-design-build-1116-10828,BBB
"Cardenas Custom Builders, Inc.",(650) 892-4304,Hayward,Oakland,CA,,,,"Building Contractors, General Contractor, Remodel Contractors",,,,,A+,,,https://www.bbb.org/us/ca/hayward/profile/building-contractors/cardenas-custom-builders-inc-1116-877874,BBB
"Care Heating & Air Conditioning, Inc.",(510) 798-7944,Oakland,Oakland,CA,,,,"Heating Contractors, Heating and Air Conditioning, Air Conditioning Contractors",,,,,A+,,,https://www.bbb.org/us/ca/oakland/profile/heating-contractors/care-heating-air-conditioning-inc-1116-877009,BBB
Carol Flynn Heating & Cooling,(650) 697-1535,200 Valley Dr Ste 50,Brisbane,CA,94005,,,"Heating Contractors, Air Conditioning Contractors, Air Duct Cleaning",,,,,A+,,,https://www.bbb.org/us/ca/brisbane/profile/heating-contractors/carol-flynn-heating-cooling-1116-62866,BBB
"Cartelli Painting & Waterproofing, Inc.",(510) 527-4707,Berkeley,Oakland,CA,,,,"Painting Contractors, General Contractor, Window Installation",,,,,A+,,,https://www.bbb.org/us/ca/berkeley/profile/painting-contractors/cartelli-painting-waterproofing-inc-1116-214779,BBB
CastilloPlumbingInc.,(415) 410-4313,1534 Belien Ct,Hayward,CA,94544,,,Heating and Air Conditioning,,,,,A+,,,https://www.bbb.org/us/ca/hayward/profile/heating-and-air-conditioning/castillo-plumbing-inc-1116-946245,BBB
Cauich Drywall,(510) 776-1767,San Pablo,Oakland,CA,,,,"Drywall Contractors, General Contractor, Construction Services",,,,,A-,,,https://www.bbb.org/us/ca/san-pablo/profile/drywall-contractors/cauich-drywall-1116-977038,BBB
"CBCMechanical, Inc.",(925) 687-7889,1045 Shary Ct Ste F,Concord,CA,94518,,,"Building Contractors, Plumber, Commercial Air Conditioning Contractors",,,,,,,,https://www.bbb.org/us/ca/concord/profile/building-contractors/cbc-mechanical-inc-1116-34063,BBB
Central Heating & Air Conditioning,(510) 299-7250,Livermore,Oakland,CA,,,,"Heating Contractors, Heating and Air Conditioning, Air Conditioning Contractors",,,,,A+,,,https://www.bbb.org/us/ca/livermore/profile/heating-contractors/central-heating-air-conditioning-1116-81169,BBB
Century Mechanical &Plumbing,(408) 238-5000,2416 Britt Way,San Jose,CA,95148,,,Heating and Air Conditioning,,,,,A+,,,https://www.bbb.org/us/ca/san-jose/profile/heating-and-air-conditioning/century-mechanical-plumbing-1216-1000043125,BBB
"Certified Solar, Heating & Air Conditioning",(925) 406-3718,5040 Commercial Circle,Concord,CA,94520,,,"Heating Contractors, Mechanical Contractors, Air Conditioning Cleaning",,,,,,,,https://www.bbb.org/us/ca/concord/profile/heating-contractors/certified-solar-heating-air-conditioning-1116-875935,BBB
CES-TECH Heating and Cooling,(925) 497-0276,4180 Treat Blvd Ste 103,Concord,CA,94518,,,"Heating and Air Conditioning, Air Conditioning Contractors, Air Conditioning Repair",,,,,A+,,,https://www.bbb.org/us/ca/concord/profile/heating-and-air-conditioning/ces-tech-heating-and-cooling-1116-895279,BBB
Cheng'sMechanicalContractor,(415) 806-3856,4584 James Ave,Castro Valley,CA,94546,,,Heating and Air Conditioning,,,,,A+,,,https://www.bbb.org/us/ca/castro-valley/profile/heating-and-air-conditioning/chengs-mechanical-contractor-1116-944680,BBB
"Chill HubMechanical, LLC",(510) 650-1749,1000 Harness Dr,San Ramon,CA,94583,,,"Air Conditioning Contractors, Air Conditioning Repair, Furnace Repair",,,,,A+,,,https://www.bbb.org/us/ca/san-ramon/profile/air-conditioning-contractor/savvyteks-1116-951485,BBB
ChristianHVAC,(925) 695-4074,Clayton,Oakland,CA,,,,"Heating Contractors, General Contractor, Air Conditioning Contractors",,,,,A+,,,https://www.bbb.org/us/ca/clayton/profile/heating-contractors/christian-hvac-1116-878563,BBB
"Christopher J. Wells,GeneralContractor",(415) 469-7116,100 N Hill Dr Ste 20,Brisbane,CA,94005,,,"General Contractor, Remodel Contractors, Bathroom Design",,,,,A+,,,https://www.bbb.org/us/ca/brisbane/profile/general-contractor/christopher-wells-construction-inc-1116-23237,BBB
Christy Plumbing,(925) 776-4835,Antioch,Oakland,CA,,,,"General Contractor, Plumber, Heating and Air Conditioning",,,,,A+,,,https://www.bbb.org/us/ca/antioch/profile/general-contractor/christy-plumbing-1116-308239,BBB
"CityMechanical, Inc.",(510) 724-9088,1925 Ingalls St,San Francisco,CA,94124,,,"Heating Contractors, Plumber, Air Conditioning Contractors",,,,,B-,,,https://www.bbb.org/us/ca/san-francisco/profile/heating-contractors/city-mechanical-inc-1116-65738/addressId/160300,BBB
"CityWest Construction, Inc.",(415) 279-8860,San Francisco,Oakland,CA,,,,"General Contractor, Remodel Contractors, Commercial Contractors",,,,,A+,,,https://www.bbb.org/us/ca/san-francisco/profile/general-contractor/citywest-construction-inc-1116-896688,BBB
Claycon Developers Corp,(510) 712-5742,66-Franklin Suite 300,Oakland,CA,94607,,,"General Contractor, Remodel Contractors, Building Contractors",,,,,A+,,,https://www.bbb.org/us/ca/oakland/profile/general-contractor/claycon-developers-corp-1116-923895/addressId/191307,BBB
cleanAIRHVAC,(925) 689-7017,428 N Buchanan Cir Ste 1,Pacheco,CA,94553,,,"Heating Contractors, Air Conditioning Contractors, Ventilating Contractors",,,,,A+,,,https://www.bbb.org/us/ca/pacheco/profile/heating-contractors/cleanair-hvac-1116-357427,BBB
"CleanAirHVAC, Inc.",(925) 689-7017,428 N Buchanan Cir Ste 1,Pacheco,CA,94553,,,"Heating Contractors, Air Conditioning Contractors, Ventilating Contractors",,,,,A+,,,https://www.bbb.org/us/ca/pacheco/profile/heating-contractors/cleanair-hvac-1116-357427,BBB
ClimatecareMechanicalService LLC,(510) 244-7566,23314 Cabot Blvd,Hayward,CA,94545,,,Fence Contractors,,,,,A-,,,https://www.bbb.org/us/ca/hayward/profile/fence-contractors/climatecare-mechanical-service-llc-1116-974282,BBB
ClimatechMechanicalSvc,(925) 693-0583,1200 Krona Ln,Concord,CA,94521,,,Air Conditioning Contractors,,,,,,,,https://www.bbb.org/us/ca/concord/profile/air-conditioning-contractor/climatech-mechanical-svc-1116-898094,BBB
CloudMechanicalHeating and Air Conditioning,(650) 312-1416,415 Birch Ave,San Mateo,CA,94402,,,Low Voltage Contractors,,,,,A+,,,https://www.bbb.org/us/ca/san-mateo/profile/low-voltage-contractors/cloud-mechanical-heating-and-air-conditioning-1116-974073,BBB
CollinsPlumbing,(510) 654-5793,4875 Harbord Dr,Oakland,CA,94618,,,Heating and Air Conditioning,,,,,A+,,,https://www.bbb.org/us/ca/oakland/profile/heating-and-air-conditioning/collins-plumbing-1116-946421,BBB
ColvinMechanicalInc,(650) 281-7078,343 Grand Blvd # 4,Half Moon Bay,CA,94019,,,Mechanical Contractors,,,,,,,,https://www.bbb.org/us/ca/half-moon-bay/profile/mechanical-contractors/colvin-mechanical-inc-1116-911386,BBB
Comfort AirMechanicalSystems,(510) 881-6495,1712 Willow St.,Alameda,CA,94501,,,"Heating Contractors, Heating and Air Conditioning, Heating System Repair",,,,,A+,,,https://www.bbb.org/us/ca/alameda/profile/heating-contractors/comfort-air-mechanical-systems-1116-301511,BBB
"Comfort Energy, Inc.",(408) 675-6065,1465 N Milpitas Blvd,Milpitas,CA,95035,,,"Heating and Air Conditioning, Air Conditioning Repair, Heating Contractors",,,,,A+,,,https://www.bbb.org/us/ca/milpitas/profile/heating-and-air-conditioning/comfort-energy-inc-1216-232310,BBB
"Comfort FactorMechanical, Inc.",(707) 775-8117,Sebastopol,Oakland,CA,,,,"Air Conditioning Contractors, Heating and Air Conditioning, Air Conditioning Repair",,,,,A-,,,https://www.bbb.org/us/ca/sebastopol/profile/air-conditioning-contractor/comfort-factor-mechanical-inc-1116-970735,BBB
Comfort Home Heating & Air Conditioning,(510) 837-1620,San Pablo,Oakland,CA,,,,"Residential Air Conditioning Contractors, Heating and Air Conditioning, Air Conditioning Contractors",,,,,A,,,https://www.bbb.org/us/ca/san-pablo/profile/residential-air-conditioning-contractors/comfort-home-heating-air-conditioning-1116-964391,BBB
