name,phone,address,city,state,zip_code,email,website,category,license_number,license_type,license_expiry,types_of_work,bbb_rating,google_rating,review_count,bbb_profile_url,source,is_new_to_db
Chadds Ford Climate Control Inc.,(610) 388-9333,144 Fairville Rd,Chadds Ford,PA,19317,,,"Heating and Air Conditioning, Plumber, Air Conditioning Contractors",,,,,A,,,https://www.bbb.org/us/pa/chadds-ford/profile/heating-and-air-conditioning/chadds-ford-climate-control-inc-0241-144639989/addressId/219507,BBB,yes
"Chadds Ford Complete Services, LLC",(484) 770-8261,402A N Mill Rd,Kennett Sq,PA,19348,,,"Heating and Air Conditioning, Plumbing and Heating",,,,,A+,,,https://www.bbb.org/us/pa/kennett-sq/profile/heating-and-air-conditioning/chadds-ford-complete-services-llc-0241-236044725,BBB,yes
"Charles B. Gans Plumbing, Heating & Cooling, Incorporated",(610) 853-1628,2418 Grasslyn Ave,Havertown,PA,19083,,,"Heating and Air Conditioning, Plumber",,,,,A+,,,https://www.bbb.org/us/pa/havertown/profile/heating-and-air-conditioning/charles-b-gans-plumbing-heating-cooling-incorporated-0241-68000064,BBB,yes
Chesapeake Home Services,(302) 732-6002,115 S 6th St,Odessa,DE,19730,,,"Heating and Air Conditioning, Plumber, Air Conditioning Contractors",,,,,A+,,,https://www.bbb.org/us/de/odessa/profile/heating-and-air-conditioning/chesapeake-home-services-0251-92001150/addressId/47263,BBB,yes
"Christian Heating, Cooling, Plumbing, & Electrical LLC",(484) 202-3473,252 N Radnor Chester Road Suite 2F,Villanova,PA,19085,,,"Air Conditioning Contractors, Heating and Air Conditioning, Electrical Contractors",,,,,A+,,,https://www.bbb.org/us/pa/villanova/profile/air-conditioning-contractor/christian-heating-cooling-plumbing-electrical-llc-0241-80017190/addressId/373497,BBB,yes
"Christian Heating, Cooling, Plumbing, & Electrical LLC",(215) 774-6582,54 E Oakland Ave Ste 1A,Doylestown,PA,18901,,,"Air Conditioning Contractors, Heating and Air Conditioning, Electrical Contractors",,,,,A+,,,https://www.bbb.org/us/pa/doylestown/profile/air-conditioning-contractor/christian-heating-cooling-plumbing-electrical-llc-0241-80017190/addressId/373499,BBB,yes
"Chud-Air Conditioning, Heating, Refrigeration, Co. Inc.",(215) 659-4343,1570 Old York Rd,Abington,PA,19001,,,"Heating and Air Conditioning, Air Conditioning Contractors, Air Duct Cleaning",,,,,A+,,,https://www.bbb.org/us/pa/abington/profile/heating-and-air-conditioning/chud-air-conditioning-heating-refrigeration-co-inc-0241-80002701,BBB,yes
"City Plumbing, LLC",(215) 470-3638,3383 Miller St,Philadelphia,PA,19134,,,"Commercial Plumber, Plumber, Air Conditioning Contractors",,,,,A+,,,https://www.bbb.org/us/pa/philadelphia/profile/commercial-plumber/city-plumbing-llc-0241-236029661,BBB,yes
CLA Mechanical LLC,(267) 832-6242,74 Redwood Dr,Richboro,PA,18954,,,"Heating and Air Conditioning, Mechanical Contractors",,,,,A,,,https://www.bbb.org/us/pa/richboro/profile/heating-and-air-conditioning/cla-mechanical-llc-0241-236089185,BBB,yes
Climico,(610) 532-8745,3 Industrial Hwy Ste 210,Essington,PA,19029,,,"Commercial Air Conditioning Contractors, Heating and Air Conditioning",,,,,A+,,,https://www.bbb.org/us/pa/essington/profile/commercial-air-conditioning-contractors/climico-0241-236053594,BBB,yes
"Clyde S. Walton, Incorporated",(215) 855-6893,PO Box 1669,Lansdale,PA,19446,,,"Heating and Air Conditioning, Air Conditioning Contractors, Heating Contractors",,,,,A+,,,https://www.bbb.org/us/pa/lansdale/profile/heating-and-air-conditioning/clyde-s-walton-incorporated-0241-80001679,BBB,yes
Colonial Construction Co. Inc.,(302) 994-5705,126 Middleboro Rd,Wilmington,DE,19804,,,"Home Builders, Roofing Contractors, General Contractor",,,,,A+,,,https://www.bbb.org/us/de/wilmington/profile/home-builders/colonial-construction-co-inc-0251-21000406,BBB,yes
"Commercial Kitchen Ventilation, Inc.",(484) 823-5039,315 W Germantown Pike,Norristown,PA,19403,,,"Air conditioning & Heating Contractors - Commercial, Commercial Kitchen Renovations",,,,,A+,,,https://www.bbb.org/us/pa/norristown/profile/air-conditioning-heating-contractors-commercial/commercial-kitchen-ventilation-inc-0241-236092749,BBB,yes
"Condino Heating & Air Conditioning, Inc.",(215) 468-8116,2032 S Percy St,Philadelphia,PA,19148,,,Heating and Air Conditioning,,,,,A+,,,https://www.bbb.org/us/pa/philadelphia/profile/heating-and-air-conditioning/condino-heating-air-conditioning-inc-0241-80015725/addressId/111525,BBB,yes
Core Mechanical Contracting,(856) 665-0636,7905 Browning Road,Merchantville,NJ,08109,,,Mechanical Contractors,,,,,,,,https://www.bbb.org/us/nj/merchantville/profile/mechanical-contractors/core-mechanical-contracting-0221-24004381,BBB,yes
Custom Aire Inc,(215) 638-1800,962 Bristol Pike,Bensalem,PA,19020,,,"Heating and Air Conditioning, Duct Cleaning, Heat Pumps",,,,,A+,,,https://www.bbb.org/us/pa/bensalem/profile/heating-and-air-conditioning/custom-aire-inc-0241-80001203,BBB,yes
"D & B Mechanical , LLC",(302) 722-0471,13 Oakknoll Cir,Newark,DE,19711,,,"Heating and Air Conditioning, Air Conditioning Contractors, Residential Air Conditioning Contractors",,,,,A+,,,https://www.bbb.org/us/de/newark/profile/heating-and-air-conditioning/d-b-mechanical-llc-0251-32003780,BBB,yes
D Mechanical Services LLC,(856) 767-3145,242 Mill Rd,Marlton,NJ,08053,,,Heating and Air Conditioning,,,,,A+,,,https://www.bbb.org/us/nj/marlton/profile/heating-and-air-conditioning/d-mechanical-services-llc-0221-90147252,BBB,yes
D&D Mechanical,(203) 493-4400,East Haven,Philadelphia,PA,,,,"Air Conditioning Repair, Heating and Air Conditioning, Air Conditioning Contractors",,,,,A,,,https://www.bbb.org/us/ct/east-haven/profile/air-conditioning-repair/dd-mechanical-0111-110095314,BBB,yes
D&L Custom Services,(856) 755-1348,600 Deer Rd Ste 5,Cherry Hill,NJ,08034,,,"Heating and Air Conditioning, Residential Air Conditioning Contractors, Geothermal Heat Pumps",,,,,A+,,,https://www.bbb.org/us/nj/cherry-hill/profile/heating-and-air-conditioning/dl-custom-services-0221-90153392,BBB,yes
D'Amato IncPlumbingHeating&Cooling,(856) 794-8108,Vineland,Philadelphia,PA,,,,"Plumber, Plumbing and Heating",,,,,A+,,,https://www.bbb.org/us/nj/vineland/profile/plumber/damato-inc-plumbing-heating-cooling-0221-80004975,BBB,yes
D'Amato IncPlumbingHeating&Cooling,(856) 794-8625,3009 Country Ln,Vineland,NJ,08361,,,"Plumber, Plumbing and Heating",,,,,A+,,,https://www.bbb.org/us/nj/vineland/profile/plumber/damato-inc-plumbing-heating-cooling-0221-80004975/addressId/42993,BBB,yes
"Dalton Electric,Plumbing,Heating&CoolingCo. Inc.",(732) 247-7389,New Brunswick,Philadelphia,PA,,,,"Electrician, Plumber, Heating and Air Conditioning",,,,,A+,,,https://www.bbb.org/us/nj/new-brunswick/profile/electrician/dalton-electric-plumbing-heating-cooling-co-inc-0221-27002715,BBB,yes
Dan Bernoski First Class Plumbing & Heating LLC,(609) 771-0663,134 Palmer Lane,Trenton,NJ,08618,,,"Plumber, General Contractor, Construction Services",,,,,A+,,,https://www.bbb.org/us/nj/trenton/profile/plumber/dan-bernoski-first-class-plumbing-heating-llc-0221-27003459,BBB,yes
Davis Heating and Air LLC,(856) 223-7973,1916 Old Cuthbert Rd Ste B21,Cherry Hill,NJ,08034,,,Heating and Air Conditioning,,,,,A+,,,https://www.bbb.org/us/nj/cherry-hill/profile/heating-and-air-conditioning/davis-heating-and-air-llc-0221-90169930,BBB,yes
Deck Masters LLC,(302) 307-3451,536 Dawson Tract Rd,Yorklyn,DE,19736,,,"Deck Builder, General Contractor, Construction Services",,,,,A+,,,https://www.bbb.org/us/de/yorklyn/profile/deck-builder/deck-masters-llc-0251-27000816/addressId/24603,BBB,yes
Delfera Heating & Cooling Company,(610) 494-1114,3581 Concord Rd,Aston,PA,19014,,,"Heating and Air Conditioning, Heating Contractors",,,,,A+,,,https://www.bbb.org/us/pa/aston/profile/heating-and-air-conditioning/delfera-heating-cooling-company-0241-142428014,BBB,yes
Denis Contractors Services LLC,(609) 372-6350,Trenton,Philadelphia,PA,,,,"General Contractor, Landscape Contractors",,,,,A+,,,https://www.bbb.org/us/nj/trenton/profile/general-contractor/denis-contractors-services-llc-0221-90222067,BBB,yes
DeSantis Mechanical Services Inc.,(215) 454-6968,1628 S Clarion St,Philadelphia,PA,19148,,,Mechanical Insulation Contractors,,,,,A+,,,https://www.bbb.org/us/pa/philadelphia/profile/mechanical-insulation-contractors/desantis-mechanical-services-inc-0241-236023275,BBB,yes
Design A Castle Remodelers LLC,(856) 985-8554,1410 Piccard Ct,Deptford,NJ,08096,,,"Siding Contractors, Roofing Contractors, General Contractor",,,,,A+,,,https://www.bbb.org/us/nj/deptford/profile/siding-contractors/design-a-castle-remodelers-llc-0221-80001187/addressId/91000,BBB,yes
Desmond Heating & Cooling Solutions LLC,(888) 777-8310,1803 E Tulpehocken St,Philadelphia,PA,19138,,,Heating and Air Conditioning,,,,,A+,,,https://www.bbb.org/us/pa/philadelphia/profile/heating-and-air-conditioning/desmond-heating-cooling-solutions-llc-0241-236080759,BBB,yes
DeVito's Heating & Air,(856) 939-4609,592 Sherrington Ln,Runnemede,NJ,08078,,,"Heating and Air Conditioning, Heating Contractors, Dryer Vent Cleaning",,,,,A+,,,https://www.bbb.org/us/nj/runnemede/profile/heating-and-air-conditioning/devitos-heating-air-0221-27001824,BBB,yes
DeWalt Manufacturing Company Inc.,(856) 423-1207,88 W Cohawkin Rd,Clarksboro,NJ,08020,,,"Machine Shop, Mechanical Contractors",,,,,A+,,,https://www.bbb.org/us/nj/clarksboro/profile/machine-shop/dewalt-manufacturing-company-inc-0221-90125128,BBB,yes
"DiFiore Builders, Inc",(610) 358-5433,20 Whitetail Dr,Chadds Ford,PA,19317,,,"General Contractor, Roofing Contractors, Home Improvement",,,,,A+,,,https://www.bbb.org/us/pa/chadds-ford/profile/general-contractor/difiore-builders-inc-0241-191952896,BBB,yes
Disaster Solutions Inc.,(215) 499-6122,32 Maple St,Conshohocken,PA,19428,,,"Fire and Water Damage Restoration, Water Damage Restoration, Mold Remediation",,,,,A+,,,https://www.bbb.org/us/pa/conshohocken/profile/fire-water-damage-restoration/disaster-solutions-inc--0241-236042625/addressId/297046,BBB,yes
Done Right Today Inc.,(302) 364-0579,19 Germay Dr,Wilmington,DE,19804,,,"Plumber, Heating and Air Conditioning, Air Conditioning Contractors",,,,,A+,,,https://www.bbb.org/us/de/wilmington/profile/plumber/done-right-today-inc-0251-92007207,BBB,yes
Donnelly Heating & Air Conditioning,(610) 399-9083,242 Green Tree Dr,West Chester,PA,19382,,,"Heating and Air Conditioning, Heating Contractors",,,,,A+,,,https://www.bbb.org/us/pa/west-chester/profile/heating-and-air-conditioning/donnelly-heating-air-conditioning-0241-185523738,BBB,yes
Donnelly's Plumbing Heating and Cooling,(215) 631-8391,1 Innovation Dr,Plymouth Meeting,PA,19462,,,"Plumber, Heating and Air Conditioning, Air Conditioning Contractors",,,,,A+,,,https://www.bbb.org/us/pa/plymouth-meeting/profile/plumber/donnellys-plumbing-heating-and-cooling-0241-80001677,BBB,yes
Dowd Heating & Air Conditioning,(215) 752-3638,2515 Easton Rd,Hatboro,PA,19040,,,Heating and Air Conditioning,,,,,A+,,,https://www.bbb.org/us/pa/hatboro/profile/heating-and-air-conditioning/dowd-heating-air-conditioning-0241-80004314/addressId/379234,BBB,yes
Dragon Construction,(215) 989-5256,235 Mountain St,Philadelphia,PA,19148,,,"Construction Services, General Contractor, Home Improvement",,,,,A+,,,https://www.bbb.org/us/pa/philadelphia/profile/construction-services/dragon-construction-0241-235982878,BBB,yes
DRB Development LLC,(609) 634-5790,24 Minnetonka Trail,Medford,NJ,08055,,,"General Contractor, Carpenter, Framing Contractors",,,,,A+,,,https://www.bbb.org/us/nj/medford/profile/general-contractor/drb-development-llc-0221-90186721,BBB,yes
"Dream Team - Plumbing, Heating, Cooling, & Electric",(610) 477-8226,436 S Lansdowne Ave,Lansdowne,PA,19050,,,"Electrician, Plumber, Heating and Air Conditioning",,,,,A+,,,https://www.bbb.org/us/pa/lansdowne/profile/electrician/dream-team-plumbing-heating-cooling-electric-0241-185521468,BBB,yes
DVRT Mechanical,(215) 345-6530,108 W Butler Ave # 1,New Britain,PA,18901,,,Mechanical Contractors,,,,,A+,,,https://www.bbb.org/us/pa/new-britain/profile/mechanical-contractors/dvrt-mechanical-0241-152755400,BBB,yes
DWDMechanicalContractors,(610) 328-0820,1005 Kedron Ave,Morton,PA,19070,,,Mechanical Contractors,,,,,A+,,,https://www.bbb.org/us/pa/morton/profile/mechanical-contractors/dwd-mechanical-contractors-0241-236001444,BBB,yes
"DzO Mechanical, Inc.",(484) 454-3348,816 W Springfield Rd,Springfield,PA,19064,,,"Mechanical Contractors, Heating and Air Conditioning, Residential Air Conditioning Contractors",,,,,A+,,,https://www.bbb.org/us/pa/springfield/profile/mechanical-contractors/dzo-mechanical-inc-0241-235992583,BBB,yes
D’Auria & SonMechanicalContractors,(856) 257-1092,26 Evergreen Ave,Blackwood,NJ,08012,,,Heating and Air Conditioning,,,,,A+,,,https://www.bbb.org/us/nj/blackwood/profile/heating-and-air-conditioning/dauria-son-mechanical-contractors-0221-90222452,BBB,yes
E&E Independent Contractor Inc,(267) 528-9248,228 Melrose Ave,Lansdowne,PA,19050,,,"General Contractor, Electrician, Flooring Contractors",,,,,A+,,,https://www.bbb.org/us/pa/lansdowne/profile/general-contractor/ee-independent-contractor-inc--0241-236101708,BBB,yes
"E. Earle Downing, Inc.",(302) 656-1290,PO Box 7830,Wilmington,DE,19803,,,"Paving Contractors, General Contractor, Concrete Contractors",,,,,A+,,,https://www.bbb.org/us/de/wilmington/profile/paving-contractors/e-earle-downing-inc-0251-21000453/addressId/58590,BBB,yes
"E. Earle Downing, Inc.",(302) 656-9908,1221 Bowers St Ste 6,Wilmington,DE,19802,,,"Paving Contractors, General Contractor, Concrete Contractors",,,,,A+,,,https://www.bbb.org/us/de/wilmington/profile/paving-contractors/e-earle-downing-inc-0251-21000453,BBB,yes
E. S. Van Ness Mechanical Inc,(484) 707-5578,3502 Scotts Ln Apt 727 Bldg 7,Philadelphia,PA,19129,,,Mechanical Contractors,,,,,A+,,,https://www.bbb.org/us/pa/philadelphia/profile/mechanical-contractors/e-s-van-ness-mechanical-inc-0241-236073313,BBB,yes
ECI Comfort,(215) 245-3200,1115 W Gillam Ave,Langhorne,PA,19047,,,"Heating and Air Conditioning, Fuel Oil",,,,,A+,,,https://www.bbb.org/us/pa/langhorne/profile/heating-and-air-conditioning/eci-comfort-0241-80018439,BBB,yes
Ed Moran Family Construction LLC,(215) 675-4006,1055 Dogwood Rd,Warminster,PA,18974,,,"General Contractor, Remodel Contractors",,,,,A+,,,https://www.bbb.org/us/pa/warminster/profile/general-contractor/ed-moran-family-construction-llc-0241-236092520,BBB,yes
"Eden Comfort Aire Service, Incorporated",(610) 622-1654,8217 Halstead St,Philadelphia,PA,19111,,,"Air Conditioning Contractors, Heating and Air Conditioning, Residential Air Conditioning Contractors",,,,,A+,,,https://www.bbb.org/us/pa/philadelphia/profile/air-conditioning-contractor/eden-comfort-aire-service-incorporated-0241-235985454,BBB,yes
"Edward Powell Pump & Well Drilling, Inc.",(610) 558-3527,17B Mount Pleasant Road,Aston,PA,19014,,,"Drilling Contractor, Water Well Drilling, Geothermal Heat Pumps",,,,,A+,,,https://www.bbb.org/us/pa/aston/profile/drilling-contractor/edward-powell-pump-well-drilling-inc-0241-100855379,BBB,yes
"Edward R. Woods & Company, Inc.",(609) 883-6811,PO Box 7248,West Trenton,NJ,08628,,,Mechanical Contractors,,,,,,,,https://www.bbb.org/us/nj/west-trenton/profile/mechanical-contractors/edward-r-woods-company-inc-0221-90076886,BBB,yes
EGM Construction,(610) 558-9828,19 Marshall Rd,Glen Mills,PA,19342,,,"General Contractor, Roofing Contractors, Construction Services",,,,,A+,,,https://www.bbb.org/us/pa/glen-mills/profile/general-contractor/egm-construction-0241-151610527,BBB,yes
"Eiseman Construction Co., Inc.",(215) 345-9135,110 S Sand Rd,New Britain,PA,18901,,,"Roofing Contractors, General Contractor",,,,,A+,,,https://www.bbb.org/us/pa/new-britain/profile/roofing-contractors/eiseman-construction-co-inc-0241-80001084,BBB,yes
Electrical &MechanicalContractorsLLC,(856) 672-0707,517 Clements Bridge Rd,Barrington,NJ,08007,,,"Electrician, Mechanical Contractors",,,,,A+,,,https://www.bbb.org/us/nj/barrington/profile/electrician/led-electrical-mechanical-contractors-llc-0221-90037717,BBB,yes
Engel Air Conditioning and Heating,(215) 364-3533,518 Hazel Ave,Fstrvl Trvose,PA,19053,,,"Heating and Air Conditioning, Air Conditioning Contractors, Air Conditioning Repair",,,,,A+,,,https://www.bbb.org/us/pa/fstrvl-trvose/profile/heating-and-air-conditioning/engel-air-conditioning-and-heating-0241-80001520,BBB,yes
"Engineered Energy Solutions, Inc.",(908) 252-3800,16 Mount Bethel Rd PMB 336,Warren,NJ,07059,,,"Control Systems, Mechanical Contractors",,,,,A+,,,https://www.bbb.org/us/nj/warren/profile/control-systems/engineered-energy-solutions-inc-0221-90225027,BBB,yes
"Essential Heating & Air, LLC",(856) 787-0007,13 Sheffield Lane,Mount Laurel,NJ,08054,,,"Heating and Air Conditioning, Air Conditioning Contractors, Residential Air Conditioning Contractors",,,,,A+,,,https://www.bbb.org/us/nj/mount-laurel/profile/heating-and-air-conditioning/essential-heating-air-llc-0221-90182435,BBB,yes
Essig Plumbing & Heating,(610) 373-8391,448 Snyder Rd,Reading,PA,19605,,,"Plumber, Heating and Air Conditioning, Home Improvement",,,,,A+,,,https://www.bbb.org/us/pa/reading/profile/plumber/essig-plumbing-heating-0241-50006489,BBB,yes
"Excalibur Home Remodeling & Restorations, Inc.",(267) 634-1783,93 Old York Rd Ste 1-758,Jenkintown,PA,19046,,,"Fire and Water Damage Restoration, General Contractor, Construction Services",,,,,A+,,,https://www.bbb.org/us/pa/jenkintown/profile/fire-water-damage-restoration/excalibur-home-remodeling-restorations-inc-0241-236004506/addressId/266519,BBB,yes
Extreme Plumbing & Heating Corporation,(215) 878-0638,1449 W End Dr,Philadelphia,PA,19151,,,"Plumber, Heating Contractors, Boiler Repair",,,,,A+,,,https://www.bbb.org/us/pa/philadelphia/profile/plumber/extreme-plumbing-heating-corporation-0241-201643676,BBB,yes
"Family Heating & Air Conditioning, Inc.",(215) 377-9090,873 Township Line Rd,Elkins Park,PA,19027,,,"Heating and Air Conditioning, Heating Contractors",,,,,A+,,,https://www.bbb.org/us/pa/elkins-park/profile/heating-and-air-conditioning/family-heating-air-conditioning-inc-0241-236023344,BBB,yes
"Fante's Heating, Cooling, Plumbing & Electrical",(609) 835-1512,35 Charleston Rd,Willingboro,NJ,08046,,,"Heating and Air Conditioning, Plumber, Air Conditioning Contractors",,,,,A+,,,https://www.bbb.org/us/nj/willingboro/profile/heating-and-air-conditioning/fantes-heating-cooling-plumbing-electrical-0221-80007426,BBB,yes
"Fante's Plumbing,Heating&AirConditioning",(609) 835-1512,35 Charleston Rd,Willingboro,NJ,08046,,,"Heating and Air Conditioning, Plumber, Air Conditioning Contractors",,,,,A+,,,https://www.bbb.org/us/nj/willingboro/profile/heating-and-air-conditioning/fantes-heating-cooling-plumbing-electrical-0221-80007426,BBB,yes
Fast Tech Heating & Air LLC,(609) 668-3668,904 Park Ave E,Hainesport,NJ,08036,,,"Heating Contractors, Heating and Air Conditioning, Air Conditioning Contractors",,,,,A+,,,https://www.bbb.org/us/nj/hainesport/profile/heating-contractors/fast-tech-heating-air-llc-0221-90183802,BBB,yes
Father & Daughters Home Services LLC,,6 Balwyn Pl,Bala Cynwyd,PA,19004,,,"General Contractor, Construction Services, Home Improvement",,,,,A+,,,https://www.bbb.org/us/pa/bala-cynwyd/profile/general-contractor/father-daughters-home-services-llc-0241-80005629,BBB,yes
"Fayda Engineering & Energy Solutions, LLC",(302) 999-1060,801 W Newport Pike,Wilmington,DE,19804,,,"Engineering Consultant, Commercial Contractors, Mechanical Contractors",,,,,A+,,,https://www.bbb.org/us/de/wilmington/profile/engineering-consultant/fayda-engineering-energy-solutions-llc-0251-32002583,BBB,yes
"FedaleGeneralContractors, LLC",(215) 567-7663,1454 Bethlehem Pike,North Wales,PA,19454,,,"Roofing Contractors, Siding Contractors, Gutters",,,,,A-,,,https://www.bbb.org/us/pa/north-wales/profile/roofing-contractors/g-fedale-roofing-siding-0241-235998842,BBB,yes
Fidelity Mechanical Services,(410) 771-9400,25 Loveton Cir,Sparks Glencoe,MD,21152,,,"Mechanical Contractors, Contractors Equipment",,,,,A+,,,https://www.bbb.org/us/md/sparks-glencoe/profile/mechanical-contractors/fidelity-mechanical-services-0011-90175723,BBB,yes
Fire & Ice Mechanical Services Inc.,(856) 742-8868,518 Ridgeway St,Gloucester Cy,NJ,08030,,,"Mechanical Contractors, Heating and Air Conditioning, Heating Contractors",,,,,F,,,https://www.bbb.org/us/nj/gloucester-cy/profile/mechanical-contractors/fire-ice-mechanical-services-inc-0221-90167347,BBB,yes
"FJN Construction, LLC",(215) 943-1184,369 Indian Creek Dr,Levittown,PA,19057,,,"General Contractor, Roofing Contractors, Concrete Contractors",,,,,A+,,,https://www.bbb.org/us/pa/levittown/profile/general-contractor/fjn-construction-llc-0241-236044605,BBB,yes
Fletcher Brothers Roofing & Siding,(856) 667-3933,Maple Shade,Philadelphia,PA,,,,"Roofing Contractors, General Contractor, Siding Contractors",,,,,A+,,,https://www.bbb.org/us/nj/maple-shade/profile/roofing-contractors/fletcher-brothers-roofing-siding-0221-80008672,BBB,yes
"Fortitude Solutions, LLC",(302) 723-4556,1207 Delaware Ave Unit 3434,Wilmington,DE,19806,,,"General Contractor, Painting Contractors, Handyman",,,,,A+,,,https://www.bbb.org/us/de/wilmington/profile/general-contractor/fortitude-solutions-llc-0251-92034990,BBB,yes
"Foundation Experts, LLC",(800) 497-5219,7816 Verree Rd,Philadelphia,PA,19111,,,"Foundation Contractors, Mason Contractors, Home Inspections",,,,,A+,,,https://www.bbb.org/us/pa/philadelphia/profile/foundation-contractors/foundation-experts-llc-0241-235991584/addressId/265860,BBB,yes
Frank Summerill,(610) 277-2555,115 Valley View Rd,Norristown,PA,19401,,,"Asphalt Repair, General Contractor, Concrete Contractors",,,,,A+,,,https://www.bbb.org/us/pa/norristown/profile/asphalt-repair/frank-summerill-0241-80000066,BBB,yes
Fras-Air/General Service Experts,(908) 526-5088,178C Route 206 Ste E,Hillsborough,NJ,08844,,,"Heating and Air Conditioning, Plumber, Air Conditioning Contractors",,,,,A+,,,https://www.bbb.org/us/nj/hillsborough/profile/heating-and-air-conditioning/fras-airgeneral-service-experts-0221-12000127/addressId/125963,BBB,yes
"Freedom Cooling & Heating, LLC",(215) 355-1893,340 Andrews Rd Ste C,Fstrvl Trvose,PA,19053,,,"Heating and Air Conditioning, Air Conditioning Contractors, Heating Contractors",,,,,A+,,,https://www.bbb.org/us/pa/fstrvl-trvose/profile/heating-and-air-conditioning/freedom-cooling-heating-llc-0241-131726256,BBB,yes
"Freedom Home Improvements & General Contracting, Inc.",(215) 794-0326,5294 Long Lane,Doylestown,PA,18902,,,"General Contractor, Remodel Contractors, Commercial Contractors",,,,,A+,,,https://www.bbb.org/us/pa/doylestown/profile/general-contractor/freedom-home-improvements-general-contracting-inc-0241-80004690,BBB,yes
Fresh Air Flow HVAC Inc.,(856) 856-4223,2070 Springdale Rd Ste 200,Cherry Hill,NJ,08003,,,Heating and Air Conditioning,,,,,A+,,,https://www.bbb.org/us/nj/cherry-hill/profile/heating-and-air-conditioning/fresh-air-flow-hvac-inc-0221-90207941,BBB,yes
Furness Electrical Engineers and Contractors,(302) 764-6030,1604 Todds Ln,Wilmington,DE,19802,,,"Electrician, Electrical Contractors, Commercial Electrician",,,,,A+,,,https://www.bbb.org/us/de/wilmington/profile/electrician/furness-electrical-engineers-and-contractors-0251-2142010,BBB,yes
Furness Electrical Engineers and Contractors,(302) 764-5168,PO Box 1186,Wilmington,DE,19899,,,"Electrician, Electrical Contractors, Commercial Electrician",,,,,A+,,,https://www.bbb.org/us/de/wilmington/profile/electrician/furness-electrical-engineers-and-contractors-0251-2142010/addressId/3095,BBB,yes
"G & GMechanicalContractors, Inc.",(856) 931-9231,Bellmawr,Philadelphia,PA,,,,Heating and Air Conditioning,,,,,A+,,,https://www.bbb.org/us/nj/bellmawr/profile/heating-and-air-conditioning/g-g-mechanical-contractors-inc-0221-90236583,BBB,yes
G & S Enhancements,(609) 937-3696,213 Petticoat Bridge Rd,Columbus,NJ,08022,,,Mechanical Contractors,,,,,,,,https://www.bbb.org/us/nj/columbus/profile/mechanical-contractors/g-s-enhancements-0221-90169579,BBB,yes
"GansPlumbing,Heating&Cooling, Incorporated",(610) 853-1628,2418 Grasslyn Ave,Havertown,PA,19083,,,"Heating and Air Conditioning, Plumber",,,,,A+,,,https://www.bbb.org/us/pa/havertown/profile/heating-and-air-conditioning/charles-b-gans-plumbing-heating-cooling-incorporated-0241-68000064,BBB,yes
"Garry's Plumbing, Heating & Mechanical",(215) 546-1509,1700 Webster St,Philadelphia,PA,19146,,,"Heating Contractors, Plumber, Mechanical Contractors",,,,,A+,,,https://www.bbb.org/us/pa/philadelphia/profile/heating-contractors/garrys-plumbing-heating-mechanical-0241-172759946,BBB,yes
Gartland's Plumbing & Heating,(610) 565-5645,204 Bortondale Rd,Media,PA,19063,,,"Plumber, Heating and Air Conditioning",,,,,A+,,,https://www.bbb.org/us/pa/media/profile/plumber/gartlands-plumbing-heating-0241-80010341,BBB,yes
GEN3 Electric & HVAC,(215) 512-4102,4117 Pine St,Phila,PA,19104,,,"Electrician, Heating and Air Conditioning",,,,,A+,,,https://www.bbb.org/us/pa/phila/profile/electrician/gen3-electric-hvac--0241-154123290/addressId/118207,BBB,yes
George Marko Electrical Contractor LLC,(609) 730-3944,Trenton,Philadelphia,PA,,,,"Electrician, Electrical Contractors, Smoke Alarm Systems",,,,,A+,,,https://www.bbb.org/us/nj/trenton/profile/electrician/george-marko-electrical-contractor-llc-0221-90162465,BBB,yes
George R. Coulter Plumbing,(856) 753-9871,430 Cooper Rd,West Berlin,NJ,08091,,,"Plumber, Heating Contractors, Plumbing and Heating",,,,,A+,,,https://www.bbb.org/us/nj/west-berlin/profile/plumber/george-r-coulter-plumbing-0221-90016759,BBB,yes
Giant Mechanical Systems LLC,(516) 882-7254,Amityville,Philadelphia,PA,,,,Mechanical Contractors,,,,,A+,,,https://www.bbb.org/us/ny/amityville/profile/mechanical-contractors/giant-mechanical-systems-llc-0121-108932,BBB,yes
