name,phone,address,city,state,zip_code,email,website,category,license_number,license_type,license_expiry,types_of_work,bbb_rating,google_rating,review_count,bbb_profile_url,source
"DC Refrigeration Technologies, LLC",(913) 347-5442,Independence,Centerville,IA,,,,"Heating and Air Conditioning, Air Conditioning Contractors, Air Conditioning Repair",,,,,A+,,,https://www.bbb.org/us/mo/independence/profile/heating-and-air-conditioning/dc-refrigeration-technologies-llc-0714-1000028538,BBB
Deck Stars,(402) 968-2629,Omaha,Waukee,IA,,,,"Deck Builder, General Contractor, Fence Contractors",,,,,A+,,,https://www.bbb.org/us/ne/omaha/profile/deck-builder/deck-stars-0714-1000059461,BBB
Deer ValleyMechanicalInc,(712) 221-1710,115 W Cedar,Cherokee,IA,51012,,,Excavating Contractors,,,,,A+,,,https://www.bbb.org/us/ia/cherokee/profile/excavating-contractors/deer-valley-mechanical-inc-0664-32058536,BBB
Deml Heating & Air Conditioning LLC,(507) 451-6388,1500 E Main St,Owatonna,MN,55060,,,"Heating and Air Conditioning, Air Quality Services",,,,,A+,,,https://www.bbb.org/us/mn/owatonna/profile/heating-and-air-conditioning/deml-heating-air-conditioning-llc-0704-96151940,BBB
DemmerMechanical,(563) 875-8544,521 5th St NW,Dyersville,IA,52040,,,Air Conditioning Contractors,,,,,,,,https://www.bbb.org/us/ia/dyersville/profile/air-conditioning-contractor/demmer-mechanical-0664-32078577,BBB
Dennis Supply Company,(515) 244-1105,319 New York Ave,Des Moines,IA,50313,,,"Refrigeration Equipment, Building Contractors, Air Conditioning Parts",,,,,A+,,,https://www.bbb.org/us/ia/des-moines/profile/refrigeration-equipment/dennis-supply-company-0664-103174,BBB
DeremiahPlumbing&Heating,(515) 210-5177,1070 45th St,Des Moines,IA,50311,,,Heating and Air Conditioning,,,,,,,,https://www.bbb.org/us/ia/des-moines/profile/heating-and-air-conditioning/deremiah-plumbing-heating-0664-17000476,BBB
Des Moines Comfort Inc,(515) 266-4660,2703 E Grand Ave,Des Moines,IA,50317,,,"Heating and Air Conditioning, Heating Contractors",,,,,A+,,,https://www.bbb.org/us/ia/des-moines/profile/heating-and-air-conditioning/des-moines-comfort-inc-0664-32014119,BBB
Des Moines Excavating LLC,(515) 471-3333,10540 Hickman Rd STE D,Clive,IA,50325,,,"Excavating Contractors, Heating and Air Conditioning, Residential Air Conditioning Contractors",,,,,A+,,,https://www.bbb.org/us/ia/clive/profile/excavating-contractors/des-moines-excavating-llc-0664-32105758,BBB
Des Moines Heating and Cooling,(515) 282-7086,1034 Army Post Rd,Des Moines,IA,50315,,,"Residential Air Conditioning Contractors, Heating Contractors, Commercial Air Conditioning Contractors",,,,,A+,,,https://www.bbb.org/us/ia/des-moines/profile/residential-air-conditioning-contractors/des-moines-heating-and-cooling-0664-32039423,BBB
"Diamond Pavon Construction, LLC",(660) 292-0923,Milan,Des Moines,IA,,,,"General Contractor, Fence Contractors, Home Improvement",,,,,A+,,,https://www.bbb.org/us/mo/milan/profile/general-contractor/diamond-pavon-construction-llc-0714-1000061448,BBB
Dickerson Mechanical Inc,(515) 674-3636,129 N West St,Colfax,IA,50054,,,"Mechanical Contractors, Plumber, Electrician",,,,,A+,,,https://www.bbb.org/us/ia/colfax/profile/mechanical-contractors/dickerson-mechanical-inc-0664-18001070,BBB
Dillon Construction LLC,(319) 640-6861,646 Greenfield St NE,Cedar Rapids,IA,52402,,,"General Contractor, Building Contractors, Construction",,,,,A+,,,https://www.bbb.org/us/ia/cedar-rapids/profile/general-contractor/dillon-construction-llc-0664-32135608,BBB
Dinsdale Construction,(319) 231-9193,1965 110th St,Reinbeck,IA,50669,,,"General Contractor, Commercial Contractors",,,,,A+,,,https://www.bbb.org/us/ia/reinbeck/profile/general-contractor/dinsdale-construction-0664-32052603,BBB
Direct Heating and Air,(515) 943-6558,107 Dooley Ct SW,Altoona,IA,50009,,,Heating and Air Conditioning,,,,,A+,,,https://www.bbb.org/us/ia/altoona/profile/heating-and-air-conditioning/direct-heating-and-air-0664-32157287,BBB
DittrichMechanical& Fab,(507) 388-4675,101 Kingswood Rd,Mankato,MN,56001,,,Mechanical Contractors,,,,,,,,https://www.bbb.org/us/mn/mankato/profile/mechanical-contractors/dittrich-mechanical-fab-0704-96133142,BBB
DiversMechanicalLLC,(816) 550-1098,Saint Joseph,Winterset,IA,,,,"Heating and Air Conditioning, Remodel Contractors",,,,,F,,,https://www.bbb.org/us/mo/saint-joseph/profile/heating-and-air-conditioning/divers-mechanical-llc-0714-1000052870,BBB
DLR Construction LLC,(515) 729-0426,109 NW Scott St,Ankeny,IA,50023,,,"General Contractor, Roofing Contractors, Siding Contractors",,,,,A+,,,https://www.bbb.org/us/ia/ankeny/profile/general-contractor/dlr-construction-llc-0664-32135399/addressId/65122,BBB
DLR Construction LLC,(515) 349-6128,808 SW Cherry St Ste 104,Ankeny,IA,50023,,,"General Contractor, Roofing Contractors, Siding Contractors",,,,,A+,,,https://www.bbb.org/us/ia/ankeny/profile/general-contractor/dlr-construction-llc-0664-32135399,BBB
"DML Construction Services, LLC",(515) 202-5021,752 NE Broadway Ave,Des Moines,IA,50313,,,"General Contractor, Construction Services, Concrete Contractors",,,,,A+,,,https://www.bbb.org/us/ia/des-moines/profile/general-contractor/dml-construction-services-llc-0664-32053424/addressId/21560,BBB
DocHandy's,(816) 527-5309,Raytown,Centerville,IA,,,,"Heating and Air Conditioning, Home Improvement, Air Conditioning Contractors",,,,,A+,,,https://www.bbb.org/us/mo/raytown/profile/heating-and-air-conditioning/dochandys-0714-1000069928,BBB
Domestic Plumbing Co.,(563) 242-0022,716 S 2nd St,Clinton,IA,52732,,,"Plumber, Heating and Air Conditioning, Geothermal Heat Pumps",,,,,A+,,,https://www.bbb.org/us/ia/clinton/profile/plumber/domestic-plumbing-co-0664-32009855,BBB
Don'sHeating&Cooling&Plumbing,(641) 828-8107,714 W Montgomery St,Knoxville,IA,50138,,,Residential Air Conditioning Contractors,,,,,A+,,,https://www.bbb.org/us/ia/knoxville/profile/residential-air-conditioning-contractors/dons-heating-cooling-plumbing-0664-32061317,BBB
"DonnellMechanical& Electrical Contracting, LLC",(816) 547-9019,Raytown,Centerville,IA,,,,"Electrician, Heating and Air Conditioning, Air Conditioning Contractors",,,,,A+,,,https://www.bbb.org/us/mo/raytown/profile/electrician/donnell-mechanical-electrical-contracting-llc-0714-1000069929,BBB
Dorrian Heating & Cooling Inc,(515) 987-4310,25750 U Ave,Waukee,IA,50263,,,"Heating and Air Conditioning, Heating Contractors, Fireplaces",,,,,A+,,,https://www.bbb.org/us/ia/waukee/profile/heating-and-air-conditioning/dorrian-heating-cooling-inc-0664-6000345,BBB
Doug Richards Construction Inc,(515) 253-0393,6419 NW 52nd Ct,Johnston,IA,50131,,,"General Contractor, Construction Services, Home Builders",,,,,A+,,,https://www.bbb.org/us/ia/johnston/profile/general-contractor/doug-richards-construction-inc-0664-29000412,BBB
Dragonfly Mechanical,(816) 377-1400,3004 SW US Highway 40 Ste C,Blue Springs,MO,64015,,,"Heating and Air Conditioning, Plumber, Air Conditioning Contractors",,,,,A+,,,https://www.bbb.org/us/mo/blue-springs/profile/heating-and-air-conditioning/dragonfly-mechanical-0714-1000009634,BBB
Dream Renovations & Construction LLC,(319) 400-9116,Iowa City,Des Moines,IA,,,,"Siding Contractors, Roofing Contractors, General Contractor",,,,,A,,,https://www.bbb.org/us/ia/iowa-city/profile/siding-contractors/dream-renovations-construction-llc-0664-32157850,BBB
Dreams 2 Reality LLC,(515) 782-2944,17615 Meredith Dr,Waukee,IA,50263,,,"General Contractor, Construction Services, Bathroom Remodel",,,,,A+,,,https://www.bbb.org/us/ia/waukee/profile/general-contractor/dreams-2-reality-llc-0664-32053148,BBB
"DreesHeating&Plumbing, Inc.",(712) 775-4328,609 N Carroll St,Carroll,IA,51401,,,Heating and Air Conditioning,,,,,A+,,,https://www.bbb.org/us/ia/carroll/profile/heating-and-air-conditioning/drees-heating-plumbing-inc-0664-18000510,BBB
Drew's Home Improvement LLC,(217) 577-4486,515 Washington St,Canton,MO,63435,,,"General Contractor, Construction Services, Handyman",,,,,,,,https://www.bbb.org/us/mo/canton/profile/general-contractor/drews-home-improvement-llc-0734-1000006816,BBB
"DrexelMechanical, Inc.",(402) 558-9565,8707 S 97th St,La Vista,NE,68128,,,"Mechanical Contractors, Heating and Air Conditioning, Residential Air Conditioning Contractors",,,,,,,,https://www.bbb.org/us/ne/la-vista/profile/mechanical-contractors/drexel-mechanical-inc-0714-300021463,BBB
"DSMechanical, LLC",(608) 935-3523,221 County Road YZ,Dodgeville,WI,53533,,,"Heating and Air Conditioning, Construction Services, Plumber",,,,,A+,,,https://www.bbb.org/us/wi/dodgeville/profile/heating-and-air-conditioning/collins-and-hying-0694-1000011090,BBB
Dulin Contracting Inc,(712) 320-2220,1204 Eloise St,Okoboji,IA,51355,,,"Heating and Air Conditioning, Plumbing Renovation, Geothermal Heat Pumps",,,,,A+,,,https://www.bbb.org/us/ia/okoboji/profile/heating-and-air-conditioning/dulin-contracting-inc-0664-32027594,BBB
"DuncanHeating&Plumbing, Inc",(515) 432-6762,706 Allen St,Boone,IA,50036,,,Heating and Air Conditioning,,,,,A+,,,https://www.bbb.org/us/ia/boone/profile/heating-and-air-conditioning/duncan-heating-plumbing-inc-0664-22000251,BBB
"DunlapPlumbingHeating&Cooling, Inc.",(712) 643-5120,113 Iowa Ave,Dunlap,IA,51529,,,"Plumber, Heating and Air Conditioning, Septic Tank Contractors",,,,,,,,https://www.bbb.org/us/ia/dunlap/profile/plumber/dunlap-plumbing-heating-cooling-inc-0714-300034904,BBB
"Duty CallsPlumbingand Rooter, LLC",(816) 945-2131,523 E US Highway 24,Independence,MO,64050,,,"Plumber, Heating and Air Conditioning, Air Conditioning Contractors",,,,,A+,,,https://www.bbb.org/us/mo/independence/profile/plumber/duty-calls-plumbing-and-rooter-llc-0714-1000069798,BBB
Dyno Heating and Cooling,(913) 235-0640,1804 162nd St,Basehor,KS,66007,,,"Heating and Air Conditioning, Air Conditioning Contractors, Air Conditioning Repair",,,,,A-,,,https://www.bbb.org/us/ks/basehor/profile/heating-and-air-conditioning/dyno-heating-and-cooling-0714-1000074302,BBB
EaganPlumbing&Heating,,405 3rd St,Red Oak,IA,51566,,,"Plumber, Heating and Air Conditioning, Residential Air Conditioning Contractors",,,,,,,,https://www.bbb.org/us/ia/red-oak/profile/plumber/eagan-plumbing-heating-0714-135001069,BBB
Eastern Iowa Building Inc,(319) 845-8000,114 Williams Blvd,Fairfax,IA,52228,,,"Pole Barns, General Contractor, Concrete Contractors",,,,,A+,,,https://www.bbb.org/us/ia/fairfax/profile/pole-barn/eastern-iowa-building-inc-0664-32008996,BBB
"Edge Commercial, LLC",(515) 986-2229,3155 SE Miehe Dr # 2,Grimes,IA,50111,,,"General Contractor, Construction Services, Construction Management",,,,,A+,,,https://www.bbb.org/us/ia/grimes/profile/general-contractor/edge-commercial-llc-0664-32032282,BBB
EhlenPlumbing&Heating,(319) 444-2229,PO Box 203,Belle Plaine,IA,52208,,,Heating and Air Conditioning,,,,,,,,https://www.bbb.org/us/ia/belle-plaine/profile/heating-and-air-conditioning/ehlen-plumbing-heating-0664-32098460,BBB
Ehrecke Construction,(563) 391-3200,2857 Washington Ln,Davenport,IA,52804,,,"Construction Services, General Contractor, Home Builders",,,,,A+,,,https://www.bbb.org/us/ia/davenport/profile/construction-services/ehrecke-construction-0664-18001882/addressId/4791,BBB
Eilander Enterprises L.L.C.,(641) 521-9138,950 500Th Avenue,Montezuma,IA,50171,,,Heating and Air Conditioning,,,,,A,,,https://www.bbb.org/us/ia/montezuma/profile/heating-and-air-conditioning/eilander-enterprises-llc-0664-32156495,BBB
"Eldridge Heating & Cooling & Home Repairs, LLC",(641) 751-6866,1018 260th St,State Center,IA,50247,,,Residential Air Conditioning Contractors,,,,,,,,https://www.bbb.org/us/ia/state-center/profile/residential-air-conditioning-contractors/eldridge-heating-cooling-home-repairs-llc-0664-32074812,BBB
Eletech Inc,(515) 471-4444,PO Box 15,Williamsburg,IA,52361,,,Mechanical Contractors,,,,,,,,https://www.bbb.org/us/ia/williamsburg/profile/mechanical-contractors/eletech-inc-0664-32077963,BBB
Elite Heating and Cooling Inc,(515) 289-2980,6649 NW Timberline Dr,Des Moines,IA,50313,,,"Heating and Air Conditioning, Heating Contractors",,,,,A+,,,https://www.bbb.org/us/ia/des-moines/profile/heating-and-air-conditioning/elite-heating-and-cooling-inc-0664-32006982,BBB
Elite Woodworks & Home Improvements,(515) 979-4583,2530 Dean Ave,Des Moines,IA,50317,,,"Carpenter, Roofing Contractors, General Contractor",,,,,A+,,,https://www.bbb.org/us/ia/des-moines/profile/carpenter/elite-woodworks-home-improvements-0664-32054434,BBB
Elysian Construction,(952) 467-6874,699 Walnut St STE 4,Des Moines,IA,50309,,,"Roofing Contractors, General Contractor, Construction Services",,,,,A+,,,https://www.bbb.org/us/ia/des-moines/profile/roofing-contractors/elysian-construction-0664-32136908/addressId/66321,BBB
"Emergency Mitigation Services, LLC",(913) 773-6777,2309 US-40 unit C,Blue Springs,MO,64015,,,"Water Mitigation, Fire and Water Damage Restoration, Commercial Contractors",,,,,A+,,,https://www.bbb.org/us/mo/blue-springs/profile/water-mitigation/emergency-mitigation-services-llc-0714-1000058509/addressId/259765,BBB
Enderle Heating &AirConditioning,(319) 524-8672,3533 Main St Ste 6,Keokuk,IA,52632,,,"Residential Air Conditioning Contractors, Commercial Air Conditioning Contractors, Geothermal Heat Pumps",,,,,A+,,,https://www.bbb.org/us/ia/keokuk/profile/residential-air-conditioning-contractors/enderle-heating-air-conditioning-0664-32044187,BBB
"Engineered Controls, Inc.",(402) 339-1300,10703 J St Suite #100,Omaha,NE,68127,,,"Heating and Air Conditioning, Air Conditioning Contractors, Building Contractors",,,,,A+,,,https://www.bbb.org/us/ne/omaha/profile/heating-and-air-conditioning/engineered-controls-inc-0714-217003077,BBB
"Engle Construction, LLC",(309) 351-0248,15002 N Prairie Grove Rd,Burlington,IA,52601,,,"Construction Services, General Contractor, Siding Contractors",,,,,A+,,,https://www.bbb.org/us/ia/burlington/profile/construction-services/engle-construction-llc-0664-32145977,BBB
"Erger Construction, LLC",(319) 560-6991,606 Florence St,Norway,IA,52318,,,"General Contractor, Roofing Contractors, Siding Contractors",,,,,A+,,,https://www.bbb.org/us/ia/norway/profile/general-contractor/erger-construction-llc-0664-32056317/addressId/87421,BBB
"Eric Adams Contracting, LLC",(712) 310-7672,4921 Spring Cir,Council Bluffs,IA,51503,,,"Roofing Contractors, General Contractor, Home Improvement",,,,,A,,,https://www.bbb.org/us/ia/council-bluffs/profile/roofing-contractors/eric-adams-contracting-llc-0714-300069394,BBB
Eric Kjelshus EnergyHeatingandCooling,(816) 537-5100,25001 E Outer Belt Rd,Greenwood,MO,64034,,,"Commercial Air Conditioning Contractors, Plumber, Air Conditioning Contractors",,,,,A+,,,https://www.bbb.org/us/mo/greenwood/profile/commercial-air-conditioning-contractors/eric-kjelshus-energy-heating-and-cooling-0714-98120351,BBB
"EricksonPlumbing&Heating, Inc.",(309) 762-0716,230 35th St,Moline,IL,61265,,,"Plumber, Heating and Air Conditioning, Drainage Contractors",,,,,A+,,,https://www.bbb.org/us/il/moline/profile/plumber/erickson-plumbing-heating-inc-0664-10000181,BBB
"EsbeckPlumbing&Heating, LLC",(712) 764-4037,4128 Main St,Elk Horn,IA,51531,,,"Plumber, Heating and Air Conditioning, Air Conditioning Contractors",,,,,A+,,,https://www.bbb.org/us/ia/elk-horn/profile/plumber/esbeck-plumbing-heating-llc-0714-300034951,BBB
Ethington Heating & Cooling,(641) 753-5525,PO Box 475,Marshalltown,IA,50158,,,Air Conditioning Contractors,,,,,,,,https://www.bbb.org/us/ia/marshalltown/profile/air-conditioning-contractor/ethington-heating-cooling-0664-32063260,BBB
Everest Exteriors Inc,(515) 805-7050,5500 Wild Rose Ln Ste 400,West Des Moines,IA,50266,,,"Roofing Contractors, General Contractor, Siding Contractors",,,,,A+,,,https://www.bbb.org/us/ia/west-des-moines/profile/roofing-contractors/everest-exteriors-inc-0664-32137133,BBB
Everest Exteriors Inc,(844) 463-8373,221 3rd Avs SE,"525 , Cedar Rapids",IA,52401,,,"Roofing Contractors, General Contractor, Siding Contractors",,,,,A+,,,https://www.bbb.org/us/ia/cedar-rapids/profile/roofing-contractors/everest-exteriors-inc-0664-32137133/addressId/90776,BBB
"Every Plumbing andHeating, Incorporated",(608) 783-2803,110 Riders Club Rd,Onalaska,WI,54650,,,"Plumber, Drainage Contractors, Hot Tub Service and Repair",,,,,A+,,,https://www.bbb.org/us/wi/onalaska/profile/plumber/every-plumbing-and-heating-incorporated-0694-20000568,BBB
ExcelMechanicalCO Inc,(515) 288-1450,5636 NE 17th Ave,Des Moines,IA,50313,,,Mechanical Contractors,,,,,A+,,,https://www.bbb.org/us/ia/des-moines/profile/mechanical-contractors/excel-mechanical-co-inc-0664-32068005,BBB
"Exira Plumbing Heating & Electrical, LLC",(712) 268-5367,PO Box 111,Exira,IA,50076,,,"Heating Contractors, Plumber, Electrician",,,,,A+,,,https://www.bbb.org/us/ia/exira/profile/heating-contractors/exira-plumbing-heating-electrical-llc-0664-5027152/addressId/2647,BBB
Eyman Plumbing Heating & Air,(402) 731-2727,8506 S 117th St,La Vista,NE,68128,,,"Plumber, Heating and Air Conditioning, Excavating Contractors",,,,,A+,,,https://www.bbb.org/us/ne/la-vista/profile/plumber/eyman-plumbing-heating-air-0714-104001211,BBB
"Fagen Construction, LLC",(712) 320-1355,606 38th st,Spirit Lake,IA,51360,,,"General Contractor, Construction Services, Painting Contractors",,,,,A+,,,https://www.bbb.org/us/ia/spirit-lake/profile/general-contractor/fagen-construction-llc-0664-32014464,BBB
Family Heating & Cooling Inc,(563) 359-1000,3831 Jefferson Ave,Davenport,IA,52807,,,"Heating and Air Conditioning, Air Conditioning Contractors, Residential Air Conditioning Contractors",,,,,A+,,,https://www.bbb.org/us/ia/davenport/profile/heating-and-air-conditioning/family-heating-cooling-inc-0664-32044718,BBB
"Family Heating andAir, LLC",(402) 403-9693,Papillion,Des Moines,IA,,,,"Heating and Air Conditioning, Air Conditioning Contractors, Air Conditioning Repair",,,,,A+,,,https://www.bbb.org/us/ne/papillion/profile/heating-and-air-conditioning/breezetech-heating-and-cooling-0714-1000056847,BBB
FederMechanicalInc.,(507) 642-3522,320 Adams Ave NE,Madelia,MN,56062,,,Air Conditioning Contractors,,,,,,,,https://www.bbb.org/us/mn/madelia/profile/air-conditioning-contractor/feder-mechanical-inc-0704-1000007768,BBB
"Fencl Remodeling and Construction, LLC",(712) 520-0677,Council Blfs,West Des Moines,IA,,,,"Construction Services, Roofing Contractors, General Contractor",,,,,A+,,,https://www.bbb.org/us/ia/council-blfs/profile/construction-services/fencl-remodeling-and-construction-llc-0714-300012463,BBB
Fenelon Place Elevator CO,(563) 588-2357,512 Fenelon PL,Dubuque,IA,52001,,,Mechanical Contractors,,,,,,,,https://www.bbb.org/us/ia/dubuque/profile/mechanical-contractors/fenelon-place-elevator-co-0664-32063444,BBB
Figueroas Construction LLC,(507) 236-0604,206 North State Street,Fairmont,MN,56031,,,"Roofing Contractors, General Contractor, Siding Contractors",,,,,A+,,,https://www.bbb.org/us/mn/fairmont/profile/roofing-contractors/figueroas-construction-llc-0704-1000059332,BBB
"Fine & Sons Homebuilders, Inc.",(712) 542-5630,217 N 15th St,Clarinda,IA,51632,,,"Construction Services, General Contractor, Home Builders",,,,,A+,,,https://www.bbb.org/us/ia/clarinda/profile/construction-services/fine-sons-homebuilders-inc-0714-300058944,BBB
First ChoiceMechanicalLLC,(573) 569-2015,19060 Mystical Ln,Versailles,MO,65084,,,"Heating and Air Conditioning, Air Conditioning Contractors, Air Duct Cleaning",,,,,A+,,,https://www.bbb.org/us/mo/versailles/profile/heating-and-air-conditioning/first-choice-mechanical-llc-0734-310614828,BBB
First Fruits Construction,(812) 459-6120,211 Hwy 5,Swan,IA,50252,,,"Residential General Contractor, Roofing Contractors, Siding Contractors",,,,,A+,,,https://www.bbb.org/us/ia/swan/profile/residential-general-contractor/first-fruits-construction-0664-32156337,BBB
FIRSTCALL Remodeling-Restoration-Exteriors,(515) 986-9300,3910 SE Capitol Cir,Grimes,IA,50111,,,"Remodel Contractors, Roofing Contractors, General Contractor",,,,,A+,,,https://www.bbb.org/us/ia/grimes/profile/remodel-contractors/firstcall-remodeling-restoration-exteriors-0664-5000915,BBB
Five Star Exteriors,(515) 803-0508,2945 Lyon St,Des Moines,IA,50317,,,"General Contractor, Roofing Contractors, Handyman",,,,,A+,,,https://www.bbb.org/us/ia/des-moines/profile/general-contractor/five-star-exteriors-0664-32136983,BBB
Fleckson's AirConditioning,(402) 332-3480,124 S Mc Kenna Ave,Gretna,NE,68028,,,"Heating and Air Conditioning, Air Conditioning Contractors, Air Conditioning Repair",,,,,A+,,,https://www.bbb.org/us/ne/gretna/profile/heating-and-air-conditioning/gp-fleck-sons-inc-0714-104007701,BBB
FloorCo.,(402) 215-3917,Omaha,Des Moines,IA,,,,"Floor Installation, Flooring Contractors, Floor Refinishing",,,,,A+,,,https://www.bbb.org/us/ne/omaha/profile/floor-installation/floorco-0714-300163393/addressId/132443,BBB
"Fluid Mechanical, LLC",(402) 332-6749,9991 J St,Omaha,NE,68127,,,"Mechanical Contractors, Heating and Air Conditioning, Air Conditioning Contractors",,,,,A+,,,https://www.bbb.org/us/ne/omaha/profile/mechanical-contractors/fluid-mechanical-llc-0714-300245154,BBB
Foley Contracting LLC,(563) 208-9007,6730 Double Eagle Dr,Davenport,IA,52804,,,"General Contractor, Roofing Contractors, Siding Contractors",,,,,A+,,,https://www.bbb.org/us/ia/davenport/profile/general-contractor/foley-contracting-llc-0664-32047772,BBB
FopsMechanicalLLC,(563) 370-4895,110 N 8th Ave CT,Donahue,IA,52746,,,Mechanical Contractors,,,,,,,,https://www.bbb.org/us/ia/donahue/profile/mechanical-contractors/fops-mechanical-llc-0664-32102177,BBB
Four Corners Remodeling & Restoration,(402) 916-0017,14015 Industrial Rd,Omaha,NE,68144,,,"General Contractor, Bathroom Remodel, Patios and Decks",,,,,A+,,,https://www.bbb.org/us/ne/omaha/profile/general-contractor/four-corners-remodeling-restoration-0714-300173781,BBB
"FrambachHeating, AC &Plumbing",(712) 852-3724,910 Broadway Street,Emmetsburg,IA,50536,,,Heating and Air Conditioning,,,,,A+,,,https://www.bbb.org/us/ia/emmetsburg/profile/heating-and-air-conditioning/frambach-ltd-0664-32082505/addressId/88053,BBB
Francis Pump and Well,(319) 367-2294,2731 Old Highway 34,New London,IA,52645,,,"Heating and Air Conditioning, Plumber, Water Well Drilling",,,,,A+,,,https://www.bbb.org/us/ia/new-london/profile/heating-and-air-conditioning/francis-pump-and-well-0664-32021117,BBB
FrancisHeatingAnd Cooling,(319) 367-2294,2731 Old Highway 34,New London,IA,52645,,,"Heating and Air Conditioning, Plumber, Water Well Drilling",,,,,A+,,,https://www.bbb.org/us/ia/new-london/profile/heating-and-air-conditioning/francis-pump-and-well-0664-32021117,BBB
"Frazier Co., Inc.",(402) 896-5900,14830 B Cir,Omaha,NE,68144,,,"Heating and Air Conditioning, Plumber, Air Conditioning Contractors",,,,,A+,,,https://www.bbb.org/us/ne/omaha/profile/heating-and-air-conditioning/frazier-co-inc-0714-105000101,BBB
Fred's Heating and Air,(402) 895-3030,8817 S 117th St STE 500,La Vista,NE,68128,,,"Heating and Air Conditioning, Air Conditioning Contractors, Air Conditioning Repair",,,,,A+,,,https://www.bbb.org/us/ne/la-vista/profile/heating-and-air-conditioning/freds-heating-and-air-0714-105000379,BBB
Frederick Quality Plumbing,(641) 754-1777,PO Box 206,Marshalltown,IA,50158,,,Air Conditioning Contractors,,,,,A+,,,https://www.bbb.org/us/ia/marshalltown/profile/air-conditioning-contractor/frederick-quality-plumbing-0664-32063231,BBB
FrederickburgPlumbing&HeatingLLC,(563) 237-5027,PO Box 192,Fredericksburg,IA,50630,,,Heating and Air Conditioning,,,,,,,,https://www.bbb.org/us/ia/fredericksburg/profile/heating-and-air-conditioning/frederickburg-plumbing-heating-llc-0664-32081969,BBB
Frye Construction,(641) 844-7645,1971 160th St,Albion,IA,50005,,,"General Contractor, Roofing Contractors, Construction Services",,,,,A+,,,https://www.bbb.org/us/ia/albion/profile/general-contractor/frye-construction-0664-32098082,BBB
"Full NelsonPlumbing, Inc",(913) 346-5420,8525 Parallel Pkwy,Kansas City,KS,66112,,,"Plumber, Heating and Air Conditioning, Sewer Cleaning",,,,,A+,,,https://www.bbb.org/us/ks/kansas-city/profile/plumber/full-nelson-services-0714-99127542,BBB
"G.P. Fleck & Sons, Inc.",(402) 332-3480,PO Box 9,Gretna,NE,68028,,,"Heating and Air Conditioning, Air Conditioning Contractors, Air Conditioning Repair",,,,,A+,,,https://www.bbb.org/us/ne/gretna/profile/heating-and-air-conditioning/gp-fleck-sons-inc-0714-104007701/addressId/40514,BBB
"Gallatin Construction, LLC",(515) 300-4910,1507 Maple Dr,Adel,IA,50003,,,"General Contractor, Bathroom Remodel, Remodel Contractors",,,,,A+,,,https://www.bbb.org/us/ia/adel/profile/general-contractor/gallatin-construction-llc-0664-32099988,BBB
GardnerMechanicalServices LLC,(319) 551-4121,2800 Virginia Dr SE,Cedar Rapids,IA,52403,,,Heating Contractors,,,,,,,,https://www.bbb.org/us/ia/cedar-rapids/profile/heating-contractors/gardner-mechanical-services-llc-0664-32137582,BBB
Garry Bair Heating & Mech,(641) 673-4229,101 15th Ave E,Oskaloosa,IA,52577,,,Air Conditioning Contractors,,,,,,,,https://www.bbb.org/us/ia/oskaloosa/profile/air-conditioning-contractor/garry-bair-heating-mech-0664-32132263,BBB
Gary HinderakerPlumbingHeatingAir Conditioning Inc.,(319) 415-1508,PO Box 803,Waverly,IA,50677,,,Heating and Air Conditioning,,,,,A+,,,https://www.bbb.org/us/ia/waverly/profile/heating-and-air-conditioning/gary-hinderaker-plumbing-heating-air-conditioning-inc-0664-32098475/addressId/43934,BBB
Gary HinderakerPlumbingHeatingAir Conditioning Inc.,(319) 352-1784,2202 E Bremer Ave,Waverly,IA,50677,,,Heating and Air Conditioning,,,,,A+,,,https://www.bbb.org/us/ia/waverly/profile/heating-and-air-conditioning/gary-hinderaker-plumbing-heating-air-conditioning-inc-0664-32098475,BBB
GatewayPlumbingLlc,(515) 292-8056,556 E 190Th Street E,Ames,IA,50010,,,Heating and Air Conditioning,,,,,A+,,,https://www.bbb.org/us/ia/ames/profile/heating-and-air-conditioning/gateway-plumbing-llc-0664-32143904,BBB
