name,phone,address,city,state,zip_code,email,website,category,license_number,license_type,license_expiry,types_of_work,bbb_rating,google_rating,review_count,bbb_profile_url,source
"Comfort Zone MechanicalAir, Inc.",(408) 675-6065,1465 N Milpitas Blvd,Milpitas,CA,95035,,,"Heating and Air Conditioning, Air Conditioning Repair, Heating Contractors",,,,,A+,,,https://www.bbb.org/us/ca/milpitas/profile/heating-and-air-conditioning/comfort-energy-inc-1216-232310,BBB
Compare Heating & Air Conditioning,(925) 686-1366,1717 Solano Way Ste 42,Concord,CA,94520,,,"Air Conditioning Contractors, Heating and Air Conditioning, Sheet Metal Contractor",,,,,A+,,,https://www.bbb.org/us/ca/concord/profile/air-conditioning-contractor/compare-heating-air-conditioning-1116-15224,BBB
Connolly Heating and Air Conditioning,(925) 293-2702,428 N Buchanan Cir Ste 8,Pacheco,CA,94553,,,"Heating and Air Conditioning, General Contractor, Air Conditioning Contractors",,,,,A+,,,https://www.bbb.org/us/ca/pacheco/profile/heating-and-air-conditioning/connolly-heating-and-air-conditioning-1116-877316,BBB
Contractors,(415) 307-5160,202 S Rolling Blvd,San Francisco,CA,94104,,,"Medical Doctor, Online Shopping",,,,,B-,,,https://www.bbb.org/us/ca/san-francisco/profile/medical-doctor/contractors-1116-14114211,BBB
Cooper Hawkins,(510) 845-4225,2701 San Pablo Avenue,Berkeley,CA,94702,,,"Boiler Repair, Electrician, Heating and Air Conditioning",,,,,A+,,,https://www.bbb.org/us/ca/berkeley/profile/boiler-repair/cooper-hawkins-1116-31734,BBB
"Copeland Mechanical, Inc.",(510) 795-7216,Newark,Oakland,CA,,,,"Heating Contractors, Heating and Air Conditioning, Air Conditioning Contractors",,,,,A+,,,https://www.bbb.org/us/ca/newark/profile/heating-contractors/copeland-mechanical-inc-1116-13098,BBB
"Costa Engineers, Inc.",(707) 252-9177,Napa,Oakland,CA,,,,"Professional Engineers, Mechanical Contractors",,,,,A+,,,https://www.bbb.org/us/ca/napa/profile/professional-engineer/costa-engineers-inc-1116-48301,BBB
Cozy Home Services,(707) 719-6056,875 Cotting Ln,Vacaville,CA,95688,,,"Heating and Air Conditioning, Air Conditioning Contractors, Air Conditioning Repair",,,,,A+,,,https://www.bbb.org/us/ca/vacaville/profile/heating-and-air-conditioning/cozy-home-services-1116-942132,BBB
CPMechanical,(650) 299-9070,720 S. Amphlett Blvd.,San Mateo,CA,94402,,,Heating Contractors,,,,,A+,,,https://www.bbb.org/us/ca/san-mateo/profile/heating-contractors/cp-mechanical-1116-66528,BBB
Crane Construction,(925) 322-9002,1910 N Main St,Walnut Creek,CA,94596,,,"General Contractor, Roofing Contractors, Home Improvement",,,,,A,,,https://www.bbb.org/us/ca/walnut-creek/profile/general-contractor/crane-construction-1116-950579,BBB
CtwMechanical,(415) 760-8318,544 2nd Ave,San Francisco,CA,94118,,,Mechanical Contractors,,,,,,,,https://www.bbb.org/us/ca/san-francisco/profile/mechanical-contractors/ctw-mechanical-1116-908567,BBB
Cyclone Air Systems Inc,(925) 349-9595,1070 Concord Ave Ste 285,Concord,CA,94520,,,"Heating and Air Conditioning, Air Conditioning Contractors, Air Duct Cleaning",,,,,A+,,,https://www.bbb.org/us/ca/concord/profile/heating-and-air-conditioning/cyclone-air-systems-inc-1116-80291,BBB
Dale's Excavating,(510) 506-5302,Alameda,Oakland,CA,,,,"General Engineering Contractor, Excavating Contractors, Demolition Contractors",,,,,A+,,,https://www.bbb.org/us/ca/alameda/profile/general-engineering-contractor/dales-excavating-1116-141919,BBB
Daniel LarrattPlumbingInc.,(650) 551-1200,944 Terminal Way,San Carlos,CA,94070,,,Heating and Air Conditioning,,,,,A+,,,https://www.bbb.org/us/ca/san-carlos/profile/heating-and-air-conditioning/daniel-larratt-plumbing-inc-1116-974479,BBB
De Jager & Reilly Plumbing &Heating,(415) 626-1644,245 Castleton Way,San Bruno,CA,94066,,,"Plumber, Bathroom Remodel, Kitchen Remodel",,,,,A+,,,https://www.bbb.org/us/ca/san-bruno/profile/plumber/de-jager-reilly-plumbing-heating-1116-12096,BBB
DegreeHVACInc.,(650) 596-2920,1160 Industrial Road Suite #2,San Carlos,CA,94070,,,"Heating Contractors, Plumber, Air Conditioning Contractors",,,,,A+,,,https://www.bbb.org/us/ca/san-carlos/profile/heating-contractors/degree-hvac-inc-1116-195247,BBB
"Design Build Specialists, Inc.",(415) 892-3932,394 Bel Marin Keys Blvd STE 5,Novato,CA,94949,,,"Building Contractors, Construction Services, Home Improvement",,,,,A+,,,https://www.bbb.org/us/ca/novato/profile/building-contractors/design-build-specialists-inc-1116-41552,BBB
"Devil MountainMechanicalServices, Inc.",(925) 250-3147,Concord,Oakland,CA,,,,"Heating Contractors, Heating and Air Conditioning, Commercial Air Conditioning Contractors",,,,,A+,,,https://www.bbb.org/us/ca/concord/profile/heating-contractors/devil-mountain-mechanical-services-inc-1116-881149,BBB
"DG Heating & AirConditioning, Inc.",(408) 201-9411,1040 Commercial St #104,San Jose,CA,95112,,,"Residential Air Conditioning Contractors, Heating and Air Conditioning, Air Conditioning Contractors",,,,,A+,,,https://www.bbb.org/us/ca/san-jose/profile/residential-air-conditioning-contractors/dg-heating-air-conditioning-inc-1216-1000006061,BBB
Diamond Bridge Builders,(510) 712-5672,El Sobrante,Oakland,CA,,,,"General Contractor, Landscape Contractors, Building Contractors",,,,,A+,,,https://www.bbb.org/us/ca/el-sobrante/profile/general-contractor/diamond-bridge-builders-1116-961968,BBB
"Dinardo Design and Construction, Inc.",(510) 482-2777,733 Allston Way,Berkeley,CA,94710,,,"General Contractor, Remodel Contractors, Remodeling",,,,,A+,,,https://www.bbb.org/us/ca/berkeley/profile/general-contractor/dinardo-design-and-construction-inc-1116-933167,BBB
DLM Enterprises,(510) 915-0091,Oakland,Oakland,CA,,,,"General Contractor, Home Improvement, Bathroom Remodel",,,,,A+,,,https://www.bbb.org/us/ca/oakland/profile/general-contractor/dlm-enterprises-1116-360785,BBB
"Doherty Restoration, Inc.",(415) 695-1494,San Francisco,Oakland,CA,,,,"General Contractor, Construction Services, Painting Contractors",,,,,A+,,,https://www.bbb.org/us/ca/san-francisco/profile/general-contractor/doherty-restoration-inc-1116-12120,BBB
"Doke'sPlumbing, Inc.",(415) 463-3058,1205 Andersen Drive Ste J,San Rafael,CA,94915,,,"Plumber, Heating and Air Conditioning, Fire Protection Contractor",,,,,A+,,,https://www.bbb.org/us/ca/san-rafael/profile/plumber/dokes-plumbing-inc-1116-276372/addressId/43087,BBB
Dooley's Heating and Air,(707) 419-4555,Suisun City,Oakland,CA,,,,"Heating Contractors, Heating and Air Conditioning, Air Conditioning Contractors",,,,,A+,,,https://www.bbb.org/us/ca/suisun-city/profile/heating-contractors/dooleys-heating-and-air-1116-877980,BBB
"DoPro Construction, Inc.",(925) 323-4710,2121 N California Blvd Ste 290,Walnut Creek,CA,94596,,,"General Contractor, Roofing Contractors, Construction Services",,,,,A-,,,https://www.bbb.org/us/ca/walnut-creek/profile/general-contractor/dopro-construction-inc-1116-966604,BBB
Dowdle & SonsMechanicalInc,(707) 224-6968,100 Tower Rd,American Canyon,CA,94503,,,"General Engineering Contractor, Building Contractors",,,,,A+,,,https://www.bbb.org/us/ca/american-canyon/profile/general-engineering-contractor/dowdle-sons-mechanical-inc-1116-132164,BBB
"Dream Big Drywall & Construction, Inc.",(925) 698-9595,Walnut Creek,Oakland,CA,,,,"General Contractor, Drywall Contractors, Bathroom Remodel",,,,,A+,,,https://www.bbb.org/us/ca/walnut-creek/profile/general-contractor/dream-big-drywall-construction-inc-1116-970878,BBB
Dynamite Construction Management,(415) 685-3615,1875 Mission St Ste 103 # 309,San Francisco,CA,94103,,,"General Contractor, Construction Services, Bathroom Remodel",,,,,A,,,https://www.bbb.org/us/ca/san-francisco/profile/general-contractor/dynamite-construction-management-1116-965671,BBB
E Martinez Construction Inc.,(510) 860-1305,3575 San Pablo Dam Rd Ste 21,El Sobrante,CA,94803,,,"General Contractor, Bathroom Remodel, Remodel Contractors",,,,,A+,,,https://www.bbb.org/us/ca/el-sobrante/profile/general-contractor/e-martinez-construction-inc-1116-935025,BBB
E. Troupe & Sons Construction,(510) 812-6710,1617 7th St,Berkeley,CA,94710,,,"General Contractor, Construction Services, Kitchen Remodel",,,,,A+,,,https://www.bbb.org/us/ca/berkeley/profile/general-contractor/e-troupe-sons-construction-1116-317818,BBB
Eagle Air,(925) 255-1115,5542 Brisa St. Suite B,Livermore,CA,94550,,,"Air Conditioning Contractors, Heating and Air Conditioning, Air Conditioning Repair",,,,,A+,,,https://www.bbb.org/us/ca/livermore/profile/air-conditioning-contractor/eagle-air-1116-28255,BBB
"East Bay Heating and Cooling, Inc.",(925) 457-0548,1110 Burnett Ave,Concord,CA,94520,,,"Heating and Air Conditioning, Residential Air Conditioning Contractors, Heating Contractors",,,,,A+,,,https://www.bbb.org/us/ca/concord/profile/heating-and-air-conditioning/east-bay-heating-and-cooling-inc-1116-881279,BBB
"East Bay Pump & Equipment Co., Inc.",(510) 532-1800,4900 E 12th St,Oakland,CA,94601,,,"Pump Service, General Contractor, Pumping Contractors",,,,,A+,,,https://www.bbb.org/us/ca/oakland/profile/pump-service/east-bay-pump-equipment-co-inc-1116-38024,BBB
Eco Insulation Company LLC,(916) 792-5240,Orangevale,Oakland,CA,,,,"Blown Insulation, Insulation Contractors, Spray Foam Insulation Contractors",,,,,A,,,https://www.bbb.org/us/ca/orangevale/profile/blown-insulation/eco-insulation-company-llc-1156-90098496,BBB
Economy Plumbing Sewer & Drain,(650) 756-5100,1661 Southgate Ave,Daly City,CA,94015,,,"Plumber, Building Contractors, Residential Air Conditioning Contractors",,,,,A+,,,https://www.bbb.org/us/ca/daly-city/profile/plumber/economy-plumbing-sewer-drain-1116-548026,BBB
EDL Construction Corp.,(650) 248-6470,618 Fairway St,Hayward,CA,94544,,,"General Contractor, Construction Services, Drywall Contractors",,,,,A+,,,https://www.bbb.org/us/ca/hayward/profile/general-contractor/edl-construction-corp-1116-375229,BBB
Efficient Modern Heat Pump-HVAC,(707) 840-3411,Suisun City,Oakland,CA,,,,"Heat Pumps, Electrician, Heating and Air Conditioning",,,,,A+,,,https://www.bbb.org/us/ca/suisun-city/profile/heat-pump/electrify-my-home-1116-925188,BBB
Electrify My Home,(707) 840-3411,Suisun City,Oakland,CA,,,,"Heat Pumps, Electrician, Heating and Air Conditioning",,,,,A+,,,https://www.bbb.org/us/ca/suisun-city/profile/heat-pump/electrify-my-home-1116-925188,BBB
"Elite Comfort Systems, Inc.",(925) 580-8875,PO Box 1422,Brentwood,CA,94513,,,"Heating Contractors, Heating and Air Conditioning, Air Conditioning Contractors",,,,,A+,,,https://www.bbb.org/us/ca/brentwood/profile/heating-contractors/elite-comfort-systems-inc-1116-194890,BBB
"EliteMechanicalService, Inc.",(925) 580-8875,PO Box 1422,Brentwood,CA,94513,,,"Heating Contractors, Heating and Air Conditioning, Air Conditioning Contractors",,,,,A+,,,https://www.bbb.org/us/ca/brentwood/profile/heating-contractors/elite-comfort-systems-inc-1116-194890,BBB
"ElliottAirSystems, Inc.",(925) 837-7201,160 Alamo Plz Unit 411,Alamo,CA,94507,,,"Heating Contractors, Air Conditioning Contractors, Furnace Repair",,,,,A+,,,https://www.bbb.org/us/ca/alamo/profile/heating-contractors/elliott-air-systems-inc-1116-116588,BBB
EmpireMechanicalServices Inc.,(530) 885-3333,Applegate,Oakland,CA,,,,"Residential Air Conditioning Contractors, Heating and Air Conditioning, Air Conditioning Repair",,,,,A+,,,https://www.bbb.org/us/ca/applegate/profile/residential-air-conditioning-contractors/mize-guys-heating-and-cooling-1156-47002911,BBB
EmpirePlumbingCompany LLC,(925) 430-4489,2400 Sycamore Dr Ste 15,Antioch,CA,94509,,,Heating and Air Conditioning,,,,,A+,,,https://www.bbb.org/us/ca/antioch/profile/heating-and-air-conditioning/empire-plumbing-company-llc-1116-945850,BBB
Energreen Mechanical,(415) 725-5322,1434 65th Ave,Oakland,CA,94621,,,"Heating Contractors, Air Conditioning Contractors, Residential Air Conditioning Contractors",,,,,A+,,,https://www.bbb.org/us/ca/oakland/profile/heating-contractors/energreen-mechanical-1116-875838,BBB
Energy Solutions,(925) 778-1335,2520 Verne Roberts Cir,Antioch,CA,94509,,,"Heating Contractors, Heating and Air Conditioning, Air Conditioning Contractors",,,,,A+,,,https://www.bbb.org/us/ca/antioch/profile/heating-contractors/energy-solutions-1116-73737,BBB
"Enterprise Roofing Service, Inc.",(925) 689-8100,PO Box 5130,Concord,CA,94524,,,"Commercial Roofing, Roofing Contractors, General Contractor",,,,,A+,,,https://www.bbb.org/us/ca/concord/profile/commercial-roofing/enterprise-roofing-service-inc-1116-10808,BBB
"Everest Waterproofing & Restoration, Inc.",(415) 282-9800,1270 Missouri St,San Francisco,CA,94107,,,"General Contractor, Painting Contractors, Waterproofing Contractors",,,,,A+,,,https://www.bbb.org/us/ca/san-francisco/profile/general-contractor/everest-waterproofing-restoration-inc-1116-33717,BBB
EVSMechanical,(408) 300-8254,Mountain View,Oakland,CA,,,,Air Conditioning Contractors,,,,,A+,,,https://www.bbb.org/us/ca/mountain-view/profile/air-conditioning-contractor/evs-mechanical-1216-1636806,BBB
EZ Air Control,(510) 648-3922,32425 Elizabeth Way,Union City,CA,94587,,,"Heating Contractors, Heating and Air Conditioning, Air Conditioning Contractors",,,,,A+,,,https://www.bbb.org/us/ca/union-city/profile/heating-contractors/ez-air-control-1116-58162,BBB
FairPrice Heating & Cooling,(408) 608-8246,Santa Clara,Oakland,CA,,,,"General Contractor, Heating and Air Conditioning, Air Conditioning Contractors",,,,,A+,,,https://www.bbb.org/us/ca/santa-clara/profile/general-contractor/fairprice-heating-cooling-1216-885992,BBB
FairwayPlumbing/Heating,(510) 715-3749,29568 Union City Blvd,Union City,CA,94587,,,"Plumber, Heating and Air Conditioning",,,,,A+,,,https://www.bbb.org/us/ca/union-city/profile/plumber/fairway-plumbingheating-1116-10824,BBB
FairwayPlumbingHeating&Cooling,(510) 582-1111,29568 Union City Blvd,Union City,CA,94587,,,Heating and Air Conditioning,,,,,A+,,,https://www.bbb.org/us/ca/union-city/profile/heating-and-air-conditioning/fairway-plumbing-heating-cooling-1116-947615,BBB
Femenia & SonsPlumbing,(415) 383-7473,PO Box 2196,Mill Valley,CA,94942,,,"Plumber, Heating and Air Conditioning, Fire Protection Contractor",,,,,A+,,,https://www.bbb.org/us/ca/mill-valley/profile/plumber/femenia-sons-plumbing-1116-129748/addressId/33074,BBB
FencePro,(415) 468-8485,PO Box 27,Brisbane,CA,94005,,,"Fence Contractors, General Contractor, Landscape Contractors",,,,,A+,,,https://www.bbb.org/us/ca/brisbane/profile/fence-contractors/fencepro-1116-63163/addressId/199072,BBB
Feron Construction,(510) 282-3286,Oakland,Oakland,CA,,,,"General Contractor, Bathroom Remodel, Remodel Contractors",,,,,A+,,,https://www.bbb.org/us/ca/oakland/profile/general-contractor/feron-construction-1116-881401,BBB
Fertado Heating &Air,(925) 754-2730,Antioch,Oakland,CA,,,,"Heating Contractors, Air Conditioning Contractors, Residential Air Conditioning Contractors",,,,,A+,,,https://www.bbb.org/us/ca/antioch/profile/heating-contractors/fertado-heating-air-1116-123052,BBB
"Fine Wood Worx, Inc.",(510) 367-8779,Richmond,Oakland,CA,,,,"General Contractor, Painting Contractors, Kitchen Remodel",,,,,A-,,,https://www.bbb.org/us/ca/richmond/profile/general-contractor/fine-wood-worx-inc-1116-973670,BBB
First ResponsePlumbingLLC,(925) 437-7983,1 Huntington Cir,Pittsburg,CA,94565,,,Heating and Air Conditioning,,,,,A+,,,https://www.bbb.org/us/ca/pittsburg/profile/heating-and-air-conditioning/first-response-plumbing-llc-1116-945692,BBB
"Fitzgerald Construction, Inc.",(510) 531-4077,Berkeley,Oakland,CA,,,,"General Contractor, Roofing Contractors, Home Improvement",,,,,A+,,,https://www.bbb.org/us/ca/berkeley/profile/general-contractor/fitzgerald-construction-inc-1116-106350,BBB
Flanders Heat & Air Systems,(510) 438-0800,555 Peters Ave,"Suite 255 , Pleasanton",CA,94566,,,"Heating and Air Conditioning, General Contractor, Plumber",,,,,A+,,,https://www.bbb.org/us/ca/pleasanton/profile/heating-and-air-conditioning/flanders-heat-air-systems-1116-124327,BBB
FontanillaMechanical,(650) 438-2595,27990 Thackeray Ave,Hayward,CA,94544,,,Heating Contractors,,,,,A+,,,https://www.bbb.org/us/ca/hayward/profile/heating-contractors/fontanilla-mechanical-1116-357737,BBB
Frank ThomasPlumbingCo Inc.,(415) 686-4236,PO Box 433,Fairfax,CA,94978,,,Heating and Air Conditioning,,,,,A+,,,https://www.bbb.org/us/ca/fairfax/profile/heating-and-air-conditioning/frank-thomas-plumbing-co-inc-1116-946095,BBB
FreewayMechanical,(510) 280-4171,614 W Sunset Blvd,Hayward,CA,94541,,,"Building Contractors, Heating and Air Conditioning, Residential Air Conditioning Contractors",,,,,A+,,,https://www.bbb.org/us/ca/hayward/profile/building-contractors/freeway-mechanical-1116-367549/addressId/52550,BBB
Freschi Service Experts,(866) 397-3787,2440 Sprig Ct,Concord,CA,94520,,,"Heating and Air Conditioning, Plumber, Air Conditioning Contractors",,,,,A+,,,https://www.bbb.org/us/ca/concord/profile/heating-and-air-conditioning/freschi-service-experts-1116-10864/addressId/147476,BBB
FullerMechanical,(707) 310-4616,1567 Los Carneros Ave,Napa,CA,94559,,,Mechanical Contractors,,,,,,,,https://www.bbb.org/us/ca/napa/profile/mechanical-contractors/fuller-mechanical-1116-903322,BBB
Galaxy Heating & Air Conditioning,(925) 578-3293,3301 Vincent Rd,Pleasant Hill,CA,94523,,,"Air Conditioning Contractors, Electrician, Heating and Air Conditioning",,,,,A+,,,https://www.bbb.org/us/ca/pleasant-hill/profile/air-conditioning-contractor/galaxy-heating-air-conditioning-1116-925353,BBB
GamaBuilt,(415) 860-7174,2261 Market St #600,San Francisco,CA,94114,,,"General Contractor, Bathroom Remodel, Building Contractors",,,,,A+,,,https://www.bbb.org/us/ca/san-francisco/profile/general-contractor/gamabuilt-1116-939206,BBB
GBMechanicalHVAC Co.,(415) 699-3983,430 44th Avenue Ste 305,San Francisco,CA,94121,,,"Heating and Air Conditioning, Pipe and Boiler Covering Contractors",,,,,A+,,,https://www.bbb.org/us/ca/san-francisco/profile/heating-and-air-conditioning/gb-mechanical-hvac-co-1116-302149,BBB
Gd3PlumbingSolutions,(415) 525-9576,PO Box 5096,Vallejo,CA,94591,,,Heating and Air Conditioning,,,,,A+,,,https://www.bbb.org/us/ca/vallejo/profile/heating-and-air-conditioning/gd3-plumbing-solutions-1116-946121,BBB
Geico Builders,(510) 800-6202,1901 Harrison St Ste 1100,Oakland,CA,94612,,,"General Contractor, Paving Contractors, Bathroom Remodel",,,,,A+,,,https://www.bbb.org/us/ca/oakland/profile/general-contractor/geico-builders-1116-973577,BBB
GeneralExpress Construction,(650) 666-5554,58 West Portal Ave #605,San Francisco,CA,94127,,,"Roofing Contractors, General Contractor, Gutter Cleaning",,,,,A+,,,https://www.bbb.org/us/ca/san-francisco/profile/roofing-contractors/roof-express-1116-926196,BBB
"GeneralRoofing Company, Inc.",(510) 761-5937,3309 Elmwood Ave,Oakland,CA,94601,,,"Roofing Contractors, Gutters, Skylights",,,,,A+,,,https://www.bbb.org/us/ca/oakland/profile/roofing-contractors/general-roofing-company-inc-1116-10885,BBB
"GenXPro Heating & Air Conditioning, Inc.",(925) 505-8398,Antioch,Oakland,CA,,,,"Heating and Air Conditioning, Air Conditioning Contractors, Air Conditioning Repair",,,,,A,,,https://www.bbb.org/us/ca/antioch/profile/heating-and-air-conditioning/genxpro-heating-air-conditioning-inc-1116-952141,BBB
GG Heating & Air Inc.,(707) 731-2066,1018 Alabama St,Vallejo,CA,94590,,,"Heating and Air Conditioning, Air Conditioning Repair, Heating System Repair",,,,,A+,,,https://www.bbb.org/us/ca/vallejo/profile/heating-and-air-conditioning/gg-heating-air-inc-1116-929984,BBB
"GHS Landscaping, Inc.",(800) 682-0447,El Sobrante,Oakland,CA,,,,"General Engineering Contractor, Landscape Contractors, Hardscaping",,,,,A+,,,https://www.bbb.org/us/ca/el-sobrante/profile/general-engineering-contractor/ghs-landscaping-inc-1116-310849,BBB
GibbonsPlumbingInc,(925) 570-5117,1490 Renown Dr,Tracy,CA,95376,,,Heating and Air Conditioning,,,,,A+,,,https://www.bbb.org/us/ca/tracy/profile/heating-and-air-conditioning/gibbons-plumbing-inc-1156-90085083,BBB
"Glover & Son Heating Air Conditioning, Inc.",(510) 657-6741,6553 Thornton Ave,Newark,CA,94560,,,"Heating Contractors, Heating and Air Conditioning, Air Conditioning Contractors",,,,,A+,,,https://www.bbb.org/us/ca/newark/profile/heating-contractors/glover-son-heating-air-conditioning-inc-1116-33030/addressId/169943,BBB
"Golden Gate HomeRepair, Inc.",(415) 892-3932,394 Bel Marin Keys Blvd STE 5,Novato,CA,94949,,,"Building Contractors, Construction Services, Home Improvement",,,,,A+,,,https://www.bbb.org/us/ca/novato/profile/building-contractors/design-build-specialists-inc-1116-41552,BBB
Golden Grove Roofing and Construction,(925) 272-8248,1990 N California Blvd,"8th Floor , Walnut Creek",CA,94596,,,"General Contractor, Roofing Contractors, Metal Roofing Contractors",,,,,A-,,,https://www.bbb.org/us/ca/walnut-creek/profile/general-contractor/golden-grove-roofing-and-construction-1116-978193,BBB
Golden Space Construction,(510) 999-0102,El Sobrante,Oakland,CA,,,,"General Contractor, Landscape Contractors, Retaining Wall Contractors",,,,,A-,,,https://www.bbb.org/us/ca/el-sobrante/profile/general-contractor/golden-space-construction-1116-973122,BBB
"Golden State Builders Group, Inc.",(844) 472-8326,Walnut Creek,Oakland,CA,,,,"General Contractor, Painting Contractors, Siding Contractors",,,,,A,,,https://www.bbb.org/us/ca/walnut-creek/profile/general-contractor/golden-state-builders-group-inc-1116-959297,BBB
GoodrichPlumbingInc.,,265 Kensington Way,San Francisco,CA,94127,,,Heating and Air Conditioning,,,,,A+,,,https://www.bbb.org/us/ca/san-francisco/profile/heating-and-air-conditioning/goodrich-plumbing-inc-1116-946321,BBB
Gosal Heating & Air Conditioning,(510) 441-2318,Union City,Oakland,CA,,,,"Heating Contractors, Heating and Air Conditioning, Air Conditioning Contractors",,,,,A+,,,https://www.bbb.org/us/ca/union-city/profile/heating-contractors/gosal-heating-air-conditioning-1116-28604,BBB
"Got Watts Electric, Solar, &HVAC",(925) 421-0411,2045 Commerce Ave,Concord,CA,94520,,,"Electrical Contractors, Electrician, Heating and Air Conditioning",,,,,A+,,,https://www.bbb.org/us/ca/concord/profile/electrical-contractors/got-watts-electric-solar-hvac-1116-875867,BBB
GPAMechanicalServices,(510) 886-1090,2767 Tribune Avenue,Hayward,CA,94542,,,Heating Contractors,,,,,,,,https://www.bbb.org/us/ca/hayward/profile/heating-contractors/gpa-mechanical-services-1116-308281,BBB
"Green Air Heating and Air Conditioning, Inc.",(925) 284-7336,3953 Industrial Way,Concord,CA,94520,,,"Heating Contractors, Heating and Air Conditioning, Residential Air Conditioning Contractors",,,,,A+,,,https://www.bbb.org/us/ca/concord/profile/heating-contractors/green-air-heating-and-air-conditioning-inc-1116-207445,BBB
Green Mechanics,(510) 774-1841,34550 Shenandoah Pl,Fremont,CA,94555,,,Residential Air Conditioning Contractors,,,,,,,,https://www.bbb.org/us/ca/fremont/profile/residential-air-conditioning-contractors/green-mechanics-1116-382660,BBB
Greenlief Energy,(415) 342-8624,Petaluma,Oakland,CA,,,,"Heating and Air Conditioning, Solar Energy Contractors, Ventilating Contractors",,,,,A+,,,https://www.bbb.org/us/ca/petaluma/profile/heating-and-air-conditioning/greenlief-energy-1116-926302,BBB
Griggs Construction,(510) 387-1100,Oakland,Oakland,CA,,,,"General Contractor, Fence Contractors, Patios and Decks",,,,,A+,,,https://www.bbb.org/us/ca/oakland/profile/general-contractor/griggs-construction-1116-926991,BBB
GriswoldMechanicalCorporation,(925) 634-9510,950 Detroit Ave Ste 14,Concord,CA,94518,,,"Heating Contractors, Plumber, Heating and Air Conditioning",,,,,A+,,,https://www.bbb.org/us/ca/concord/profile/heating-contractors/griswold-mechanical-corporation-1116-219921,BBB
H & H Builders & Remodelers,(510) 282-5503,130 Doolittle Dr Ste 21,San Leandro,CA,94577,,,"General Contractor, Remodel Contractors, Building Contractors",,,,,A+,,,https://www.bbb.org/us/ca/san-leandro/profile/general-contractor/h-h-builders-remodelers-1116-147393,BBB
Hammer's Heating &AirConditioning,(925) 229-2779,Martinez,Oakland,CA,,,,"Heating Contractors, Air Conditioning Contractors, Air Duct Cleaning",,,,,A+,,,https://www.bbb.org/us/ca/martinez/profile/heating-contractors/hammers-heating-air-conditioning-1116-28611,BBB
Hammerhouse Construction,(415) 516-7399,San Francisco,Oakland,CA,,,,"General Contractor, Home Improvement, Remodel Contractors",,,,,A+,,,https://www.bbb.org/us/ca/san-francisco/profile/general-contractor/hammerhouse-construction-1116-438414,BBB
"Handy Construction Team, Inc.",(650) 273-1500,S San Fran,Oakland,CA,,,,"General Contractor, Building Contractors, Foundation Repair",,,,,A+,,,https://www.bbb.org/us/ca/s-san-fran/profile/general-contractor/handy-construction-team-inc-1116-302941,BBB
HarrisonMechanicalService,(408) 615-8531,2717 Toledo Ave,Santa Clara,CA,95051,,,Heating Contractors,,,,,,,,https://www.bbb.org/us/ca/santa-clara/profile/heating-contractors/harrison-mechanical-service-1216-221850,BBB
"Hassler Heating & Air Conditioning, Inc.",(510) 848-3030,El Cerrito,Oakland,CA,,,,"Water Heater Repair, Plumber, Heating and Air Conditioning",,,,,A+,,,https://www.bbb.org/us/ca/el-cerrito/profile/water-heater-repair/hassler-heating-air-conditioning-inc-1116-223985,BBB
Hawthorne Construction Management,(415) 722-2976,San Francisco,Oakland,CA,,,,"General Contractor, Bathroom Remodel, Remodel Contractors",,,,,A,,,https://www.bbb.org/us/ca/san-francisco/profile/general-contractor/hawthorne-construction-management-1116-966771,BBB
HearthGeneralContracting,(415) 902-1777,San Francisco,Oakland,CA,,,,"Building Contractors, General Contractor, Construction Services",,,,,A+,,,https://www.bbb.org/us/ca/san-francisco/profile/building-contractors/hearth-general-contracting-1116-450181,BBB
Heating & Air Conditioning Co,(925) 854-6005,803 Camino Ramon,Danville,CA,94526,,,Mechanical Contractors,,,,,,,,https://www.bbb.org/us/ca/danville/profile/mechanical-contractors/heating-air-conditioning-co-1116-903320,BBB
