name,phone,address,city,state,zip_code,email,website,category,license_number,license_type,license_expiry,types_of_work,bbb_rating,google_rating,review_count,bbb_profile_url,source
"10G Heating Cooling Plumbing , LLC",(641) 373-2174,317 NE Allison Ave,Elkhart,IA,50073,,,"Heating and Air Conditioning, Plumbing and Heating",,,,,A+,,,https://www.bbb.org/us/ia/elkhart/profile/heating-and-air-conditioning/10g-heating-cooling-plumbing-llc-0664-32155507,BBB
"1st Class Plumbing, Heating & Air Conditioning",(402) 209-4846,319 S 11th St,Nebraska City,NE,68410,,,"Plumber, Heating and Air Conditioning, Air Conditioning Contractors",,,,,A+,,,https://www.bbb.org/us/ne/nebraska-city/profile/plumber/1st-class-plumbing-heating-air-conditioning-0714-300059689,BBB
"1st Priority Heating & Cooling and Construction, LLC",(816) 785-3126,118 N Conistor Ln Ste B229,Liberty,MO,64068,,,"Heating and Air Conditioning, Air Conditioning Contractors, Air Duct Cleaning",,,,,A+,,,https://www.bbb.org/us/mo/liberty/profile/heating-and-air-conditioning/1st-priority-heating-cooling-and-construction-llc-0714-1000002225,BBB
323 Heating & Cooling LLC,(816) 551-8321,Excelsior Springs,Des Moines,IA,,,,"Mechanical Contractors, Heating and Air Conditioning, Air Conditioning Contractors",,,,,A+,,,https://www.bbb.org/us/mo/excelsior-springs/profile/mechanical-contractors/323-heating-cooling-llc-0714-1000045505,BBB
72 Degrees Heating Cooling Plumbing & Electrical,(515) 965-7272,1202 Thomas Beck Rd Ste 101,Des Moines,IA,50315,,,"Heating and Air Conditioning, Residential Air Conditioning Contractors, Heating Contractors",,,,,A+,,,https://www.bbb.org/us/ia/des-moines/profile/heating-and-air-conditioning/72-degrees-heating-cooling-plumbing-electrical-0664-21000002,BBB
816Mechanical,(816) 323-9059,11608 NE 144th St,Kearney,MO,64060,,,"Heating and Air Conditioning, Air Conditioning Contractors, Air Conditioning Repair",,,,,A+,,,https://www.bbb.org/us/mo/kearney/profile/heating-and-air-conditioning/816-mechanical-0714-1000047790,BBB
"A B Construction, LLC",(573) 822-4657,29042 State Hwy N,Ewing,MO,63440,,,"Drywall Contractors, Construction Services, Home Improvement",,,,,A+,,,https://www.bbb.org/us/mo/ewing/profile/drywall-contractors/a-b-construction-llc-0734-1000002950,BBB
A J AllenMechanicalContractorsInc,(515) 697-3500,PO Box 931,Des Moines,IA,50304,,,Plumber,,,,,,,,https://www.bbb.org/us/ia/des-moines/profile/plumber/a-j-allen-mechanical-contractors-inc-0664-100054/addressId/489,BBB
A Plus Heating & Cooling,(402) 289-2970,Waterloo,Winterset,IA,,,,"Heating and Air Conditioning, Air Conditioning Contractors, Air Conditioning Repair",,,,,A+,,,https://www.bbb.org/us/ne/waterloo/profile/heating-and-air-conditioning/a-plus-heating-cooling-0714-118000118,BBB
"A Touch of Heaven's Development, LLC",(309) 612-8239,Cedar Rapids,Des Moines,IA,,,,"Home Improvement, General Contractor, Siding Contractors",,,,,A+,,,https://www.bbb.org/us/ia/cedar-rapids/profile/home-improvement/a-touch-of-heavens-development-llc-0664-32158763,BBB
A&S Premier Construction LLC,(319) 299-8326,135 15th St SW,Cedar Rapids,IA,52404,,,"General Contractor, Roofing Contractors, Lawn Maintenance",,,,,A,,,https://www.bbb.org/us/ia/cedar-rapids/profile/general-contractor/as-premier-construction-llc-0664-32158638,BBB
"A&SMechanicalHVAC, Inc.",(913) 601-2711,Lenexa,Centerville,IA,,,,"Heating and Air Conditioning, Air Conditioning Contractors, Air Conditioning Repair",,,,,A+,,,https://www.bbb.org/us/ks/lenexa/profile/heating-and-air-conditioning/as-mechanical-hvac-inc-0714-1000029745,BBB
"A-1 United Heating, Air & Electrical Co., Inc.",(402) 593-7500,4972 F St,Omaha,NE,68117,,,"Heating and Air Conditioning, Electrician, Air Conditioning Contractors",,,,,A+,,,https://www.bbb.org/us/ne/omaha/profile/heating-and-air-conditioning/a-1-united-heating-air-electrical-co-inc-0714-104000616,BBB
A.B. May,(816) 705-2751,7100 E 50th St,Kansas City,MO,64129,,,"Heating and Air Conditioning, Plumber, Electrician",,,,,A+,,,https://www.bbb.org/us/mo/kansas-city/profile/heating-and-air-conditioning/ab-may-0714-62030001,BBB
A2ZHeatingandPlumbingInc,(319) 351-2743,PO Box 530,North Liberty,IA,52317,,,Heating and Air Conditioning,,,,,A+,,,https://www.bbb.org/us/ia/north-liberty/profile/heating-and-air-conditioning/a2z-heating-and-plumbing-inc-0664-32067309/addressId/27218,BBB
A2ZMechanicalContractorsInc,(319) 351-2743,PO Box 530,North Liberty,IA,52317,,,Heating and Air Conditioning,,,,,A+,,,https://www.bbb.org/us/ia/north-liberty/profile/heating-and-air-conditioning/a2z-heating-and-plumbing-inc-0664-32067309/addressId/27218,BBB
AAA Construction & Roofing LLC,(319) 440-7940,4416 Regal Ave NE,Cedar Rapids,IA,52402,,,"Roofing Contractors, General Contractor, Painting Contractors",,,,,A+,,,https://www.bbb.org/us/ia/cedar-rapids/profile/roofing-contractors/aaa-construction-roofing-llc-0664-32101469,BBB
AAAMechanicalContractorsInc,(319) 351-1843,PO Box 805,Iowa City,IA,52244,,,Mechanical Contractors,,,,,A+,,,https://www.bbb.org/us/ia/iowa-city/profile/mechanical-contractors/aaa-mechanical-contractors-inc-0664-32067284,BBB
"Aaron's Services, LLC",(816) 471-7890,207 NE 72nd St Ste. C,Kansas City,MO,64118,,,Heating and Air Conditioning,,,,,A+,,,https://www.bbb.org/us/mo/kansas-city/profile/heating-and-air-conditioning/aarons-services-llc-0714-1000002077/addressId/245369,BBB
Able Appliance Repair,(816) 415-3663,1626 Welleslay Ln,Liberty,MO,64068,,,"Major Appliance Services, Residential Air Conditioning Contractors, Appliance Repair",,,,,A+,,,https://www.bbb.org/us/mo/liberty/profile/major-appliance-services/able-appliance-repair-0714-1000062233/addressId/264812,BBB
Able Appliance Repair,(816) 254-5350,16609 E 31st Ter S,Independence,MO,64055,,,"Major Appliance Services, Residential Air Conditioning Contractors, Appliance Repair",,,,,A+,,,https://www.bbb.org/us/mo/independence/profile/major-appliance-services/able-appliance-repair-0714-1000062234/addressId/264815,BBB
"Above & Beyond Heating and Air Conditioning, LLC",(319) 224-0700,44 Sturgis Corner Dr Ste 15,Iowa City,IA,52246,,,"Air Conditioning Contractors, Heating and Air Conditioning, Heating Contractors",,,,,A+,,,https://www.bbb.org/us/ia/iowa-city/profile/air-conditioning-contractor/above-beyond-heating-and-air-conditioning-llc-0664-32132258,BBB
"Abraham Heating & Air Conditioning, Inc.",(402) 885-3134,1725 S 42ND Street #10,Omaha,NE,68131,,,"Heating and Air Conditioning, Air Conditioning Contractors, Air Conditioning Repair",,,,,A+,,,https://www.bbb.org/us/ne/omaha/profile/heating-and-air-conditioning/abraham-heating-air-conditioning-inc-0714-104000617,BBB
"Abraham Heating & Air Conditioning, Inc.",(402) 553-3353,PO Box 541193,Omaha,NE,68154,,,"Heating and Air Conditioning, Air Conditioning Contractors, Air Conditioning Repair",,,,,A+,,,https://www.bbb.org/us/ne/omaha/profile/heating-and-air-conditioning/abraham-heating-air-conditioning-inc-0714-104000617/addressId/270276,BBB
"Absolute Comfort Technologies, Inc.",(816) 442-8154,8248 NW 101st Ter Ste 16,Kansas City,MO,64153,,,"Heating and Air Conditioning, Air Conditioning Contractors, Residential Air Conditioning Contractors",,,,,A+,,,https://www.bbb.org/us/mo/kansas-city/profile/heating-and-air-conditioning/absolute-comfort-technologies-inc-0714-99151213,BBB
"Absolute Plumbing, Heating & Pumps, Inc.",(608) 326-4800,520 Mooney St Ste 2,Prairie du Chien,WI,53821,,,"Plumber, Heating and Air Conditioning, Septic Tank Contractors",,,,,,,,https://www.bbb.org/us/wi/prairie-du-chien/profile/plumber/absolute-plumbing-heating-pumps-inc-0694-25000140,BBB
AC Cleaning Services,(402) 850-3727,PO Box 31577,Omaha,NE,68131,,,"Janitor Service, Cleaning Services, Pressure Washing",,,,,A+,,,https://www.bbb.org/us/ne/omaha/profile/janitor-service/ac-cleaning-services-0714-300047662/addressId/105156,BBB
Ace Refrigeration and Plumbing,(319) 363-9209,6440 6th St SW,Cedar Rapids,IA,52404,,,Mechanical Contractors,,,,,,,,https://www.bbb.org/us/ia/cedar-rapids/profile/mechanical-contractors/ace-refrigeration-and-plumbing-0664-32007689,BBB
"ACG Builders, LLC",(712) 830-7860,110 6th Ave,Coon Rapids,IA,50058,,,"General Contractor, Concrete Contractors",,,,,A+,,,https://www.bbb.org/us/ia/coon-rapids/profile/general-contractor/acg-builders-llc-0664-32058296,BBB
ACIMechanicalInc,(515) 232-1236,2182 231st Ln,Ames,IA,50014,,,Mechanical Contractors,,,,,A,,,https://www.bbb.org/us/ia/ames/profile/mechanical-contractors/aci-mechanical-inc-0664-32156580,BBB
"ACM Heating, Cooling and Electrical, LLC",(712) 323-1960,Council Bluffs,Des Moines,IA,,,,"Heating and Air Conditioning, Concrete Contractors, Electrician",,,,,A+,,,https://www.bbb.org/us/ia/council-bluffs/profile/heating-and-air-conditioning/acm-heating-cooling-and-electrical-llc-0714-300053908,BBB
"Action PlusPlumbing,Heating&Cooling, LLC",(515) 450-9302,324 Aaron Ave NW,Bondurant,IA,50035,,,Plumber,,,,,,,,https://www.bbb.org/us/ia/bondurant/profile/plumber/action-plus-plumbing-heating-cooling-llc-0664-32067688,BBB
"ActionPlumbing,Heating, A/C, & Electrical",(402) 423-6960,4101 S 8th St,Lincoln,NE,68502,,,"Plumber, Heating and Air Conditioning, Air Conditioning Contractors",,,,,A+,,,https://www.bbb.org/us/ne/lincoln/profile/plumber/action-plumbing-heating-ac-electrical-0714-208000003,BBB
Active Thermal Concepts Inc,(319) 393-8088,2805 Stonegate Ct,Hiawatha,IA,52233,,,Mechanical Contractors,,,,,A+,,,https://www.bbb.org/us/ia/hiawatha/profile/mechanical-contractors/active-thermal-concepts-inc-0664-5026849,BBB
"Advanced AirMechanical, Inc.",(515) 226-4008,609 1/2 S 19th Street,West Des Moines,IA,50265,,,Heating Contractors,,,,,A+,,,https://www.bbb.org/us/ia/west-des-moines/profile/heating-contractors/advanced-air-mechanical-inc-0664-32011779,BBB
Advanced Comfort and Refrigeration LLC,(816) 729-0739,4959 N College Ave,Kansas City,MO,64119,,,"Heating and Air Conditioning, Air Conditioning Repair, Residential Air Conditioning Contractors",,,,,A,,,https://www.bbb.org/us/mo/kansas-city/profile/heating-and-air-conditioning/advanced-comfort-and-refrigeration-llc-0714-1000057935,BBB
"Advanced Electric &Mechanical, LLC",(402) 960-5666,13002 Overland Trl,Council Bluffs,IA,51503,,,"Commercial Electrician, Electrician, Heating and Air Conditioning",,,,,,,,https://www.bbb.org/us/ia/council-bluffs/profile/commercial-electrician/advanced-electric-mechanical-llc-0714-300095142,BBB
Advanced Heating and Air Conditioning,(402) 359-2213,232 N West St,Valley,NE,68064,,,"Heating and Air Conditioning, Air Conditioning Contractors, Air Conditioning Repair",,,,,A+,,,https://www.bbb.org/us/ne/valley/profile/heating-and-air-conditioning/advanced-heating-and-air-conditioning-0714-127001197/addressId/59184,BBB
AdvantageMechanicalLLC,(701) 202-1471,202 N Cedar Ave. Suite 1,Owatonna,MN,55060,,,Mechanical Contractors,,,,,A+,,,https://www.bbb.org/us/mn/owatonna/profile/mechanical-contractors/advantage-mechanical-llc-0704-1000064906/addressId/287546,BBB
"Affordable Concrete, Inc.",(402) 690-2339,Omaha,Waukee,IA,,,,"Concrete Contractors, Roofing Contractors, General Contractor",,,,,A+,,,https://www.bbb.org/us/ne/omaha/profile/concrete-contractors/affordable-concrete-inc-0714-300030575,BBB
Affordable Gutters-N-More LLC,(573) 819-9818,704 Big Bear Blvd Ste A,Columbia,MO,65202,,,"General Contractor, Roofing Contractors, Construction Services",,,,,A+,,,https://www.bbb.org/us/mo/columbia/profile/general-contractor/affordable-gutters-n-more-llc-0734-310593028,BBB
"Affordable Heating & Air, LLC",(712) 784-4328,907 E 7th St,Atlantic,IA,50022,,,"Heating and Air Conditioning, Air Conditioning Contractors, Air Conditioning Repair",,,,,,,,https://www.bbb.org/us/ia/atlantic/profile/heating-and-air-conditioning/affordable-heating-air-llc-0714-300057883,BBB
Affordable Services LLC,(641) 569-9600,150 Pella Ave,Oskaloosa,IA,52577,,,Heating and Air Conditioning,,,,,A+,,,https://www.bbb.org/us/ia/oskaloosa/profile/heating-and-air-conditioning/affordable-services-llc-0664-32098268,BBB
Affordable Services LLC,(641) 295-1798,P.O.Box 1132,Oskaloosa,IA,52577,,,Heating and Air Conditioning,,,,,A+,,,https://www.bbb.org/us/ia/oskaloosa/profile/heating-and-air-conditioning/affordable-services-llc-0664-32098268/addressId/43841,BBB
"Air & Heat Doctor, LLC",(608) 475-9984,24599 Pier Springs Rd,Richland Center,WI,53581,,,"Heating and Air Conditioning, Air Conditioning Contractors, Air Conditioning Repair",,,,,A+,,,https://www.bbb.org/us/wi/richland-center/profile/heating-and-air-conditioning/air-heat-doctor-llc-0694-1000014892,BBB
Air Care Heating & Air Conditioning,(712) 256-3432,4121 S 9th St # 1,Council Bluffs,IA,51501,,,"Heating and Air Conditioning, Air Conditioning Contractors, Air Conditioning Repair",,,,,A+,,,https://www.bbb.org/us/ia/council-bluffs/profile/heating-and-air-conditioning/air-care-heating-air-conditioning-0714-300070499,BBB
Air Con Electric/Plumbing/Hvac,(515) 243-5500,3121 SE 14th St,Des Moines/Johnston,IA,50320,,,Air Conditioning Contractors,,,,,A+,,,https://www.bbb.org/us/ia/des-moinesjohnston/profile/air-conditioning-contractor/air-con-electricplumbinghvac-0664-32067701,BBB
Air Services Inc,(319) 287-5858,2213 Laporte Rd,Waterloo,IA,50702,,,"Heating and Air Conditioning, Air Conditioning Contractors, Geothermal Heat Pumps",,,,,A+,,,https://www.bbb.org/us/ia/waterloo/profile/heating-and-air-conditioning/air-services-inc-0664-32024204,BBB
"Air Solutions Heating & Air Conditioning, LLC",(816) 807-6390,1205 Berry Rd,Independence,MO,64057,,,"Heating and Air Conditioning, Residential Air Conditioning Contractors, Heating Contractors",,,,,A+,,,https://www.bbb.org/us/mo/independence/profile/heating-and-air-conditioning/air-solutions-heating-air-conditioning-llc-0714-1000014866,BBB
Air Temp Plg Htg AndCoolingInc.,(515) 386-7116,1104 Grant St,Scranton,IA,51462,,,Plumbing and Heating,,,,,,,,https://www.bbb.org/us/ia/scranton/profile/plumbing-and-heating/air-temp-plg-htg-and-cooling-inc-0664-32137628,BBB
Air Unlimited Heating and Cooling,(816) 286-7258,701 Haines Ste 100,Liberty,MO,64068,,,"Heating and Air Conditioning, Air Conditioning Contractors, Air Duct Cleaning",,,,,A+,,,https://www.bbb.org/us/mo/liberty/profile/heating-and-air-conditioning/air-unlimited-heating-and-cooling-0714-1000000526,BBB
"Air/Tech Mechanical of Rochester, Inc.",(507) 281-7933,PO Box 936,Byron,MN,55920,,,"Heating and Air Conditioning, Air Purification Systems",,,,,A+,,,https://www.bbb.org/us/mn/byron/profile/heating-and-air-conditioning/airtech-mechanical-of-rochester-inc-0704-96008773,BBB
Aire Serv of Council Bluffs,(712) 256-4443,3319 Nebraska Ave Ste 2,Council Bluffs,IA,51501,,,"Heating and Air Conditioning, Air Conditioning Contractors, Duct Cleaning",,,,,A+,,,https://www.bbb.org/us/ia/council-bluffs/profile/heating-and-air-conditioning/aire-serv-of-council-bluffs-0714-300016679,BBB
AirFree Duct Cleaning Inc,(515) 986-3424,PO Box 376,Grimes,IA,50111,,,"Air Duct Cleaning, Air Conditioning Contractors, Duct Cleaning",,,,,A+,,,https://www.bbb.org/us/ia/grimes/profile/air-duct-cleaning/air-free-duct-cleaning-inc-0664-5025438/addressId/2459,BBB
"Airstream Heating and Cooling, LLC",(402) 414-7083,Auburn,Winterset,IA,,,,"Heating and Air Conditioning, Air Conditioning Contractors, Air Conditioning Repair",,,,,A+,,,https://www.bbb.org/us/ne/auburn/profile/heating-and-air-conditioning/airstream-heating-and-cooling-llc-0714-300174090,BBB
aksarben® ARS,(402) 331-1233,7070 S 108th St,Lavista,NE,68128,,,"Heating and Air Conditioning, Plumber, Electrician",,,,,A+,,,https://www.bbb.org/us/ne/lavista/profile/heating-and-air-conditioning/aksarben%C2%AE-ars-0714-104000658/addressId/36316,BBB
Al4u Mechanical,(563) 219-1644,835 11th Ave S,Clinton,IA,52732,,,"Plumbing and Heating, Air Conditioning Repair, Pipe and Boiler Covering Contractors",,,,,A+,,,https://www.bbb.org/us/ia/clinton/profile/plumbing-and-heating/al4u-mechanical-0664-32074956,BBB
Alan Heating & Air,(309) 221-8648,21 Lake Warren Dr,Monmouth,IL,61462,,,"Residential Air Conditioning Contractors, Heating and Air Conditioning, Air Conditioning Contractors",,,,,,,,https://www.bbb.org/us/il/monmouth/profile/residential-air-conditioning-contractors/alan-heating-air-0724-90026917,BBB
"All American Heating & Cooling, Inc.",(816) 452-1266,6333 N Oak Trfy,Gladstone,MO,64118,,,"Heating and Air Conditioning, Air Conditioning Contractors, Residential Air Conditioning Contractors",,,,,A+,,,https://www.bbb.org/us/mo/gladstone/profile/heating-and-air-conditioning/all-american-heating-cooling-inc-0714-91100007,BBB
"All Appliance Service, Inc.",(402) 553-0900,7016 Maple St STE 12,Omaha,NE,68104,,,"Appliance Repair, Air Conditioning Repair, Major Appliance Services",,,,,A+,,,https://www.bbb.org/us/ne/omaha/profile/appliance-repair/all-appliance-service-inc-0714-104000663,BBB
All Around Mobile Home Repair,(608) 350-9338,1044 Darwin Ct,Onalaska,WI,54650,,,"Manufactured Home Repair, Roofing Contractors, Heating and Air Conditioning",,,,,A,,,https://www.bbb.org/us/wi/onalaska/profile/manufactured-home-repair/all-around-mobile-home-repair-0694-1000060324,BBB
All Day Comfort Heating and Cooling LLC,(816) 916-4606,Independence,Centerville,IA,,,,"Heating and Air Conditioning, Air Conditioning Repair, Residential Air Conditioning Contractors",,,,,A+,,,https://www.bbb.org/us/mo/independence/profile/heating-and-air-conditioning/all-day-comfort-heating-and-cooling-llc-0714-1000008336,BBB
All Eastern Iowa Gutter,(319) 364-5724,1732 E Ave NE,Cedar Rapids,IA,52402,,,"Gutter Contractors, General Contractor, Gutters",,,,,A+,,,https://www.bbb.org/us/ia/cedar-rapids/profile/gutter-contractor/all-eastern-iowa-gutter-0664-32009267,BBB
All ProMechanicalLLC,(563) 322-7467,223 Oak Street,Davenport,IA,52802,,,Mechanical Contractors,,,,,,,,https://www.bbb.org/us/ia/davenport/profile/mechanical-contractors/all-pro-mechanical-llc-0664-32106617,BBB
"All Remodeling, Inc.",(712) 328-3038,1032 Woodbury Ave # 3,Council Bluffs,IA,51503,,,"Construction Services, General Contractor, Remodel Contractors",,,,,A+,,,https://www.bbb.org/us/ia/council-bluffs/profile/construction-services/all-remodeling-inc-0714-104002468,BBB
All SeasonsMechanical,(208) 407-0134,1223 NE Windsor Dr,Ankeny,IA,50021,,,Air Conditioning Contractors,,,,,,,,https://www.bbb.org/us/ia/ankeny/profile/air-conditioning-contractor/all-seasons-mechanical-0664-32132458,BBB
All StarPlumbingandHeating,(319) 988-3253,926 Dale Dr.,Hudson,IA,50643,,,Heating and Air Conditioning,,,,,A+,,,https://www.bbb.org/us/ia/hudson/profile/heating-and-air-conditioning/all-star-plumbing-and-heating-0664-32025555,BBB
All Year Round Heating & Cooling LLC,(816) 200-4169,Buckner,Centerville,IA,,,,"Heating and Air Conditioning, Air Conditioning Contractors, Air Conditioning Repair",,,,,A+,,,https://www.bbb.org/us/mo/buckner/profile/heating-and-air-conditioning/all-year-round-heating-cooling-llc-0714-1000000281,BBB
"All-Temp Refrigeration, Inc",(319) 362-8367,5907 4th St SW STE 250,Cedar Rapids,IA,52404,,,Mechanical Contractors,,,,,A+,,,https://www.bbb.org/us/ia/cedar-rapids/profile/mechanical-contractors/all-temp-refrigeration-inc-0664-32055277,BBB
"Allen's Electric, Inc.",(816) 935-8684,Sugar Creek,Winterset,IA,,,,"Heating and Air Conditioning, Electrical Contractors, Plumbing and Heating",,,,,A+,,,https://www.bbb.org/us/mo/sugar-creek/profile/heating-and-air-conditioning/allens-electric-inc-0714-1000023794,BBB
Allen'sHVACLLC,(816) 379-6616,Grain Valley,Centerville,IA,,,,"Heating and Air Conditioning, Air Conditioning Contractors, Air Duct Cleaning",,,,,A-,,,https://www.bbb.org/us/mo/grain-valley/profile/heating-and-air-conditioning/allens-hvac-llc-0714-1000075142,BBB
Allis Demolition & Hauling,(402) 301-5087,PO Box 574,Elkhorn,NE,68022,,,"Demolition Contractors, Fire and Water Damage Restoration, Home Renovation",,,,,A+,,,https://www.bbb.org/us/ne/elkhorn/profile/demolition-contractors/allis-demolition-hauling-0714-300164895,BBB
Alpha Elite Contracting,(573) 823-8069,111 E Mauller Rd,Columbia,MO,65202,,,"Remodel Contractors, Roofing Contractors, General Contractor",,,,,A+,,,https://www.bbb.org/us/mo/columbia/profile/remodel-contractors/alpha-elite-contracting-0734-1000051916,BBB
AltmanMechanicalLLC,(608) 647-7902,20860 Oxford School Rd,Richland Ctr,WI,53581,,,"Heating and Air Conditioning, Air Conditioning Contractors, Heating Contractors",,,,,A+,,,https://www.bbb.org/us/wi/richland-ctr/profile/heating-and-air-conditioning/j-m-heating-and-cooling-0694-4023688,BBB
Ambient Control Systems,(641) 919-2000,609 Pleasant Plain Rd,Fairfield,IA,52556,,,"Geothermal Heat Pumps, Heating Contractors, Heat Pumps",,,,,A+,,,https://www.bbb.org/us/ia/fairfield/profile/geothermal-heat-pump/ambient-control-systems-0664-32041294,BBB
AMC Mechanical Inc.,(515) 227-8379,2265 Dakota Wood Dr,Pella,IA,50219,,,Heating and Air Conditioning,,,,,,,,https://www.bbb.org/us/ia/pella/profile/heating-and-air-conditioning/amc-mechanical-inc-0664-32138113,BBB
AMCMechanical,(641) 628-8590,107 Vermeer Road,Pella,IA,50219,,,Mechanical Contractors,,,,,A+,,,https://www.bbb.org/us/ia/pella/profile/mechanical-contractors/amc-mechanical-0664-32130934,BBB
American Boiler Company,(402) 346-8100,2424 Deer Park Blvd,Omaha,NE,68105,,,"Boiler Repair, Mechanical Contractors, Pipe Fittings",,,,,A+,,,https://www.bbb.org/us/ne/omaha/profile/boiler-repair/american-boiler-company-0714-130000173,BBB
"American Home Renovations, L.L.C.",(515) 508-9739,10503 NE 82nd Ave,Bondurant,IA,50035,,,"General Contractor, Roofing Contractors, Concrete Contractors",,,,,A,,,https://www.bbb.org/us/ia/bondurant/profile/general-contractor/american-home-renovations-llc-0664-32158882,BBB
American Water Resources,(866) 430-0819,5201 Grand Ave,Davenport,IA,52807,,,"Water and Sewer Line Protection, Heating and Air Conditioning, Air Conditioning Repair",,,,,A+,,,https://www.bbb.org/us/ia/davenport/profile/water-and-sewer-line-protection/american-water-resources-0664-32021908/addressId/89359,BBB
AmericanHeating&Cooling,(573) 384-5803,19 Highway Ra,Silex,MO,63377,,,"Air Conditioning Contractors, Concrete Contractors, Excavating Contractors",,,,,A+,,,https://www.bbb.org/us/mo/silex/profile/air-conditioning-contractor/american-hvac-llc-0734-310362539,BBB
AmericanMechanical,(515) 259-7273,3105 SE Enterprise Dr,Grimes,IA,50111,,,Commercial Air Conditioning Contractors,,,,,,,,https://www.bbb.org/us/ia/grimes/profile/commercial-air-conditioning-contractors/american-mechanical-0664-32070595/addressId/29113,BBB
Americlean,(319) 362-0604,1410 Rockford Rd SW,Cedar Rapids,IA,52404,,,"Carpet and Rug Cleaners, Cleaning Services, Air Duct Cleaning",,,,,A+,,,https://www.bbb.org/us/ia/cedar-rapids/profile/carpet-and-rug-cleaners/americlean-0664-8000035,BBB
AmeriPro Roofing,(800) 200-8151,4436 114th St,Des Moines,IA,50322,,,"Roofing Contractors, General Contractor, Siding Contractors",,,,,A+,,,https://www.bbb.org/us/ia/des-moines/profile/roofing-contractors/ameripro-roofing-0664-32061272/addressId/86888,BBB
"Andersen Exteriors, LLC",(402) 680-2641,2 W Main St,Treynor,IA,51575,,,"Roofing Contractors, General Contractor, Siding Contractors",,,,,A+,,,https://www.bbb.org/us/ia/treynor/profile/roofing-contractors/andersen-exteriors-llc-0714-300029612,BBB
Anderson Service,(515) 669-5159,1999 290th St,Stanhope,IA,50246,,,"Heating and Air Conditioning, Mechanical Contractors",,,,,A+,,,https://www.bbb.org/us/ia/stanhope/profile/heating-and-air-conditioning/anderson-service-0664-32081528,BBB
"Anthem Heating & Cooling, Inc.",(515) 249-2581,124 South Mill St,Gilman,IA,50106,,,"Heating and Air Conditioning, Air Conditioning Contractors, Heating Contractors",,,,,A+,,,https://www.bbb.org/us/ia/gilman/profile/heating-and-air-conditioning/anthem-heating-cooling-inc-0664-32159005,BBB
"AnthonyPlumbing,Heating,Cooling& Electric",(913) 286-5929,15203 W 99th St,Lenexa,KS,66219,,,"Heating and Air Conditioning, Electrician, Residential Air Conditioning Contractors",,,,,A,,,https://www.bbb.org/us/ks/lenexa/profile/heating-and-air-conditioning/anthony-plumbing-heating-cooling-electric-0714-94070011,BBB
"Apex Heating and Air Conditioning, Inc.",(816) 228-2739,1202 NW Eagle Ridge Blvd,Grain Valley,MO,64029,,,"Heating and Air Conditioning, Residential Air Conditioning Contractors, Commercial Air Conditioning Contractors",,,,,A+,,,https://www.bbb.org/us/mo/grain-valley/profile/heating-and-air-conditioning/apex-heating-and-air-conditioning-inc-0714-99142570,BBB
Apex Services Heating Cooling Plumbing,(402) 289-3082,21008 Cumberland Dr Ste 102,Elkhorn,NE,68022,,,"Heating and Air Conditioning, Plumber, Air Conditioning Contractors",,,,,A+,,,https://www.bbb.org/us/ne/elkhorn/profile/heating-and-air-conditioning/apex-services-heating-cooling-plumbing-0714-300038295,BBB
APM Construction Services LLC,(573) 777-7261,2316 Industrial Dr,Columbia,MO,65202,,,"General Contractor, Construction Services, Concrete Contractors",,,,,A+,,,https://www.bbb.org/us/mo/columbia/profile/general-contractor/apm-construction-services-llc-0734-310604463,BBB
Apollo Heating & Air,(712) 527-5291,202 Sharp St,Glenwood,IA,51534,,,"Heating and Air Conditioning, Air Conditioning Contractors, Air Duct Cleaning",,,,,A+,,,https://www.bbb.org/us/ia/glenwood/profile/heating-and-air-conditioning/apollo-heating-air-0714-104007276/addressId/284034,BBB
Apollo Heating & Air,(402) 291-5808,114 W Mission Ave,Bellevue,NE,68005,,,"Heating and Air Conditioning, Air Conditioning Contractors, Air Duct Cleaning",,,,,A+,,,https://www.bbb.org/us/ne/bellevue/profile/heating-and-air-conditioning/apollo-heating-air-0714-104007276,BBB
Apollo Heating & AirConditioning,(712) 527-5291,202 Sharp St,Glenwood,IA,51534,,,"Heating and Air Conditioning, Air Conditioning Contractors, Air Duct Cleaning",,,,,A+,,,https://www.bbb.org/us/ia/glenwood/profile/heating-and-air-conditioning/apollo-heating-air-0714-104007276/addressId/284034,BBB
