name,phone,address,city,state,zip_code,email,website,category,license_number,license_type,license_expiry,types_of_work,bbb_rating,google_rating,review_count,bbb_profile_url,source
O'Dell's Heating and Air LLC,(309) 792-0431,1307 10th Avenue West,"Suite A , Milan",IL,61264,,,"Heating and Air Conditioning, Residential Air Conditioning Contractors, Heating Contractors",,,,,A+,,,https://www.bbb.org/us/il/milan/profile/heating-and-air-conditioning/odells-heating-and-air-llc-0664-32098320,BBB
"O'Flaherty Services, Inc.",(402) 339-7388,8100 Serum Ave,Omaha,NE,68127,,,"Heating and Air Conditioning, Electrician, Air Conditioning Contractors",,,,,A+,,,https://www.bbb.org/us/ne/omaha/profile/heating-and-air-conditioning/oflaherty-services-inc-0714-300104602,BBB
OckenfelsMechanicalContrs,(319) 679-4444,4653 Indian Lookout Rd SE,Iowa City,IA,52240,,,Air Conditioning Contractors,,,,,,,,https://www.bbb.org/us/ia/iowa-city/profile/air-conditioning-contractor/ockenfels-mechanical-contrs-0664-32132463,BBB
"OconHVACServices, LLC",(402) 541-6785,PO Box 7723,Omaha,NE,68107,,,"Heating and Air Conditioning, Air Conditioning Contractors, Air Conditioning Repair",,,,,A+,,,https://www.bbb.org/us/ne/omaha/profile/heating-and-air-conditioning/ocon-hvac-services-llc-0714-1000068021,BBB
Odessa Heating & Cooling,(816) 230-7716,600 W Dryden St,Odessa,MO,64076,,,"Heating and Air Conditioning, Air Conditioning Contractors, Residential Air Conditioning Contractors",,,,,A+,,,https://www.bbb.org/us/mo/odessa/profile/heating-and-air-conditioning/odessa-heating-cooling-0714-11091183,BBB
"Oliver Heating & Air, Inc.",(319) 759-3023,14384 Washington Rd,West Burlington,IA,52655,,,"Heating and Air Conditioning, Heating Contractors",,,,,A,,,https://www.bbb.org/us/ia/west-burlington/profile/heating-and-air-conditioning/oliver-heating-air-inc-0664-31000444,BBB
OlsonPlumbing&HeatingInc,(515) 968-4327,Pobox 158,Paton,IA,50217,,,Heating and Air Conditioning,,,,,A+,,,https://www.bbb.org/us/ia/paton/profile/heating-and-air-conditioning/olson-plumbing-heating-inc-0664-32146464,BBB
Olsson,(402) 341-1116,2111 S 67th St # 200,Omaha,NE,68106,,,"Professional Engineers, Landscape Design, Structural Engineer",,,,,,,,https://www.bbb.org/us/ne/omaha/profile/professional-engineer/olsson-0714-209000407/addressId/71105,BBB
Olsson,(402) 827-7220,8720 S 114th St # 107,La Vista,NE,68128,,,"Professional Engineers, Landscape Design, Structural Engineer",,,,,,,,https://www.bbb.org/us/ne/la-vista/profile/professional-engineer/olsson-0714-209000407/addressId/71106,BBB
"Omega Test & Balance of Iowa, LLC",(515) 729-6046,302 S 14th St,Adel,IA,50003,,,"Control Systems, Air Conditioning Contractors",,,,,A+,,,https://www.bbb.org/us/ia/adel/profile/control-systems/omega-test-balance-of-iowa-llc-0664-32055114,BBB
One Hour Heating &AirConditioning,(515) 495-5112,409 S Bell Ave,Ames,IA,50010,,,"Plumber, Construction Services, Heating and Air Conditioning",,,,,A+,,,https://www.bbb.org/us/ia/ames/profile/plumber/benjamin-franklin-plumbing-0664-27000205,BBB
One Source,(641) 673-8211,1110 C Ave E,Oskaloosa,IA,52577,,,Heating and Air Conditioning,,,,,A+,,,https://www.bbb.org/us/ia/oskaloosa/profile/heating-and-air-conditioning/one-source-0664-22001362,BBB
"OrrPlumbing,Heating& Appliance, Inc.",(563) 852-7017,220 1st Ave W,Cascade,IA,52033,,,Heating and Air Conditioning,,,,,,,,https://www.bbb.org/us/ia/cascade/profile/heating-and-air-conditioning/orr-plumbing-heating-appliance-inc-0664-32008021,BBB
OTTS Restoration Services,(402) 708-2275,Union,Des Moines,IA,,,,"Home Improvement, Painting Contractors, Handyman",,,,,A+,,,https://www.bbb.org/us/ne/union/profile/home-improvement/otts-restoration-services-0714-600000843,BBB
"OwatonnaHeating& Cooling, Inc.",(507) 451-2051,408 N Cedar Ave,Owatonna,MN,55060,,,"Heating Contractors, Heating and Air Conditioning, Residential Air Conditioning Contractors",,,,,A+,,,https://www.bbb.org/us/mn/owatonna/profile/heating-contractors/owatonna-heating-cooling-inc-0704-51001381,BBB
Owens Heating and Cooling,(515) 500-5859,200 W McKinley St,Jefferson,IA,50129,,,"Air conditioning & Heating Contractors - Commercial, Heating and Air Conditioning",,,,,A+,,,https://www.bbb.org/us/ia/jefferson/profile/air-conditioning-heating-contractors-commercial/owens-heating-and-cooling-0664-32157540,BBB
"P1 Service, LLC",(515) 969-0944,6864 NE 14th St.,"STE 1 , Ankeny",IA,50023,,,"Heating and Air Conditioning, Plumber, Electrician",,,,,A+,,,https://www.bbb.org/us/ia/ankeny/profile/heating-and-air-conditioning/p1-service-llc-0664-32159358/addressId/91887,BBB
"P1 Service, LLC",(816) 279-0888,714 S 7th St Ste 200,Saint Joseph,MO,64501,,,"Heating and Air Conditioning, Plumber, Electrician",,,,,A+,,,https://www.bbb.org/us/mo/saint-joseph/profile/heating-and-air-conditioning/p1-service-llc-0714-1000076143,BBB
"Parrott Central Control Service, Inc.",(712) 322-2364,19610 Birdsley Rd,Council Bluffs,IA,51503,,,"Electrician, Electrical Contractors, Mechanical Contractors",,,,,,,,https://www.bbb.org/us/ia/council-bluffs/profile/electrician/parrott-central-control-service-inc-0714-135000719,BBB
"Paschal Air,Plumbing& Electric",(417) 358-5592,4902 Frederick Ave,Saint Joseph,MO,64506,,,"Heating and Air Conditioning, Plumber, Air Conditioning Contractors",,,,,A-,,,https://www.bbb.org/us/mo/saint-joseph/profile/heating-and-air-conditioning/paschal-air-plumbing-electric-0734-1000019864/addressId/208257,BBB
Passion Home Improvements,(641) 831-0265,10161 Hickman Rd,Urbandale,IA,50322,,,"General Contractor, Roofing Contractors, Siding Contractors",,,,,A+,,,https://www.bbb.org/us/ia/urbandale/profile/general-contractor/passion-home-improvements-0664-32106313,BBB
Paul's Heating & Air Conditioning Inc.,(608) 784-0751,1241 Oak Forest Dr,Onalaska,WI,54650,,,"Heating and Air Conditioning, Air Conditioning Contractors, Air Conditioning Repair",,,,,A+,,,https://www.bbb.org/us/wi/onalaska/profile/heating-and-air-conditioning/pauls-heating-air-conditioning-inc-0694-1005343,BBB
"Paul'sPlumbing,Heating&Cooling, Inc",(319) 837-6411,410 Avenue E,West Point,IA,52656,,,Plumber,,,,,A+,,,https://www.bbb.org/us/ia/west-point/profile/plumber/pauls-plumbing-heating-cooling-inc-0664-32086778,BBB
Peavy's Heating and Air,(402) 995-9497,Omaha,Des Moines,IA,,,,"Heating and Air Conditioning, Air Conditioning Contractors, Air Conditioning Repair",,,,,A+,,,https://www.bbb.org/us/ne/omaha/profile/heating-and-air-conditioning/peavys-heating-and-air-0714-300244893,BBB
PellaHeating&Cooling,(641) 628-1246,1415 W 2nd St,Pella,IA,50219,,,Plumbing and Heating,,,,,,,,https://www.bbb.org/us/ia/pella/profile/plumbing-and-heating/pella-heating-cooling-0664-32135750,BBB
"Pence Air Conditioning,Heating& Appliances",(816) 628-6711,105 W Washington St,Kearney,MO,64060,,,"Heating and Air Conditioning, Air Conditioning Contractors, Heating Contractors",,,,,A+,,,https://www.bbb.org/us/mo/kearney/profile/heating-and-air-conditioning/pence-air-conditioning-heating-appliances-0714-94040082,BBB
Pence Heating and Cooling,(816) 532-0303,208 W Richardson St. SteJ,Smithville,MO,64089,,,"Heating and Air Conditioning, Air Conditioning Contractors, Heating Contractors",,,,,A+,,,https://www.bbb.org/us/mo/smithville/profile/heating-and-air-conditioning/pence-heating-and-cooling-0714-99123105,BBB
PetschauerPlumbing&Heating,(712) 664-2075,PO Box 2049,Carnarvon,IA,51450,,,Heating and Air Conditioning,,,,,A+,,,https://www.bbb.org/us/ia/carnarvon/profile/heating-and-air-conditioning/petschauer-plumbing-heating-0664-32082424,BBB
"Phil's Comfort Zone, Inc.",(712) 256-9686,Council Bluffs,Des Moines,IA,,,,"Heating and Air Conditioning, Air Conditioning Contractors, Air Conditioning Repair",,,,,A+,,,https://www.bbb.org/us/ia/council-bluffs/profile/heating-and-air-conditioning/phils-comfort-zone-inc-0714-300061668,BBB
Philip Robbins Construction,(712) 370-1436,1647 270th St,Coin,IA,51636,,,"General Contractor, Construction Services, Home Builders",,,,,A+,,,https://www.bbb.org/us/ia/coin/profile/general-contractor/philip-robbins-construction-0714-140001344,BBB
PhippsMechanical,(515) 689-7926,111 N G St,Indianola,IA,50125,,,Heating Contractors,,,,,,,,https://www.bbb.org/us/ia/indianola/profile/heating-contractors/phipps-mechanical-0664-32138414,BBB
PikeMechanical,(515) 243-4275,111 SE 7th,Des Moines,IA,50309,,,Mechanical Contractors,,,,,,,,https://www.bbb.org/us/ia/des-moines/profile/mechanical-contractors/pike-mechanical-0664-32068396,BBB
Pinecrest Construction LLC,(319) 239-5366,1345 Isaac Ave,Hazleton,IA,50641,,,"General Contractor, Roofing Contractors, Siding Contractors",,,,,A+,,,https://www.bbb.org/us/ia/hazleton/profile/general-contractor/pinecrest-construction-llc-0664-32061689,BBB
"Pinnacle Construction, Inc.",(712) 527-9745,PO Box 368,Glenwood,IA,51534,,,"General Contractor, Construction Services, Remodel Contractors",,,,,A+,,,https://www.bbb.org/us/ia/glenwood/profile/general-contractor/pinnacle-construction-inc-0714-104007430/addressId/40333,BBB
"Pioneer Metal Roofing and Construction, LLC",(319) 264-0136,2635 Pioneer Rd,Delhi,IA,52223,,,"Roofing Contractors, General Contractor, Siding Contractors",,,,,A+,,,https://www.bbb.org/us/ia/delhi/profile/roofing-contractors/pioneer-metal-roofing-and-construction-llc-0664-32158414,BBB
"Pipe Pro, Inc",(319) 365-2960,6633 8th St SW,Cedar Rapids,IA,52404,,,Mechanical Contractors,,,,,,,,https://www.bbb.org/us/ia/cedar-rapids/profile/mechanical-contractors/pipe-pro-inc-0664-32054119,BBB
Pitschbrook Heating & Cooling,(402) 917-8935,Omaha,Des Moines,IA,,,,"Heating and Air Conditioning, Air Conditioning Contractors, Air Conditioning Repair",,,,,,,,https://www.bbb.org/us/ne/omaha/profile/heating-and-air-conditioning/pitschbrook-heating-cooling-0714-300092725,BBB
Platinum Contracting,(816) 294-3474,Savannah,Centerville,IA,,,,"Commercial Concrete Contractors, General Contractor",,,,,A+,,,https://www.bbb.org/us/mo/savannah/profile/commercial-concrete-contractors/platinum-contracting-0714-1000075266,BBB
"Platinum Plumbing Heating and Cooling, LLC",(515) 729-5065,1080 Cedar St,Waukee,IA,50263,,,"Plumbing and Heating, Plumber, Air Conditioning Contractors",,,,,A+,,,https://www.bbb.org/us/ia/waukee/profile/plumbing-and-heating/platinum-plumbing-heating-and-cooling-llc-0664-32158345,BBB
"Platte Valley Company, Inc.",(402) 466-3233,2301 Kimarra Pl,Lincoln,NE,68521,,,"Insulation Contractors, Mechanical Insulation Contractors, Insulation Materials",,,,,A+,,,https://www.bbb.org/us/ne/lincoln/profile/insulation-contractors/platte-valley-company-inc-0714-216001116,BBB
Plumbing TodayHVAC,(402) 933-8835,3150 Spaulding St,Omaha,NE,68111,,,"Plumber, Heating and Air Conditioning, Excavating Contractors",,,,,A+,,,https://www.bbb.org/us/ne/omaha/profile/plumber/plumbing-today-hvac-0714-300106286,BBB
"PolestarPlumbing,Heating& Air Conditioning",(913) 624-1074,7252 W Frontage Rd,Merriam,KS,66203,,,"Heating and Air Conditioning, Air Conditioning Contractors, Spray Foam Insulation Contractors",,,,,A+,,,https://www.bbb.org/us/ks/merriam/profile/heating-and-air-conditioning/polestar-plumbing-heating-air-conditioning-0714-98110758,BBB
Polk County Heating & Cooling Inc,(515) 964-7337,207 S 2nd St Ste A,Polk City,IA,50226,,,"Heating and Air Conditioning, Plumber, Electrician",,,,,A+,,,https://www.bbb.org/us/ia/polk-city/profile/heating-and-air-conditioning/polk-county-heating-cooling-inc-0664-102400,BBB
Pop'SPlumbing,(319) 759-0627,2537 Sunnylawn Drive,Burlington,IA,52601,,,Heating and Air Conditioning,,,,,A+,,,https://www.bbb.org/us/ia/burlington/profile/heating-and-air-conditioning/pops-plumbing-0664-32143998,BBB
PoppePlumbing&HeatingLLC,(319) 276-3543,21535 Butler Ave,Waverly,IA,50677,,,Heating and Air Conditioning,,,,,A+,,,https://www.bbb.org/us/ia/waverly/profile/heating-and-air-conditioning/poppe-plumbing-heating-llc-0664-32098529,BBB
Pot's Plumbing & Heating,(641) 847-2279,740 Main St,Ackley,IA,50601,,,"Plumber, Heating and Air Conditioning",,,,,A+,,,https://www.bbb.org/us/ia/ackley/profile/plumber/pots-plumbing-heating-0664-6000839,BBB
"PowerUp Electric, LLC",(319) 264-6492,603 Oakland Rd NE,Cedar Rapids,IA,52402,,,"Electrician, Electrical Contractors, Solar Energy Contractors",,,,,A,,,https://www.bbb.org/us/ia/cedar-rapids/profile/electrician/powerup-electric-llc-0664-32157576,BBB
PracticalPlumbingHeating&CoolingLLC,(515) 964-1070,12045 NE 68th St,Bondurant,IA,50035,,,Heating and Air Conditioning,,,,,,,,https://www.bbb.org/us/ia/bondurant/profile/heating-and-air-conditioning/practical-plumbing-heating-cooling-llc-0664-32068402,BBB
Prairie Construction & Contracting LLC,(309) 333-0479,535 N Fayette St,Carthage,IL,62321,,,"Framing Contractors, General Contractor, Heating and Air Conditioning",,,,,A+,,,https://www.bbb.org/us/il/carthage/profile/framing-contractors/prairie-construction-contracting-llc-0734-1000049317,BBB
Prairie Mechanical Corporation,(402) 331-4050,2842 Tucker St,Omaha,NE,68112,,,"Heating and Air Conditioning, Plumber, Air Conditioning Contractors",,,,,A+,,,https://www.bbb.org/us/ne/omaha/profile/heating-and-air-conditioning/prairie-mechanical-corporation-0714-123000316,BBB
PrairieMechanicalCorporation,(402) 318-3050,5900 N 58th St # 6,Lincoln,NE,68507,,,"Heating and Air Conditioning, Plumber, Air Conditioning Contractors",,,,,A+,,,https://www.bbb.org/us/ne/lincoln/profile/heating-and-air-conditioning/prairie-mechanical-corporation-0714-123000316/addressId/56397,BBB
"Prange's Heating &AirConditioning, Inc.",(507) 243-4190,302 Main St,Madison Lake,MN,56063,,,"Air Conditioning Contractors, Air Conditioning Repair, Heating Contractors",,,,,A+,,,https://www.bbb.org/us/mn/madison-lake/profile/air-conditioning-contractor/pranges-heating-air-conditioning-inc-0704-96179359,BBB
Precision Builders CR LLC,(319) 560-1884,PO Box 11396,Cedar Rapids,IA,52410,,,"General Contractor, Home Builders, Home Improvement",,,,,A+,,,https://www.bbb.org/us/ia/cedar-rapids/profile/general-contractor/precision-builders-cr-llc-0664-32048363,BBB
"PrecisionPlumbingHeatingand Air, LLC",(319) 332-1630,801 3rd Ave SE,Independence,IA,50644,,,"Plumbing and Heating, Plumber, Heating and Air Conditioning",,,,,A+,,,https://www.bbb.org/us/ia/independence/profile/plumbing-and-heating/precision-plumbing-heating-and-air-llc-0664-32138606,BBB
Premier Business Services,(402) 960-6657,4516 Lawnwood Dr,Papillion,NE,68133,,,"Printing Equipment, Mechanical Contractors, Electrical Wiring",,,,,A+,,,https://www.bbb.org/us/ne/papillion/profile/printing-equipment/premier-business-services-0714-300020303,BBB
"Premier Mechanical Services, LLC",(515) 313-6404,PO Box 122,Rhodes,IA,50234,,,"Heating and Air Conditioning, Commercial Air Conditioning Contractors",,,,,A+,,,https://www.bbb.org/us/ia/rhodes/profile/heating-and-air-conditioning/premier-mechanical-services-llc-0664-32144707,BBB
Premier Plus Storm Team,(319) 393-4639,3076 104th St,Urbandale,IA,50322,,,"Siding Contractors, Roofing Contractors, General Contractor",,,,,A+,,,https://www.bbb.org/us/ia/urbandale/profile/siding-contractors/premier-plus-storm-team-0664-32051664/addressId/85538,BBB
Premier Roofing Company Omaha,(402) 778-7663,1111 N 13th St # 101,Omaha,NE,68102,,,"Roofing Contractors, Roofing Consultants, Roof Leak Repair",,,,,A+,,,https://www.bbb.org/us/ne/omaha/profile/roofing-contractors/premier-roofing-company-omaha-0714-300184598/addressId/145827,BBB
Premier Roofing Des Moines,(515) 276-7663,5501 NW Beaver Dr,Johnston,IA,50131,,,"Roofing Contractors, Roofing Consultants, Roof Leak Repair",,,,,A+,,,https://www.bbb.org/us/ia/johnston/profile/roofing-contractors/premier-roofing-des-moines-0664-32136292/addressId/65784,BBB
Premier Sandblasting & Painting LLC,(608) 792-0907,500 Jefferson St E,West Salem,WI,54669,,,"Sandblasting, Painting Contractors, Pressure Washing",,,,,A+,,,https://www.bbb.org/us/wi/west-salem/profile/sandblasting/premier-sandblasting-painting-llc-0694-1000057581,BBB
"Premier Systems, Inc.",(952) 933-2282,408 S Prairie,Fairmont,MN,56031,,,"General Contractor, Roofing Contractors, Siding Contractors",,,,,A+,,,https://www.bbb.org/us/mn/fairmont/profile/general-contractor/premier-systems-inc-0704-96348552/addressId/272719,BBB
Presence Air LLC,(507) 213-1832,Owatonna,Nevada,IA,,,,"Residential Air Conditioning Contractors, Air Conditioning Contractors, Heating Contractors",,,,,A,,,https://www.bbb.org/us/mn/owatonna/profile/residential-air-conditioning-contractors/presence-air-llc-0704-1000070322,BBB
Price Cooling Heating and Electrical,(712) 483-2471,Minden,Des Moines,IA,,,,"Heating and Air Conditioning, Electrician, Air Conditioning Contractors",,,,,A+,,,https://www.bbb.org/us/ia/minden/profile/heating-and-air-conditioning/price-cooling-heating-and-electrical-0714-300037689,BBB
Prime Heating and Cooling,(402) 415-5763,4720 N 175th St,Omaha,NE,68116,,,"Heating and Air Conditioning, Air Conditioning Contractors, Air Conditioning Repair",,,,,A+,,,https://www.bbb.org/us/ne/omaha/profile/heating-and-air-conditioning/prime-heating-and-cooling-0714-300185263,BBB
PrimeMechanicalInc,(319) 841-2280,1135 State Street,Ely,IA,52227,,,Mechanical Contractors,,,,,,,,https://www.bbb.org/us/ia/ely/profile/mechanical-contractors/prime-mechanical-inc-0664-32101454,BBB
Primetime Remodels,(515) 402-1699,6663 NW 5th St,Des Moines,IA,50313,,,"Construction Services, General Contractor, Patios and Decks",,,,,A+,,,https://www.bbb.org/us/ia/des-moines/profile/construction-services/primetime-remodels-0664-32123163,BBB
"Primo Heating And Cooling, LLC",(641) 774-4368,1320 Court Ave,Chariton,IA,50049,,,"Residential Air Conditioning Contractors, Heating and Air Conditioning, Air Conditioning Contractors",,,,,A+,,,https://www.bbb.org/us/ia/chariton/profile/residential-air-conditioning-contractors/primo-heating-and-cooling-llc-0664-32124296,BBB
Principal Builders Inc.,(641) 456-5252,PO Box 125,Coulter,IA,50431,,,"New Construction, Concrete Contractors, Foundation Contractors",,,,,A+,,,https://www.bbb.org/us/ia/coulter/profile/new-construction/principal-builders-inc-0664-32138184,BBB
Priority Mechanical Services,(402) 214-5124,3307 S 67th St # 2,Omaha,NE,68106,,,"Heating and Air Conditioning, Air Conditioning Contractors, Air Conditioning Repair",,,,,A+,,,https://www.bbb.org/us/ne/omaha/profile/heating-and-air-conditioning/priority-mechanical-services-0714-300107685,BBB
"Priority One Heating and Cooling, LLC",(515) 675-4445,Runnells,Des Moines,IA,,,,"Heating and Air Conditioning, Air Conditioning Repair, Residential Air Conditioning Contractors",,,,,A+,,,https://www.bbb.org/us/ia/runnells/profile/heating-and-air-conditioning/priority-one-heating-and-cooling-llc-0664-32159046,BBB
Pro Innovation LLC,(573) 673-2501,5506 Arrow Wood Dr,Columbia,MO,65202,,,"General Contractor, Siding Contractors, Patios and Decks",,,,,A+,,,https://www.bbb.org/us/mo/columbia/profile/general-contractor/pro-innovation-llc-0734-1000039961,BBB
Prochaska & Associates,(402) 334-0755,11317 Chicago Cir,Omaha,NE,68154,,,"Architect, Landscape Contractors, Structural Engineer",,,,,,,,https://www.bbb.org/us/ne/omaha/profile/architect/prochaska-associates-0714-135001746,BBB
ProctorMechanicalCorporation,(515) 288-2251,1100 Hoak Dr,West Des Moines,IA,50265,,,Electrical Contractors,,,,,A+,,,https://www.bbb.org/us/ia/west-des-moines/profile/electrical-contractors/proctor-mechanical-corporation-0664-102442,BBB
"ProRoofs, LLC",(712) 291-5354,813 Flindt Dr,Storm Lake,IA,50588,,,"Roofing Contractors, General Contractor",,,,,A+,,,https://www.bbb.org/us/ia/storm-lake/profile/roofing-contractors/proroofs-llc-0664-32147744,BBB
ProssPlumbing&Heating,(712) 243-1944,Atlantic,Des Moines,IA,,,,"Plumber, Heating and Air Conditioning, Residential Air Conditioning Contractors",,,,,,,,https://www.bbb.org/us/ia/atlantic/profile/plumber/pross-plumbing-heating-0714-300071324,BBB
PryorMechanicalLLC,(816) 587-7562,221 NW 180th St,Smithville,MO,64089,,,"Plumber, Drainage Contractors, Commercial Contractors",,,,,A+,,,https://www.bbb.org/us/mo/smithville/profile/plumber/pryor-mechanical-llc-0714-1000002258,BBB
Pyles HVAC,(816) 527-7535,Kansas City,Centerville,IA,,,,"Heating and Air Conditioning, Air Conditioning Contractors, Air Conditioning Repair",,,,,A+,,,https://www.bbb.org/us/mo/kansas-city/profile/heating-and-air-conditioning/pyles-hvac-0714-1000070198,BBB
QC Roof Drs.,(563) 888-8967,1313 N Harrison St,Davenport,IA,52803,,,"Roofing Contractors, General Contractor, Siding Contractors",,,,,A+,,,https://www.bbb.org/us/ia/davenport/profile/roofing-contractors/qc-roof-drs-0664-32099485,BBB
QC Roof Drs.,(309) 428-7984,3111 11th Avenue A,Moline,IL,61265,,,"Roofing Contractors, General Contractor, Siding Contractors",,,,,A+,,,https://www.bbb.org/us/il/moline/profile/roofing-contractors/qc-roof-drs-0664-32099485/addressId/44292,BBB
Quality Air Heating & Cooling,(641) 682-9994,16487 87th St,Ottumwa,IA,52501,,,"Heating and Air Conditioning, Heating Contractors, Air Duct Systems",,,,,A+,,,https://www.bbb.org/us/ia/ottumwa/profile/heating-and-air-conditioning/quality-air-heating-cooling-0664-32009303,BBB
Quality Plumbing & Heating,(515) 961-4816,811 S Jefferson Way,Indianola,IA,50125,,,"Plumber, Heating and Air Conditioning, Residential Air Conditioning Contractors",,,,,A+,,,https://www.bbb.org/us/ia/indianola/profile/plumber/quality-plumbing-heating-0664-32037652,BBB
QualityHVACLLC,(816) 284-0989,Weatherby,Des Moines,IA,,,,Heating and Air Conditioning,,,,,A+,,,https://www.bbb.org/us/mo/weatherby/profile/heating-and-air-conditioning/quality-hvac-llc-0714-1000054561,BBB
QuestecMechanical,(573) 875-0260,1390 E Boone Industrial Blvd Ste 260,Columbia,MO,65202,,,Mechanical Insulation Contractors,,,,,A+,,,https://www.bbb.org/us/mo/columbia/profile/mechanical-insulation-contractors/questec-mechanical-0734-310614397,BBB
R & JMechanicalLLC,(816) 550-9239,Excelsior Springs,Centerville,IA,,,,"Plumber, Sewer Contractors",,,,,A+,,,https://www.bbb.org/us/mo/excelsior-springs/profile/plumber/r-j-mechanical-llc-0714-1000052752,BBB
R & RPlumbing,(712) 623-2425,PO Box 181,Red Oak,IA,51566,,,"Plumber, Heating and Air Conditioning, Residential Air Conditioning Contractors",,,,,,,,https://www.bbb.org/us/ia/red-oak/profile/plumber/r-r-plumbing-0714-300022379/addressId/91273,BBB
"R.J. Nelson Company, Inc.",(712) 322-7574,2437 Avenue M,Council Blfs,IA,51501,,,"Heating and Air Conditioning, Air Conditioning Contractors, Air Conditioning Repair",,,,,A+,,,https://www.bbb.org/us/ia/council-blfs/profile/heating-and-air-conditioning/rj-nelson-company-inc-0714-107000157,BBB
"R.W. Cardella, Inc",(319) 524-1566,411 Bank St,Keokuk,IA,52632,,,Mechanical Contractors,,,,,,,,https://www.bbb.org/us/ia/keokuk/profile/mechanical-contractors/rw-cardella-inc-0664-32074736,BBB
Rabe Hardware Inc,(319) 454-6514,317 Locust Street NW,Blairstown,IA,52209,,,"Mechanical Contractors, Plumber, Heating and Air Conditioning",,,,,A+,,,https://www.bbb.org/us/ia/blairstown/profile/mechanical-contractors/rabe-hardware-inc-0664-29000070,BBB
RaganMechanicalInc,(563) 326-6224,702 W 76th Street,Davenport,IA,52806,,,Mechanical Contractors,,,,,A+,,,https://www.bbb.org/us/ia/davenport/profile/mechanical-contractors/ragan-mechanical-inc-0664-32006132,BBB
Ramsey Creek Woodworks Inc,(319) 656-3883,1050 Highway 1,Kalona,IA,52247,,,"Construction Services, General Contractor, Siding Contractors",,,,,A+,,,https://www.bbb.org/us/ia/kalona/profile/construction-services/ramsey-creek-woodworks-inc-0664-5000759,BBB
Randall Renovations,(402) 510-7665,Omaha,Des Moines,IA,,,,"Remodel Contractors, General Contractor, Construction Services",,,,,A+,,,https://www.bbb.org/us/ne/omaha/profile/remodel-contractors/randall-renovations-0714-300056940,BBB
Rardon Heating and Electric Inc.,(660) 425-3004,Bethany,Des Moines,IA,,,,Heating and Air Conditioning,,,,,A+,,,https://www.bbb.org/us/mo/bethany/profile/heating-and-air-conditioning/rardon-heating-and-electric-inc-0714-1000053060,BBB
Rauch Enterprises,(641) 660-3173,22093 Acorn Rd,Elgin,IA,52141,,,"Residential Air Conditioning Contractors, Plumber",,,,,A+,,,https://www.bbb.org/us/ia/elgin/profile/residential-air-conditioning-contractors/rauch-enterprises-0664-32080219,BBB
Ray Martin Co.,(402) 553-7300,5126 F St,Omaha,NE,68117,,,"Mechanical Contractors, Plumber, Heating and Air Conditioning",,,,,A+,,,https://www.bbb.org/us/ne/omaha/profile/mechanical-contractors/ray-martin-co-0714-135002614,BBB
Recon Roofing & Construction,(515) 489-0123,455 SW 5th St Ste C,Des Moines,IA,50309,,,"Roofing Contractors, General Contractor, Siding Contractors",,,,,A+,,,https://www.bbb.org/us/ia/des-moines/profile/roofing-contractors/recon-roofing-construction-0664-32122442,BBB
"Redoy Roofing and Siding, LLC",(641) 664-2574,18951 200th St,Bloomfield,IA,52537,,,"Roofing Contractors, General Contractor, Construction Services",,,,,A+,,,https://www.bbb.org/us/ia/bloomfield/profile/roofing-contractors/redoy-roofing-and-siding-llc-0664-32136788,BBB
ReedMechanicalInc,(515) 850-1143,PO Box 65756,West Des Moines,IA,50265,,,Residential Air Conditioning Contractors,,,,,A+,,,https://www.bbb.org/us/ia/west-des-moines/profile/residential-air-conditioning-contractors/reed-mechanical-inc-0664-32044611,BBB
ReegansHeatingCoolingPlumbing,(319) 550-7064,4615 Indian Ridge St SW,Cedar Rapids,IA,52404,,,Air Conditioning Contractors,,,,,,,,https://www.bbb.org/us/ia/cedar-rapids/profile/air-conditioning-contractor/reegans-heating-cooling-plumbing-0664-32130401,BBB
Reekers Heating and Cooling,(515) 573-0120,1615 1st Ave N,Fort Dodge,IA,50501,,,"Residential Air Conditioning Contractors, Heating and Air Conditioning, Air Conditioning Contractors",,,,,A+,,,https://www.bbb.org/us/ia/fort-dodge/profile/residential-air-conditioning-contractors/reekers-heating-and-cooling-0664-32074569,BBB
