name,phone,address,city,state,zip_code,email,website,category,license_number,license_type,license_expiry,types_of_work,bbb_rating,google_rating,review_count,bbb_profile_url,source,is_new_to_db
A Quick Dry Solution,(267) 581-4873,2948 E Venango St,Philadelphia,PA,19134,,,"General Contractor, Concrete Contractors, Foundation Contractors",,,,,A+,,,https://www.bbb.org/us/pa/philadelphia/profile/general-contractor/a-quick-dry-solution-0241-235989038/addressId/335638,BBB,yes
A&S Cooling Inc.,(856) 312-8499,19 N Black Horse Pike Ste 1,Runnemede,NJ,08078,,,"Commercial Refrigeration, Air Conditioning Contractors, Mechanical Contractors",,,,,A+,,,https://www.bbb.org/us/nj/runnemede/profile/commercial-refrigeration/as-cooling-inc-0221-90154448,BBB,yes
A-Plus Mechanical Services,(484) 477-9833,101 Michigan Ave,Swarthmore,PA,19081,,,Mechanical Contractors,,,,,A+,,,https://www.bbb.org/us/pa/swarthmore/profile/mechanical-contractors/a-plus-mechanical-services-0241-4955134,BBB,yes
"A. Brooks Construction, Inc.",(215) 702-9376,2911 Ford Rd,Bristol,PA,19007,,,"Roofing Contractors, General Contractor, Siding Contractors",,,,,A+,,,https://www.bbb.org/us/pa/bristol/profile/roofing-contractors/a-brooks-construction-inc-0241-80010169,BBB,yes
A. J. Dauphin & Son,(302) 994-1454,3313 Elizabeth Ave,Wilmington,DE,19808,,,"Plumber, Heating and Air Conditioning, Air Conditioning Contractors",,,,,A+,,,https://www.bbb.org/us/de/wilmington/profile/plumber/a-j-dauphin-son-0251-27000755,BBB,yes
A. Selig Contracting and Building Maintenance Inc.,(267) 300-6049,946 E Ellet St,Philadelphia,PA,19150,,,Heating and Air Conditioning,,,,,A+,,,https://www.bbb.org/us/pa/philadelphia/profile/heating-and-air-conditioning/a-selig-contracting-and-building-maintenance-inc-0241-236041986,BBB,yes
A. W. Viohl General Contracting,(302) 375-6166,950 Ridge Rd Ste E3,Claymont,DE,19703,,,"General Contractor, Roofing Contractors, Construction Services",,,,,A+,,,https://www.bbb.org/us/de/claymont/profile/general-contractor/a-w-viohl-general-contracting-0251-92003179,BBB,yes
A.B. Graham Contracting,(888) 575-0042,2540 Kirk Dr,Huntingdon Vy,PA,19006,,,"Home Improvement, General Contractor, Bathroom Remodel",,,,,A+,,,https://www.bbb.org/us/pa/huntingdon-vy/profile/home-improvement/ab-graham-contracting-0241-235991910,BBB,yes
A.M. Botte Mechanical,(856) 208-6998,630 Delsea Dr,Sewell,NJ,08080,,,"Heating and Air Conditioning, Plumber, Electrical Contractors",,,,,A+,,,https://www.bbb.org/us/nj/sewell/profile/heating-and-air-conditioning/am-botte-mechanical-0221-90211885,BBB,yes
AAA Brothers Heating & Cooling,(215) 914-1081,Huntingdon Valley,Philadelphia,PA,,,,"Heating and Air Conditioning, Plumber, Air Duct Cleaning",,,,,A+,,,https://www.bbb.org/us/pa/huntingdon-valley/profile/heating-and-air-conditioning/aaa-brothers-heating-cooling-0241-80019727,BBB,yes
"Abbey Plumbing & HVAC, LLC",(215) 643-2216,Lansdale,Philadelphia,PA,,,,"Plumber, Heating and Air Conditioning, Heating Contractors",,,,,A+,,,https://www.bbb.org/us/pa/lansdale/profile/plumber/abbey-plumbing-hvac-llc-0241-80001407,BBB,yes
Abbott Plumbing Inc.,(856) 629-1445,1337 Sunset Ave,Williamstown,NJ,08094,,,"Plumber, Heating and Air Conditioning, Bathroom Remodel",,,,,A+,,,https://www.bbb.org/us/nj/williamstown/profile/plumber/abbott-plumbing-inc-0221-11004512,BBB,yes
Absolute Mechanical LLC,(856) 459-5605,800 W Main St,Millville,NJ,08332,,,"Heating Contractors, Plumber, Heating and Air Conditioning",,,,,A+,,,https://www.bbb.org/us/nj/millville/profile/heating-contractors/absolute-mechanical-llc-0221-90197074,BBB,yes
"Absolute Plumbing & Heating, Inc.",(215) 331-9801,620 Whittaker Way,Harleysville,PA,19438,,,"Plumber, Duct Cleaning, Heating Contractors",,,,,A+,,,https://www.bbb.org/us/pa/harleysville/profile/plumber/absolute-plumbing-heating-inc-0241-191116774,BBB,yes
Adam Home Services,(610) 457-7575,200 West Chester Pike,Havertown,PA,19083,,,"Heating and Air Conditioning, Heating Contractors",,,,,A+,,,https://www.bbb.org/us/pa/havertown/profile/heating-and-air-conditioning/adam-home-services-0241-161906392,BBB,yes
Adelphia Plumbing and Heating Corp.,(215) 879-8034,4955 Lancaster Ave,Philadelphia,PA,19131,,,"Plumber, Heating Contractors, Mechanical Contractors",,,,,A+,,,https://www.bbb.org/us/pa/philadelphia/profile/plumber/adelphia-plumbing-and-heating-corp-0241-194327138,BBB,yes
"Advanced Air Heating & Cooling, Inc.",(856) 256-7700,105 Hurffville Grenloch Rd,Sewell,NJ,08080,,,"Heating and Air Conditioning, Refrigerator Repair",,,,,A+,,,https://www.bbb.org/us/nj/sewell/profile/heating-and-air-conditioning/advanced-air-heating-cooling-inc-0221-90051024,BBB,yes
Advent  Air Conditioning and Heating LLC,(215) 262-8502,244 Centennial Rd,Warminster,PA,18974,,,"Heating and Air Conditioning, Heating Contractors",,,,,A+,,,https://www.bbb.org/us/pa/warminster/profile/heating-and-air-conditioning/advent-air-conditioning-and-heating-llc-0241-236059448,BBB,yes
"Affordable Fixes, LLC",(215) 677-1300,101 Geiger Road,"Unit 8 , Philadelphia",PA,19115,,,"Air Conditioning Contractors, Plumber, Heating and Air Conditioning",,,,,A+,,,https://www.bbb.org/us/pa/philadelphia/profile/air-conditioning-contractor/affordable-fixes-llc-0241-235985502/addressId/246405,BBB,yes
Air Adviser LLC,(302) 544-0125,147 Carlotta Dr,Bear,DE,19701,,,"Heating and Air Conditioning, Air Conditioning Contractors, Air Conditioning Repair",,,,,A+,,,https://www.bbb.org/us/de/bear/profile/heating-and-air-conditioning/air-adviser-llc-0251-92025489,BBB,yes
"Air Control Heating and Cooling, LLC",(302) 287-3400,PO Box 571,Claymont,DE,19703,,,"Heating and Air Conditioning, Air Conditioning Contractors, Air Duct Cleaning",,,,,A+,,,https://www.bbb.org/us/de/claymont/profile/heating-and-air-conditioning/air-control-heating-and-cooling-llc-0251-92013880,BBB,yes
Air Temp Solutions HVAC & Plumbing Contractors,(302) 213-6518,211 Lake Dr Ste J,Newark,DE,19702,,,"Residential Air Conditioning Contractors, Plumber, Heating and Air Conditioning",,,,,A+,,,https://www.bbb.org/us/de/newark/profile/residential-air-conditioning-contractors/air-temp-solutions-hvac-plumbing-contractors-0251-92004633,BBB,yes
"Airhandlers Mechanical Services, Inc.",(800) 783-7001,PO Box 178,Haddon Heights,NJ,08035,,,Mechanical Contractors,,,,,A,,,https://www.bbb.org/us/nj/haddon-heights/profile/mechanical-contractors/airhandlers-mechanical-services-inc-0221-90208777,BBB,yes
AirMaster Heating & Cooling Specialists,(267) 214-7672,5545 Baynton St,Philadelphia,PA,19144,,,"Heating and Air Conditioning, Air Conditioning Contractors, Heating Contractors",,,,,A+,,,https://www.bbb.org/us/pa/philadelphia/profile/heating-and-air-conditioning/airmaster-heating-cooling-specialists-0241-236084185,BBB,yes
"AJ Wehner General Contracting, LLC",(609) 654-8385,8 Hawthorne Dr,Medford,NJ,08055,,,"General Contractor, Construction Services, Remodel Contractors",,,,,A+,,,https://www.bbb.org/us/nj/medford/profile/general-contractor/aj-wehner-general-contracting-llc-0221-27003014,BBB,yes
AL Group LLC,(610) 607-7770,12135 Academy Rd Apt 83,Philadelphia,PA,19154,,,"Heating Contractors, Air Conditioning Contractors, Air Duct Systems",,,,,A+,,,https://www.bbb.org/us/pa/philadelphia/profile/heating-contractors/al-group-llc-0241-236073481,BBB,yes
Alber Service Company,(856) 317-1750,7300 North Crescent Blvd. Unit 15,Pennsauken,NJ,08110,,,"Heating and Air Conditioning, Air Conditioning Contractors, Insulation Contractors",,,,,A+,,,https://www.bbb.org/us/nj/pennsauken/profile/heating-and-air-conditioning/alber-service-company-0221-80004588,BBB,yes
"Alek Air Management, Incorporated",(267) 686-6004,2880 Comly Rd,Philadelphia,PA,19154,,,Heating and Air Conditioning,,,,,A+,,,https://www.bbb.org/us/pa/philadelphia/profile/heating-and-air-conditioning/alek-air-management-incorporated-0241-143746677,BBB,yes
All Pros Property Services,(610) 277-8658,Norristown,Philadelphia,PA,,,,"Electrical Contractors, Roofing Contractors, General Contractor",,,,,A+,,,https://www.bbb.org/us/pa/norristown/profile/electrical-contractors/all-pros-property-services-0241-235987821,BBB,yes
All ShoreHeatingandAirConditioning,(856) 596-5000,440 Elmwood Rd N,Marlton,NJ,08053,,,"Heating and Air Conditioning, Air Conditioning Contractors, Air Conditioning Repair",,,,,A+,,,https://www.bbb.org/us/nj/marlton/profile/heating-and-air-conditioning/all-shore-inc-0221-80001431,BBB,yes
"All-Shore, Inc.",(856) 596-5000,440 Elmwood Rd N,Marlton,NJ,08053,,,"Heating and Air Conditioning, Air Conditioning Contractors, Air Conditioning Repair",,,,,A+,,,https://www.bbb.org/us/nj/marlton/profile/heating-and-air-conditioning/all-shore-inc-0221-80001431,BBB,yes
Allied Experts Heating & Air Conditioning,(856) 528-2818,100 Dobbs Ln,Cherry Hill,NJ,08034,,,"Home Performance Contractor, Construction Services, Air Conditioning Contractors",,,,,A+,,,https://www.bbb.org/us/nj/cherry-hill/profile/home-performance-contractor/allied-experts-heating-air-conditioning-0221-90146301,BBB,yes
"Alpha 1 HVAC, Inc.",(484) 838-6888,315 W Germantown Pike,Norristown,PA,19403,,,"Heating and Air Conditioning, Heating Contractors",,,,,A+,,,https://www.bbb.org/us/pa/norristown/profile/heating-and-air-conditioning/alpha-1-hvac-inc-0241-236089816,BBB,yes
Alvarez Construction LLC,(302) 333-8879,Wilmington,Philadelphia,PA,,,,"General Contractor, Roofing Contractors, Siding Contractors",,,,,A+,,,https://www.bbb.org/us/de/wilmington/profile/general-contractor/alvarez-construction-llc--0251-92034213,BBB,yes
"American Custom Construction, LLC",(856) 404-9746,184 Watsontown New Freedom Rd,Berlin,NJ,08009,,,"Construction Services, General Contractor, Home Improvement",,,,,A+,,,https://www.bbb.org/us/nj/berlin/profile/construction-services/american-custom-construction-llc-0221-90148131,BBB,yes
"American Water Resources, LLC",(618) 433-4236,1000 Bishops Gate Blvd Ste 301,Mount Laurel,NJ,08054,,,"Water and Sewer Line Protection, Heating and Air Conditioning, Air Conditioning Repair",,,,,A+,,,https://www.bbb.org/us/nj/mount-laurel/profile/water-and-sewer-line-protection/american-water-resources-llc-0221-27001589,BBB,yes
AmericanMechanicalContractors,(410) 668-4872,Glen Arm,Philadelphia,PA,,,,"Air Conditioning Contractors, Heating and Air Conditioning, Residential Air Conditioning Contractors",,,,,A+,,,https://www.bbb.org/us/md/glen-arm/profile/air-conditioning-contractor/american-mechanical-contractors-0011-90086215,BBB,yes
Anchor Mechanical LLC,(410) 452-5601,2650 Eisenhower Ave Ste A130,Norristown,PA,19403,,,"Residential Air Conditioning Contractors, Plumber, Heating and Air Conditioning",,,,,A+,,,https://www.bbb.org/us/pa/norristown/profile/residential-air-conditioning-contractors/anchor-mechanical-llc-0011-90275896/addressId/111011,BBB,yes
Anew Solution Inc,(908) 284-0224,6 Biggs Pl,Flemington,NJ,08822,,,"Heating and Air Conditioning, Plumber, Electrical Contractors",,,,,A+,,,https://www.bbb.org/us/nj/flemington/profile/heating-and-air-conditioning/anew-solution-inc-0221-90183773,BBB,yes
Anew Solution Inc,(908) 284-0234,PO Box 263,Flemington,NJ,08822,,,"Heating and Air Conditioning, Plumber, Electrical Contractors",,,,,A+,,,https://www.bbb.org/us/nj/flemington/profile/heating-and-air-conditioning/anew-solution-inc-0221-90183773/addressId/133169,BBB,yes
"Angel Heating & Cooling, Inc.",(610) 379-3028,465 Pike Rd,Huntingdon Vy,PA,19006,,,"Heating and Air Conditioning, Duct Cleaning, Residential Air Conditioning Contractors",,,,,A,,,https://www.bbb.org/us/pa/huntingdon-vy/profile/heating-and-air-conditioning/angel-heating-cooling-inc-0241-164853331/addressId/306903,BBB,yes
"Angel Heating & Cooling, Inc.",(215) 464-8712,1810 Mearns Rd,Warminster,PA,18974,,,"Heating and Air Conditioning, Duct Cleaning, Residential Air Conditioning Contractors",,,,,A,,,https://www.bbb.org/us/pa/warminster/profile/heating-and-air-conditioning/angel-heating-cooling-inc-0241-164853331,BBB,yes
"Anthony Zunino, Inc.",(610) 268-0201,290 Starr Rd,Landenberg,PA,19350,,,"Heating and Air Conditioning, Plumber, Water Treatment Equipment",,,,,A+,,,https://www.bbb.org/us/pa/landenberg/profile/heating-and-air-conditioning/anthony-zunino-inc-0241-235984288,BBB,yes
Anton HVAC & Mechanical LLC,(732) 771-4771,Old Bridge,Philadelphia,PA,,,,"Plumbing and Heating, Heating and Air Conditioning, Mechanical Contractors",,,,,A,,,https://www.bbb.org/us/nj/old-bridge/profile/plumbing-and-heating/anton-hvac-mechanical-llc-0221-90204696,BBB,yes
AntonPlumbingHeating&Cooling,(732) 771-4771,Old Bridge,Philadelphia,PA,,,,"Plumbing and Heating, Heating and Air Conditioning, Mechanical Contractors",,,,,A,,,https://www.bbb.org/us/nj/old-bridge/profile/plumbing-and-heating/anton-hvac-mechanical-llc-0221-90204696,BBB,yes
"Anyzek Fuel, Inc.",(856) 456-0347,916 Market St,Gloucester Cy,NJ,08030,,,"Fuel Oil, Plumber, Heating and Air Conditioning",,,,,A+,,,https://www.bbb.org/us/nj/gloucester-cy/profile/fuel-oil/anyzek-fuel-inc-0221-90006427,BBB,yes
"Anyzek Plumbing, Heating & Cooling",(856) 742-0218,916 Market St,Gloucester City,NJ,08030,,,"Plumber, Heating and Air Conditioning, Air Conditioning Contractors",,,,,A+,,,https://www.bbb.org/us/nj/gloucester-city/profile/plumber/anyzek-plumbing-heating-cooling-0221-90207740,BBB,yes
Apple Mechanical Services,(302) 420-5351,12 Sonia Ct,Wilmington,DE,19810,,,"Plumber, Heating and Air Conditioning, Air Conditioning Contractors",,,,,A+,,,https://www.bbb.org/us/de/wilmington/profile/plumber/apple-mechanical-services-0251-92027720,BBB,yes
"ASAPPlumbing,Heating&Cooling",(609) 646-2727,3 Canale Dr,"Unit 1 , Egg Harbor Twp",NJ,08234,,,"Plumber, Heating and Air Conditioning, Septic Tank Cleaning",,,,,A+,,,https://www.bbb.org/us/nj/egg-harbor-twp/profile/plumber/asap-plumbing-heating-cooling--0221-90157316,BBB,yes
Aslan Design & Build,(267) 733-3495,206 Green Top Rd,Sellersville,PA,18960,,,"Construction, General Contractor, Remodel Contractors",,,,,A+,,,https://www.bbb.org/us/pa/sellersville/profile/construction/aslan-design-build-0241-236102165,BBB,yes
"Asteroid Operating Company, Inc.",(732) 446-7040,529 Lincoln Ave Ext,Burlington,NJ,08016,,,"Heating and Air Conditioning, Plumber, Air Conditioning Contractors",,,,,A+,,,https://www.bbb.org/us/nj/burlington/profile/heating-and-air-conditioning/asteroid-operating-company-inc-0221-9001788/addressId/129981,BBB,yes
"Asteroid Operating Company, Inc.",(732) 446-9000,PO Box 128,Englishtown,NJ,07726,,,"Heating and Air Conditioning, Plumber, Air Conditioning Contractors",,,,,A+,,,https://www.bbb.org/us/nj/englishtown/profile/heating-and-air-conditioning/asteroid-operating-company-inc-0221-9001788/addressId/7266,BBB,yes
ATI Restoration LLC,(800) 400-9353,318 Boro Road,Primos,PA,19018,,,"Disaster Cleanup, General Contractor, Building Contractors",,,,,A+,,,https://www.bbb.org/us/pa/primos/profile/disaster-cleanup/ati-restoration-llc-0241-236071609/addressId/338943,BBB,yes
Atmostemp Service Experts,(856) 783-6600,215 Old Egg Harbor Rd Ste B,West Berlin,NJ,08091,,,"Heating and Air Conditioning, Plumber, Air Conditioning Contractors",,,,,A+,,,https://www.bbb.org/us/nj/west-berlin/profile/heating-and-air-conditioning/atmostemp-service-experts-0221-80000743/addressId/41554,BBB,yes
Azinex LLC,(609) 575-5055,Lawrenceville,Philadelphia,PA,,,,"Windows, Roofing Contractors, General Contractor",,,,,A+,,,https://www.bbb.org/us/nj/lawrenceville/profile/windows/azinex-llc-0221-90236878,BBB,yes
"B & B Contracting, LLC",(302) 998-7907,2502 Tigani Dr,Wilmington,DE,19808,,,"Bathroom Design, General Contractor, Construction Services",,,,,A+,,,https://www.bbb.org/us/de/wilmington/profile/bathroom-design/b-b-contracting-llc-0251-27000261,BBB,yes
B. Lawrence Homes LLC,(302) 559-1779,2505 Concord Pike Ste 2,Wilmington,DE,19803,,,"General Contractor, Construction Services, Home Improvement",,,,,A+,,,https://www.bbb.org/us/de/wilmington/profile/general-contractor/b-lawrence-homes-llc-0251-92004055,BBB,yes
Bailey Plumbing Heating Cooling,(732) 751-0711,100 Crosswicks St,Bordentown,NJ,08505,,,"Plumber, Air Conditioning Contractors, Drainage Contractors",,,,,A+,,,https://www.bbb.org/us/nj/bordentown/profile/plumber/bailey-plumbing-heating-cooling-0221-1000948/addressId/121752,BBB,yes
"Barber Plumbing & Heating, Inc",(610) 273-9099,256 Hill Rd,Honey Brook,PA,19344,,,"Plumber, Heating and Air Conditioning, Plumbing and Heating",,,,,A+,,,https://www.bbb.org/us/pa/honey-brook/profile/plumber/barber-plumbing-heating-inc-0241-174818529,BBB,yes
"Bates Brothers Mechanical, LLC",(610) 522-0888,3 Jackson Ave,Collingdale,PA,19023,,,Mechanical Contractors,,,,,A+,,,https://www.bbb.org/us/pa/collingdale/profile/mechanical-contractors/bates-brothers-mechanical-llc-0241-236078294,BBB,yes
Beacon Air Inc.,(302) 323-1385,PO Box 10806,Wilmington,DE,19850,,,"Heating and Air Conditioning, Air Conditioning Contractors, Air Conditioning Repair",,,,,A+,,,https://www.bbb.org/us/de/wilmington/profile/heating-and-air-conditioning/beacon-air-inc-0251-7797010/addressId/13186,BBB,yes
"Benditt Mechanical, LLC",(484) 466-3148,302 Lincoln Ave,Lansdowne,PA,19050,,,"Mechanical Contractors, Plumbing and Heating",,,,,A+,,,https://www.bbb.org/us/pa/lansdowne/profile/mechanical-contractors/benditt-mechanical-llc-0241-205813677,BBB,yes
Best Choice Plumbing & Heating,(215) 289-0169,2521 Orthodox Street,Philadelphia,PA,19137,,,"Plumber, Heating Contractors",,,,,A+,,,https://www.bbb.org/us/pa/philadelphia/profile/plumber/best-choice-plumbing-heating-0241-80008162,BBB,yes
Better Homes Building Products Corp,(856) 363-7000,341 Harding Hwy,Pittsgrove,NJ,08318,,,"General Contractor, Siding Contractors, Gutters",,,,,A+,,,https://www.bbb.org/us/nj/pittsgrove/profile/general-contractor/better-homes-building-products-corp-0221-90074403,BBB,yes
"Big Dawg's Plumbing & Heating, Inc.",(215) 722-1234,5300 Umbria St,Philadelphia,PA,19128,,,"Plumber, Heating Contractors",,,,,A+,,,https://www.bbb.org/us/pa/philadelphia/profile/plumber/big-dawgs-plumbing-heating-inc-0241-173134993,BBB,yes
Bills Flooring & Remodeling,(856) 264-1079,8 Randolph Dr,Sicklerville,NJ,08081,,,"New Carpets, General Contractor, Bathroom Remodel",,,,,A,,,https://www.bbb.org/us/nj/sicklerville/profile/new-carpet/bills-flooring-remodeling-0221-26002307,BBB,yes
Black Horse Plumbing Heating and Air LLC,(856) 875-6066,4120 Black Horse Pike Ste C,Turnersville,NJ,08012,,,"Plumber, Air Conditioning Contractors, Residential Air Conditioning Contractors",,,,,A+,,,https://www.bbb.org/us/nj/turnersville/profile/plumber/black-horse-plumbing-heating-and-air-llc-0221-80009633,BBB,yes
"Blue Collar Builders, LLC.",(267) 222-8859,1282 Welsh Rd,North Wales,PA,19454,,,"General Contractor, Building Contractors, Carpenter",,,,,A+,,,https://www.bbb.org/us/pa/north-wales/profile/general-contractor/blue-collar-builders-llc-0241-236025612,BBB,yes
"BluSky Restoration Contractors, LLC",(303) 789-4759,2495 Blvd of the Genrls,West Norriton,PA,19403,,,"Fire and Water Damage Restoration, Roofing Contractors, General Contractor",,,,,A+,,,https://www.bbb.org/us/pa/west-norriton/profile/fire-water-damage-restoration/blusky-restoration-contractors-llc-0241-236073207/addressId/385353,BBB,yes
BMR Belmax Remodeling,(609) 712-2750,603 Churchville Ln,Southampton,PA,18966,,,"Remodeling, Roofing Contractors, General Contractor",,,,,A+,,,https://www.bbb.org/us/pa/southampton/profile/remodeling/bmr-belmax-remodeling-0241-236070022/addressId/374890,BBB,yes
"Bob Cermignano Air Conditioning & Heating, Inc.",(610) 789-2909,32 Saint Pauls Rd,Ardmore,PA,19003,,,"Heating and Air Conditioning, Air Conditioning Contractors, Air Conditioning Repair",,,,,A+,,,https://www.bbb.org/us/pa/ardmore/profile/heating-and-air-conditioning/bob-cermignano-air-conditioning-heating-inc-0241-80006772,BBB,yes
Borden Heating & Cooling Inc.,(610) 325-9966,501 Abbott Dr Ste G3,Broomall,PA,19008,,,Heating and Air Conditioning,,,,,A+,,,https://www.bbb.org/us/pa/broomall/profile/heating-and-air-conditioning/borden-heating-cooling-inc-0241-173157635,BBB,yes
"Boulden Brothers -Plumbing, Heating, Air, and Electric",(302) 368-3848,107 Sandy Dr Bldg 700,Newark,DE,19713,,,"Heating and Air Conditioning, Plumber, Electrician",,,,,A+,,,https://www.bbb.org/us/de/newark/profile/heating-and-air-conditioning/boulden-brothers-plumbing-heating-air-and-electric-0251-22000242,BBB,yes
"Bovio Rubino Services, LLC",(856) 740-3800,101 Summit Ave,Sicklerville,NJ,08081,,,"Residential Air Conditioning Contractors, Plumber, Heating and Air Conditioning",,,,,A+,,,https://www.bbb.org/us/nj/sicklerville/profile/residential-air-conditioning-contractors/bovio-rubino-services-llc-0221-90087017/addressId/68670,BBB,yes
BovioHeating& Air Conditioning,(856) 740-3800,101 Summit Ave,Sicklerville,NJ,08081,,,"Residential Air Conditioning Contractors, Plumber, Heating and Air Conditioning",,,,,A+,,,https://www.bbb.org/us/nj/sicklerville/profile/residential-air-conditioning-contractors/bovio-rubino-services-llc-0221-90087017/addressId/68670,BBB,yes
Brainard & Co. Construction LLC,(302) 690-1169,1303 Delaware Ave Apt 303,Wilmington,DE,19806,,,"General Contractor, Bathroom Remodel, Kitchen Remodel",,,,,A+,,,https://www.bbb.org/us/de/wilmington/profile/general-contractor/brainard-co-construction-llc--0251-92034401,BBB,yes
"Breeding & Day, Inc.",(302) 478-4585,3316 Silverside Rd Ste A,Wilmington,DE,19810,,,"Heating and Air Conditioning, Plumber, Bathroom Remodel",,,,,A+,,,https://www.bbb.org/us/de/wilmington/profile/heating-and-air-conditioning/breeding-day-inc-0251-22000185,BBB,yes
"Breeding & Day, Inc.",(302) 478-4656,PO Box 7618,Talleyville,DE,19803,,,"Heating and Air Conditioning, Plumber, Bathroom Remodel",,,,,A+,,,https://www.bbb.org/us/de/talleyville/profile/heating-and-air-conditioning/breeding-day-inc-0251-22000185/addressId/63839,BBB,yes
Brian Augustine Custom Builder,(215) 852-2058,2510 Aspen St,Philadelphia,PA,19130,,,"Remodel Contractors, General Contractor, Handyman",,,,,A+,,,https://www.bbb.org/us/pa/philadelphia/profile/remodel-contractors/brian-augustine-custom-builder-0241-80016234,BBB,yes
Brindisi Builders,(856) 985-6219,59 S Maple Ave,Marlton,NJ,08053,,,"General Contractor, Remodel Contractors, Bathroom Design",,,,,A+,,,https://www.bbb.org/us/nj/marlton/profile/general-contractor/brindisi-builders-0221-80001200,BBB,yes
Bucchino General Contracting LLC,(609) 585-7100,45 Whitehorse Ave,Trenton,NJ,08610,,,"General Contractor, Roofing Contractors, Construction Services",,,,,A+,,,https://www.bbb.org/us/nj/trenton/profile/general-contractor/bucchino-general-contracting-llc-0221-11008657,BBB,yes
"Buckanavage Home Improvements, LLC",(302) 540-9934,101 Rothwell Rd,Wilmington,DE,19805,,,"Home Improvement, General Contractor, Construction Services",,,,,A+,,,https://www.bbb.org/us/de/wilmington/profile/home-improvement/buckanavage-home-improvements-llc-0251-92008680,BBB,yes
"Bucks County Plumbing AndMechanicalContractors, Inc.",(215) 946-9222,10 Granite Rd,Levittown,PA,19057,,,Plumber,,,,,A+,,,https://www.bbb.org/us/pa/levittown/profile/plumber/bucks-county-plumbing-and-mechanical-contractors-inc-0241-80016321,BBB,yes
Bucks HVAC,(888) 645-7552,3094 Rushland Rd,Jamison,PA,18929,,,"Residential Air Conditioning Contractors, Heating and Air Conditioning",,,,,A+,,,https://www.bbb.org/us/pa/jamison/profile/residential-air-conditioning-contractors/bucks-hvac-0241-236004411,BBB,yes
Buzz Duzz Plumbing & Heating & Air Conditioning Inc.,(215) 533-7000,4721 Van Kirk St,Phila,PA,19135,,,"Heating and Air Conditioning, Plumber",,,,,A+,,,https://www.bbb.org/us/pa/phila/profile/heating-and-air-conditioning/buzz-duzz-plumbing-heating-air-conditioning-inc-0241-114502599,BBB,yes
"C & C Heating & Air Conditioning Company, Incorporated",(215) 799-0525,800 Hagey Rd,Souderton,PA,18964,,,"Heating and Air Conditioning, Heating Contractors",,,,,A+,,,https://www.bbb.org/us/pa/souderton/profile/heating-and-air-conditioning/c-c-heating-air-conditioning-company-incorporated-0241-80002542,BBB,yes
C W Services LLC,(856) 279-2670,Woodstown,Philadelphia,PA,,,,"Heating and Air Conditioning, Plumber, Air Conditioning Contractors",,,,,A+,,,https://www.bbb.org/us/nj/woodstown/profile/heating-and-air-conditioning/c-w-services-llc-0221-90228945,BBB,yes
Campbell Mechanical LLC,(856) 935-0968,PO Box 34,Salem,NJ,08079,,,"Mechanical Contractors, Heating and Air Conditioning, Air Conditioning Contractors",,,,,A+,,,https://www.bbb.org/us/nj/salem/profile/mechanical-contractors/campbell-mechanical-llc-0221-27000248,BBB,yes
"Carl R. Pursell, Inc.",(856) 768-6500,115 Berlin Cross Keys Rd Ste E,Berlin,NJ,08009,,,"General Contractor, Construction Services, Building Contractors",,,,,A+,,,https://www.bbb.org/us/nj/berlin/profile/general-contractor/carl-r-pursell-inc-0221-80004775,BBB,yes
"Carlo Plumbing & Heating, Inc.",(856) 665-0233,2230 Clements Ave Ste A,Pennsauken,NJ,08110,,,"Plumber, Mechanical Contractors",,,,,A+,,,https://www.bbb.org/us/nj/pennsauken/profile/plumber/carlo-plumbing-heating-inc-0221-90057085,BBB,yes
"Carney All Seasons, LLC",(215) 346-7160,1100 Industrial Blvd,Southampton,PA,18966,,,"Plumber, Heating and Air Conditioning, Bathroom Remodel",,,,,A+,,,https://www.bbb.org/us/pa/southampton/profile/plumber/carney-all-seasons-llc-0241-80001628/addressId/304139,BBB,yes
"CarrFord Heating & Air Conditioning, Inc.",(856) 258-5220,68 Paulsboro Rd,Woolwich Township,NJ,08085,,,"Heating and Air Conditioning, Air Conditioning Contractors, Heating Contractors",,,,,A+,,,https://www.bbb.org/us/nj/woolwich-township/profile/heating-and-air-conditioning/carrford-heating-air-conditioning-inc-0221-80001642,BBB,yes
"Cella Roofing & Remodeling, LLC",(856) 429-4088,123 E Main St # 1153,Marlton,NJ,08053,,,"Construction, Roofing Contractors, General Contractor",,,,,A+,,,https://www.bbb.org/us/nj/marlton/profile/construction/cella-roofing-remodeling-llc-0221-16006285,BBB,yes
