name,phone,address,city,state,zip_code,email,website,category,license_number,license_type,license_expiry,types_of_work,bbb_rating,google_rating,review_count,bbb_profile_url,source,is_new_to_db
"R&D Heating, Cooling & Electric",(610) 444-5572,Wilmington,Philadelphia,PA,,,,"Heating and Air Conditioning, Air Conditioning Contractors, Air Conditioning Repair",,,,,A+,,,https://www.bbb.org/us/de/wilmington/profile/heating-and-air-conditioning/rd-heating-cooling-electric-0251-27000339,BBB,yes
"R. S. Widdoes & Son, Inc.",(302) 764-7455,204 Channel Rd,Wilmington,DE,19809,,,"Concrete Contractors, General Contractor, Mason Contractors",,,,,A+,,,https://www.bbb.org/us/de/wilmington/profile/concrete-contractors/r-s-widdoes-son-inc-0251-26000329,BBB,yes
"R.E. Morrison Contracting, Inc.",(215) 249-3491,134 Maple Avenue,Dublin,PA,18917,,,"General Contractor, Construction Services, Home Improvement",,,,,A+,,,https://www.bbb.org/us/pa/dublin/profile/general-contractor/re-morrison-contracting-inc-0241-235990317,BBB,yes
"R.L. Adams Heating & Air Conditioning, LLC",(215) 918-0918,PO Box 711,Warrington,PA,18976,,,"Heating and Air Conditioning, Heating Contractors",,,,,A+,,,https://www.bbb.org/us/pa/warrington/profile/heating-and-air-conditioning/rl-adams-heating-air-conditioning-llc-0241-235250493/addressId/166562,BBB,yes
"Ralph Jain Enterprises, Inc.",(267) 282-5948,665 Catherine St,Warminster,PA,18974,,,"General Contractor, Construction Services, Home Improvement",,,,,A+,,,https://www.bbb.org/us/pa/warminster/profile/general-contractor/ralph-jain-enterprises-inc-0241-75000251,BBB,yes
Raynor Services,(609) 714-0505,401 Pine St,Westampton,NJ,08060,,,"Electrician, Heating and Air Conditioning, Air Conditioning Contractors",,,,,A+,,,https://www.bbb.org/us/nj/westampton/profile/electrician/raynor-services-0221-90046488,BBB,yes
Region Home Services LLC,(215) 639-0424,3494 Progress Dr Ste E,Bensalem,PA,19020,,,"Heating and Air Conditioning, Remodeling, Construction",,,,,A+,,,https://www.bbb.org/us/pa/bensalem/profile/heating-and-air-conditioning/region-home-services-llc-0241-236077653,BBB,yes
Reiser General Contracting,(860) 853-0589,234 Suffolk Rd,Fairless Hills,PA,19030,,,"General Contractor, Remodel Contractors, Chimney Cleaning",,,,,A+,,,https://www.bbb.org/us/pa/fairless-hills/profile/general-contractor/reiser-general-contracting-0241-236085442,BBB,yes
Reliance Contracting & Renovating Inc.,(609) 975-8767,27 S Main Street,Medford,NJ,08055,,,"General Contractor, Gutters, Bathroom Design",,,,,A+,,,https://www.bbb.org/us/nj/medford/profile/general-contractor/reliance-contracting-renovating-inc-0221-90048120,BBB,yes
"Retail MDS, Inc.",(610) 630-1625,Plymouth Meeting,Philadelphia,PA,,,,"Commercial Contractors, General Contractor, Facility Maintenance",,,,,A+,,,https://www.bbb.org/us/pa/plymouth-meeting/profile/commercial-contractors/retail-mds-inc-0241-235999562,BBB,yes
Retro HVAC Service & Installation LLC,(215) 728-7144,671A Mary St,Warminster,PA,18974,,,"Heating and Air Conditioning, Plumber, Air Conditioning Contractors",,,,,A+,,,https://www.bbb.org/us/pa/warminster/profile/heating-and-air-conditioning/retro-hvac-service-installation-llc-0241-236062404,BBB,yes
Richard H. Kazigian Home Improvements,(610) 353-7349,West Chester,Philadelphia,PA,,,,"General Contractor, Roofing Contractors, Construction Services",,,,,A+,,,https://www.bbb.org/us/pa/west-chester/profile/general-contractor/richard-h-kazigian-home-improvements-0241-80002747,BBB,yes
Richard H. Lutz & Sons Inc.,(610) 584-8008,4407 Skippack Pike,Schwenksville,PA,19473,,,"Heating Supplies, Landscape Contractors, Topsoil",,,,,A+,,,https://www.bbb.org/us/pa/schwenksville/profile/heating-supply/richard-h-lutz-sons-inc-0241-80010361,BBB,yes
"Richard M. Crossan, Inc.",(610) 268-3895,1133 Newark Rd,Toughkenamon,PA,19374,,,"Air Conditioning Contractors, Plumber, Heating and Air Conditioning",,,,,A+,,,https://www.bbb.org/us/pa/toughkenamon/profile/air-conditioning-contractor/richard-m-crossan-inc-0241-80009435,BBB,yes
Rightlook-Sealcoating LLC,(302) 213-4956,New Castle,Philadelphia,PA,,,,"Seal Coating, Paving Contractors, Asphalt",,,,,A+,,,https://www.bbb.org/us/de/new-castle/profile/seal-coating/rightlook-sealcoating-llc--0251-92032338,BBB,yes
"RileyMechanicalContractors, Inc",(215) 675-2023,1836 Stout Dr,Warminster,PA,18974,,,Heating and Air Conditioning,,,,,A+,,,https://www.bbb.org/us/pa/warminster/profile/heating-and-air-conditioning/riley-heating-air-conditioning-0241-80006755,BBB,yes
"Robert Slater, Inc.",(610) 287-1516,94 Highland Ave,Schwenksville,PA,19473,,,"Excavating Contractors, General Contractor",,,,,A+,,,https://www.bbb.org/us/pa/schwenksville/profile/excavating-contractors/robert-slater-inc-0241-236012709,BBB,yes
"Robert Slater, Inc.",(610) 287-9088,PO Box 326,Schwenksville,PA,19473,,,"Excavating Contractors, General Contractor",,,,,A+,,,https://www.bbb.org/us/pa/schwenksville/profile/excavating-contractors/robert-slater-inc-0241-236012709/addressId/243071,BBB,yes
Rock Solid Contracting,(302) 655-8250,1213 B St,Wilmington,DE,19801,,,"General Contractor, Bathroom Remodel, Remodel Contractors",,,,,A+,,,https://www.bbb.org/us/de/wilmington/profile/general-contractor/rock-solid-contracting-0251-32000538,BBB,yes
Ron Sirolli Construction Co. Inc.,(609) 561-9029,504 Fleming Pike,Hammonton,NJ,08037,,,"General Contractor, Home Builders, Siding Contractors",,,,,A+,,,https://www.bbb.org/us/nj/hammonton/profile/general-contractor/ron-sirolli-construction-co-inc-0221-80006166,BBB,yes
Ronco Tech Heating & Cooling LLC,(267) 231-7488,406 E Pennsylvania Blvd,Feasterville Trevose,PA,19053,,,Heating and Air Conditioning,,,,,A+,,,https://www.bbb.org/us/pa/feasterville-trevose/profile/heating-and-air-conditioning/ronco-tech-heating-cooling-llc-0241-236104021,BBB,yes
RTF Mechanical,(215) 486-5100,PO Box 1066,Levittown,PA,19058,,,Mechanical Contractors,,,,,A+,,,https://www.bbb.org/us/pa/levittown/profile/mechanical-contractors/rtf-mechanical-0241-236030507,BBB,yes
"Runnemede Plumbing, Heating, Cooling and Electric Co.",(856) 939-4299,39 N Black Horse Pike,Runnemede,NJ,08078,,,"Residential Air Conditioning Contractors, Plumber, Heating and Air Conditioning",,,,,A+,,,https://www.bbb.org/us/nj/runnemede/profile/residential-air-conditioning-contractors/runnemede-plumbing-heating-cooling-and-electric-co-0221-80001831,BBB,yes
"RupCoe Plumbing, Heating & Air Conditioning",(908) 226-1616,210 New Market Ave,S Plainfield,NJ,07080,,,"Plumber, Heating and Air Conditioning, Air Conditioning Contractors",,,,,A+,,,https://www.bbb.org/us/nj/s-plainfield/profile/plumber/rupcoe-plumbing-heating-air-conditioning-0221-16005591,BBB,yes
"S.G.N. Mechanical Services, Inc",(215) 783-1057,6708 Charles St,Philadelphia,PA,19135,,,Mechanical Contractors,,,,,A+,,,https://www.bbb.org/us/pa/philadelphia/profile/mechanical-contractors/sgn-mechanical-services-inc-0241-236031452,BBB,yes
"Sabin & Associates, Inc.",(610) 853-1550,8729 W Chester Pike,Upper Darby,PA,19082,,,"Mechanical Contractors, Electrician, Heating and Air Conditioning",,,,,A+,,,https://www.bbb.org/us/pa/upper-darby/profile/mechanical-contractors/sabin-associates-inc-0241-236071381,BBB,yes
Safer Home Services LLC,(856) 271-5313,1409 Marlton Pike Rte 70 E Ste 168 Unit 103,Cherry Hill,NJ,08034,,,"Mold Inspection, Waterproofing Contractors, Mold Removal",,,,,A+,,,https://www.bbb.org/us/nj/cherry-hill/profile/mold-inspection/safer-home-services-llc-0221-90217601,BBB,yes
Saintco Mechanical,(610) 558-8168,86 Park Ln,Glen Mills,PA,19342,,,Heating and Air Conditioning,,,,,A+,,,https://www.bbb.org/us/pa/glen-mills/profile/heating-and-air-conditioning/saintco-mechanical-0241-80019365,BBB,yes
"Sanco Construction Company, Inc.",(302) 633-4156,24 Brookside Dr,Newport,DE,19804,,,"Excavating Contractors, General Contractor, Paving Contractors",,,,,A+,,,https://www.bbb.org/us/de/newport/profile/excavating-contractors/sanco-construction-company-inc-0251-1709000,BBB,yes
"Sanks Mechanical, LLC",(215) 960-4803,9317 Keystone St,Philadelphia,PA,19114,,,Heating and Air Conditioning,,,,,A+,,,https://www.bbb.org/us/pa/philadelphia/profile/heating-and-air-conditioning/sanks-mechanical-llc-0241-236041299,BBB,yes
"Scatton's Heating & Cooling, Inc.",(215) 855-6144,920 Allentown Rd,Lansdale,PA,19446,,,"Heating and Air Conditioning, Air Conditioning Contractors, Heating Contractors",,,,,A+,,,https://www.bbb.org/us/pa/lansdale/profile/heating-and-air-conditioning/scattons-heating-cooling-inc-0241-80007303,BBB,yes
Scozzari Builders Inc.,(609) 989-1221,1891 N Olden Avenue Ext,Ewing,NJ,08638,,,"General Contractor, Building Contractors, Construction Management",,,,,A+,,,https://www.bbb.org/us/nj/ewing/profile/general-contractor/scozzari-builders-inc-0221-13000665,BBB,yes
Second Generation Contractors LLC,(609) 777-9137,PO Box 2311,Trenton,NJ,08607,,,"General Contractor, Roofing Contractors, Siding Contractors",,,,,A+,,,https://www.bbb.org/us/nj/trenton/profile/general-contractor/second-generation-contractors-llc-0221-90169984/addressId/111476,BBB,yes
Second Generation Contractors LLC,(609) 777-9136,314 Cortland St,Trenton,NJ,08638,,,"General Contractor, Roofing Contractors, Siding Contractors",,,,,A+,,,https://www.bbb.org/us/nj/trenton/profile/general-contractor/second-generation-contractors-llc-0221-90169984,BBB,yes
Seer Mechanical LLC,(267) 332-0059,633 Center Ave,Bensalem,PA,19020,,,"Heating and Air Conditioning, Commercial Contractors",,,,,A+,,,https://www.bbb.org/us/pa/bensalem/profile/heating-and-air-conditioning/seer-mechanical-llc-0241-236101662,BBB,yes
"Service Today Heating, Air Conditioning, Plumbing and Electrical",(443) 203-8964,108 Carson Dr,Bear,DE,19701,,,"Heating and Air Conditioning, Plumber, Electrician",,,,,A+,,,https://www.bbb.org/us/de/bear/profile/heating-and-air-conditioning/service-today-heating-air-conditioning-plumbing-and-electrical-0251-7004050/addressId/62354,BBB,yes
Service Unlimited Inc.,(302) 326-2665,19 Southgate Blvd,New Castle,DE,19720,,,"Heating and Air Conditioning, Air Conditioning Contractors, Air Conditioning Repair",,,,,A+,,,https://www.bbb.org/us/de/new-castle/profile/heating-and-air-conditioning/service-unlimited-inc-0251-32000027,BBB,yes
Servicon Facilities & Mechanical Services,(410) 469-7900,35690 Woodyard Ct,Mechanicsvlle,MD,20659,,,Mechanical Contractors,,,,,A+,,,https://www.bbb.org/us/md/mechanicsvlle/profile/mechanical-contractors/servicon-facilities-mechanical-services-0241-236050855,BBB,yes
"SG Heating & Air Conditioning, LLC",(609) 448-1273,50 Cunningham Ave,Trenton,NJ,08610,,,"Heating and Air Conditioning, Electrician, Heating Contractors",,,,,A+,,,https://www.bbb.org/us/nj/trenton/profile/heating-and-air-conditioning/sg-heating-air-conditioning-llc-0221-27003269,BBB,yes
Shamrock Heating & Air Conditioning Inc,(609) 859-1443,PO Box 2537,Vincentown,NJ,08088,,,"Air Conditioning Contractors, Heating and Air Conditioning",,,,,A+,,,https://www.bbb.org/us/nj/vincentown/profile/air-conditioning-contractor/shamrock-heating-air-conditioning-inc-0221-80003934,BBB,yes
"Shellhorn & Hill, Inc.",(302) 657-5017,3016 Edgemoor Ave,Wilmington,DE,19801,,,"Fuel Oil, Heating and Air Conditioning, Air Conditioning Contractors",,,,,A+,,,https://www.bbb.org/us/de/wilmington/profile/fuel-oil/shellhorn-hill-inc-0251-2271010,BBB,yes
Shipley Energy,(717) 854-5496,57 Lancaster Ave,Malvern,PA,19355,,,"Energy Service Company, Heating and Air Conditioning, Fuel Oil",,,,,A+,,,https://www.bbb.org/us/pa/malvern/profile/energy-service-company/shipley-energy-0241-70000797/addressId/332766,BBB,yes
"Shoemaker Heating and Cooling, LLC",(610) 671-3595,3783 Horseshoe Pike,Honey Brook,PA,19344,,,"Heating and Air Conditioning, Air Conditioning Contractors, Electrical Contractors",,,,,A+,,,https://www.bbb.org/us/pa/honey-brook/profile/heating-and-air-conditioning/shoemaker-heating-and-cooling-llc-0241-236089721,BBB,yes
Showcase Remodels,(888) 219-9449,505 Nj-168 D,Turnersville,NJ,08012,,,"General Contractor, Home Improvement, Bathroom Remodel",,,,,A+,,,https://www.bbb.org/us/nj/turnersville/profile/general-contractor/showcase-remodels--0221-90059928,BBB,yes
Signature HVAC,(610) 441-7499,1330 Enterprise Dr,West Chester,PA,19380,,,"Heating and Air Conditioning, Geothermal Heat Pumps",,,,,A+,,,https://www.bbb.org/us/pa/west-chester/profile/heating-and-air-conditioning/signature-hvac-0241-181207023,BBB,yes
Sila Services LLC,(610) 491-9409,290 Hansen Access Rd,King of Prussia,PA,19406,,,"Heating and Air Conditioning, Plumber, Air Conditioning Contractors",,,,,,,,https://www.bbb.org/us/pa/king-of-prussia/profile/heating-and-air-conditioning/sila-services-llc-0241-235984290/addressId/184729,BBB,yes
"SilaHeatingandAirConditioning, Inc.",(610) 491-9409,290 Hansen Access Rd,King of Prussia,PA,19406,,,"Heating and Air Conditioning, Plumber, Air Conditioning Contractors",,,,,,,,https://www.bbb.org/us/pa/king-of-prussia/profile/heating-and-air-conditioning/sila-services-llc-0241-235984290/addressId/184729,BBB,yes
Skilled Builders Plus LLC,(609) 343-0106,2240 W Sergeant St,Philadelphia,PA,19132,,,"Home Improvement, Home Builders, Building Contractors",,,,,A+,,,https://www.bbb.org/us/pa/philadelphia/profile/home-improvement/skilled-builders-plus-llc-0241-202140614,BBB,yes
Skip The Warehouse,(215) 316-5893,1210 Stanbridge St Ste 100,Norristown,PA,19401,,,"Air Conditioning Equipment, Heating and Air Conditioning, Heating and Air Conditioning Filters",,,,,A+,,,https://www.bbb.org/us/pa/norristown/profile/air-conditioning-equipment/skip-the-warehouse-0241-236089303,BBB,yes
Smucker Mechanical LLC,(717) 768-8142,5490 Elam Rd,Gap,PA,17527,,,"Heating and Air Conditioning, Plumber, Air Duct Cleaning",,,,,A+,,,https://www.bbb.org/us/pa/gap/profile/heating-and-air-conditioning/smucker-mechanical-llc-0241-172721220,BBB,yes
SobieskiMechanicalContractorsInc.,(302) 993-0119,900 Uniqema Blvd,New Castle,DE,19720,,,"Heating and Air Conditioning, Construction Services, Plumber",,,,,A+,,,https://www.bbb.org/us/de/new-castle/profile/heating-and-air-conditioning/jf-sobieski-mechanical-contractors-inc-0251-21001178/addressId/33444,BBB,yes
SobieskiMechanicalContractorsInc.,(302) 504-4116,1325 Old Coochs Bridge Rd,Newark,DE,19713,,,"Heating and Air Conditioning, Construction Services, Plumber",,,,,A+,,,https://www.bbb.org/us/de/newark/profile/heating-and-air-conditioning/jf-sobieski-mechanical-contractors-inc-0251-21001178,BBB,yes
"Solution Based Plumbing and Heating, Inc",(215) 584-2098,2405 New Falls Rd,Levittown,PA,19056,,,"Plumber, Heating and Air Conditioning, Heating Contractors",,,,,A+,,,https://www.bbb.org/us/pa/levittown/profile/plumber/solution-based-plumbing-and-heating-inc-0241-236007069,BBB,yes
"Spring Valley Contracting, LLC",(610) 495-0734,65 Airport Rd,POttstown,PA,19464,,,"General Contractor, Roofing Contractors",,,,,A+,,,https://www.bbb.org/us/pa/pottstown/profile/general-contractor/spring-valley-contracting-llc-0241-235983899,BBB,yes
SPS Mechanical Inc.,(856) 467-0527,68 Paulsboro Rd Ste 1,Swedesboro,NJ,08085,,,"Air Conditioning Contractors, Plumber, Heating and Air Conditioning",,,,,A+,,,https://www.bbb.org/us/nj/swedesboro/profile/air-conditioning-contractor/sps-mechanical-inc-0221-23001406,BBB,yes
Stallion Heating Plumbing Air Conditioning,(215) 515-0651,1641 Delmar Dr,Folcroft,PA,19032,,,"Heating and Air Conditioning, Plumber, Air Conditioning Contractors",,,,,A+,,,https://www.bbb.org/us/pa/folcroft/profile/heating-and-air-conditioning/stallion-heating-plumbing-air-conditioning-0241-236074754/addressId/343043,BBB,yes
"Stan Perkoski's Plumbing & Heating, Inc.",(302) 529-0756,1818 Marsh Rd,Wilmington,DE,19810,,,"Heating and Air Conditioning, Plumber, Bathroom Remodel",,,,,A+,,,https://www.bbb.org/us/de/wilmington/profile/heating-and-air-conditioning/stan-perkoskis-plumbing-heating-inc-0251-22002515,BBB,yes
Standard Mechanical Services,(609) 532-6635,165 3rd St Bldg 1,Bordentown,NJ,08505,,,Mechanical Contractors,,,,,,,,https://www.bbb.org/us/nj/bordentown/profile/mechanical-contractors/standard-mechanical-services--0221-90201310,BBB,yes
Stay-Cool Cooling & Heating Co,(856) 366-5445,Cherry Hill,Philadelphia,PA,,,,Heating and Air Conditioning,,,,,A+,,,https://www.bbb.org/us/nj/cherry-hill/profile/heating-and-air-conditioning/stay-cool-cooling-heating-co-0221-90071950,BBB,yes
Stofan Construction LLC,(800) 406-9716,607 Drexel Rd,Fairless Hls,PA,19030,,,"Roofing Contractors, General Contractor, Siding Contractors",,,,,A+,,,https://www.bbb.org/us/pa/fairless-hls/profile/roofing-contractors/stofan-construction-llc-0241-143809856,BBB,yes
Storm Guard of Ches-Mont PA,(610) 750-9718,133 Possum Hollow Rd Ste 150,Pottstown,PA,19464,,,"Roofing Contractors, General Contractor, Painting Contractors",,,,,A+,,,https://www.bbb.org/us/pa/pottstown/profile/roofing-contractors/storm-guard-of-ches-mont-pa-0241-236017305,BBB,yes
Summers Quality Services,(215) 482-8804,8200 Ridge Ave,Philadelphia,PA,19128,,,"Air Conditioning Contractors, Electrical Contractors",,,,,A+,,,https://www.bbb.org/us/pa/philadelphia/profile/air-conditioning-contractor/summers-quality-services-0241-80012237,BBB,yes
"Summit Wrecking & Demolition, LLC",(215) 669-7082,585 W Bristol Rd,Warminster,PA,18974,,,"Fire and Water Damage Restoration, General Contractor, Demolition Contractors",,,,,A+,,,https://www.bbb.org/us/pa/warminster/profile/fire-water-damage-restoration/summit-wrecking-demolition-llc-0241-235985154,BBB,yes
"Sunrise Comfort Solutions, LLC",(610) 600-6008,833 Lincoln Ave Unit 2,West Chester,PA,19380,,,"Heating and Air Conditioning, Air Conditioning Contractors, Electrical Contractors",,,,,A+,,,https://www.bbb.org/us/pa/west-chester/profile/heating-and-air-conditioning/sunrise-comfort-solutions-llc-0241-236044659,BBB,yes
T J Eckardt Associates Inc,(856) 768-7499,230 Williamstown Road,Berlin,NJ,08009,,,"Air Conditioning Contractors, Heating and Air Conditioning, Sheet Metal Fabrication",,,,,A+,,,https://www.bbb.org/us/nj/berlin/profile/air-conditioning-contractor/t-j-eckardt-associates-inc-0221-80002636,BBB,yes
TAC Construction Services,(856) 304-1896,Palmyra,Philadelphia,PA,,,,"Construction, General Contractor, Building Contractors",,,,,A+,,,https://www.bbb.org/us/nj/palmyra/profile/construction/tac-construction-services-0221-90236280,BBB,yes
The Burpee Group LLC,(856) 218-8911,Sewell,Philadelphia,PA,,,,"General Contractor, Landscape Contractors, Fence Contractors",,,,,A+,,,https://www.bbb.org/us/nj/sewell/profile/general-contractor/the-burpee-group-llc-0221-90159002,BBB,yes
The General Roofing & Contracting Co.,(215) 482-3444,5504 Ridge Ave,Philadelphia,PA,19128,,,"Roofing Contractors, General Contractor",,,,,A+,,,https://www.bbb.org/us/pa/philadelphia/profile/roofing-contractors/the-general-roofing-contracting-co-0241-80002733,BBB,yes
The Window Place Plus Exteriors,(856) 216-1888,2401 Burroughs Mill Cir,Cherry Hill,NJ,08002,,,"Windows, General Contractor, Siding Contractors",,,,,A+,,,https://www.bbb.org/us/nj/cherry-hill/profile/windows/the-window-place-plus-exteriors-0221-90186052,BBB,yes
The Witmer Company,(717) 355-2780,PO Box 338,New Holland,PA,17557,,,"Heating and Air Conditioning, Plumber",,,,,A+,,,https://www.bbb.org/us/pa/new-holland/profile/heating-and-air-conditioning/the-witmer-company-0241-1042745/addressId/195635,BBB,yes
The Witmer Company,(717) 354-4281,286 Locust St,New Holland,PA,17557,,,"Heating and Air Conditioning, Plumber",,,,,A+,,,https://www.bbb.org/us/pa/new-holland/profile/heating-and-air-conditioning/the-witmer-company-0241-1042745,BBB,yes
Thermo-Stat Heating & Cooling,(215) 702-0705,19 Maplewood Dr,Levittown,PA,19056,,,"Heating and Air Conditioning, Heating Contractors",,,,,A+,,,https://www.bbb.org/us/pa/levittown/profile/heating-and-air-conditioning/thermo-stat-heating-cooling-0241-235991355,BBB,yes
Thompson Plumbing & Heating,(215) 564-1758,2017 Brandywine St,Philadelphia,PA,19130,,,"Plumber, Heating Contractors",,,,,A+,,,https://www.bbb.org/us/pa/philadelphia/profile/plumber/thompson-plumbing-heating-0241-80003965,BBB,yes
Timber Ridge LLC,(888) 988-4623,Downingtown,Philadelphia,PA,,,,"Home Improvement, General Contractor, Construction Services",,,,,A+,,,https://www.bbb.org/us/pa/downingtown/profile/home-improvement/timber-ridge-llc-0241-200543528,BBB,yes
"Tindall & Ranson, Inc.",(609) 924-3434,55 N Main St,Windsor,NJ,08561,,,"Plumber, Heating and Air Conditioning, Bathroom Design",,,,,A+,,,https://www.bbb.org/us/nj/windsor/profile/plumber/tindall-ranson-inc-0221-9000222,BBB,yes
"TLM Contracting, Inc.",(215) 715-4341,5255 Horrocks St,Philadelphia,PA,19124,,,"Home Improvement, Roofing Contractors, General Contractor",,,,,A+,,,https://www.bbb.org/us/pa/philadelphia/profile/home-improvement/tlm-contracting-inc-0241-213049417,BBB,yes
Toran Heating and Air Conditioning Inc.,(610) 348-1142,45 E City Ave,Bala Cynwyd,PA,19004,,,"Heating and Air Conditioning, Air Conditioning Contractors, Air Conditioning Repair",,,,,A+,,,https://www.bbb.org/us/pa/bala-cynwyd/profile/heating-and-air-conditioning/toran-heating-and-air-conditioning-inc-0241-80017178,BBB,yes
Tri-City Mechanical,(609) 571-1172,209 Stokes Ave,Ewing,NJ,08638,,,Mechanical Contractors,,,,,A+,,,https://www.bbb.org/us/nj/ewing/profile/mechanical-contractors/tri-city-mechanical-0221-90179736,BBB,yes
Triangle Plumbing and Heating LLC.,(610) 407-0604,18 Greentree Ln,Malvern,PA,19355,,,"Plumber, Heating Contractors, Plumbing and Heating",,,,,A+,,,https://www.bbb.org/us/pa/malvern/profile/plumber/triangle-plumbing-and-heating-llc-0241-211654379,BBB,yes
"Triton Services, LLC",(302) 985-7656,600 Madison St,Delaware City,DE,19706,,,"Heating and Air Conditioning, Plumber, Air Conditioning Contractors",,,,,A+,,,https://www.bbb.org/us/de/delaware-city/profile/heating-and-air-conditioning/triton-services-llc-0251-92023019,BBB,yes
TRKSEI Emergency Response Team Inc,(855) 551-7200,1515 Market St Ste 1200 PMB 653,Philadelphia,PA,19102,,,"General Contractor, Roofing Contractors, Heating and Air Conditioning",,,,,A+,,,https://www.bbb.org/us/pa/philadelphia/profile/general-contractor/trksei-emergency-response-team-inc--0241-236101262,BBB,yes
Troy Mechanical Inc.,(570) 451-0140,210 Overlook Dr,Coatesville,PA,19320,,,"Mechanical Contractors, Air Conditioning Contractors, Heating Contractors",,,,,A+,,,https://www.bbb.org/us/pa/coatesville/profile/mechanical-contractors/troy-mechanical-inc-0241-235972746/addressId/260514,BBB,yes
Trustco Heating & Air,(215) 281-9376,10901 Waldemire Dr,Philadelphia,PA,19154,,,"Heating and Air Conditioning, Air Conditioning Contractors, Air Conditioning Repair",,,,,A+,,,https://www.bbb.org/us/pa/philadelphia/profile/heating-and-air-conditioning/trustco-heating-air-0241-75001065,BBB,yes
Truth Mechanical LLC,(302) 541-2665,Townsend,Philadelphia,PA,,,,"Heating and Air Conditioning, Plumber, Residential Air Conditioning Contractors",,,,,A,,,https://www.bbb.org/us/de/townsend/profile/heating-and-air-conditioning/truth-mechanical-llc-0251-92033961,BBB,yes
"Tucker Builders & Remodelers, LLC",(215) 423-6407,2735 Pickwick St,Philadelphia,PA,19134,,,"General Contractor, Construction Services, Home Improvement",,,,,A+,,,https://www.bbb.org/us/pa/philadelphia/profile/general-contractor/tucker-builders-remodelers-llc-0241-235988165,BBB,yes
Turtle Tech Inc.,(215) 690-1195,9422 Kirkwood Rd,Philadelphia,PA,19114,,,"Heating and Air Conditioning, Air Conditioning Contractors, Air Conditioning Repair",,,,,A+,,,https://www.bbb.org/us/pa/philadelphia/profile/heating-and-air-conditioning/turtle-tech-inc-0241-235997884/addressId/208683,BBB,yes
Two Brothers General Construction LLC,(215) 941-1211,101 Geiger Rd,Philadelphia,PA,19115,,,"Residential General Contractor, Fence Contractors, Siding Contractors",,,,,A+,,,https://www.bbb.org/us/pa/philadelphia/profile/residential-general-contractor/two-brothers-general-construction-llc-0241-236075679,BBB,yes
"TycosGeneralContractors, Inc.",(302) 478-9267,412 Meco Dr,Wilmington,DE,19804,,,"Roofing Contractors, Construction Services, Gutters",,,,,A+,,,https://www.bbb.org/us/de/wilmington/profile/roofing-contractors/tycos-roofing-and-siding-0251-92003110,BBB,yes
UGIHeatingCooling&Plumbing,(877) 421-2956,PO Box 12407,Reading,PA,19612,,,"Heating and Air Conditioning, Plumber, Heating System Repair",,,,,A+,,,https://www.bbb.org/us/pa/reading/profile/heating-and-air-conditioning/ugi-heating-cooling-plumbing--0241-152834276,BBB,yes
Ultimate Improvements,(856) 357-0653,4 Jan Ct,Sewell,NJ,08080,,,"Roofing Contractors, General Contractor, Siding Contractors",,,,,A+,,,https://www.bbb.org/us/nj/sewell/profile/roofing-contractors/ultimate-improvements-0221-90195117,BBB,yes
"Unlimited Construction Company, Incorporated",(610) 255-0262,PO Box 331,Kemblesville,PA,19347,,,"General Contractor, Roofing Contractors, Siding Contractors",,,,,A+,,,https://www.bbb.org/us/pa/kemblesville/profile/general-contractor/unlimited-construction-company-incorporated-0241-174712404,BBB,yes
Vai Services LLC,(302) 468-6605,2803 Philadelphia Pike Ste B PMB 1036,Claymont,DE,19703,,,"Heating and Air Conditioning, Air Conditioning Contractors, Air Conditioning Repair",,,,,A+,,,https://www.bbb.org/us/de/claymont/profile/heating-and-air-conditioning/vai-services-llc-0251-92019454,BBB,yes
Vaughan Comfort Services Inc.,(856) 627-1973,212 Barrett Ave,Magnolia,NJ,08049,,,"Heating and Air Conditioning, Air Conditioning Contractors, Insulation Contractors",,,,,A+,,,https://www.bbb.org/us/nj/magnolia/profile/heating-and-air-conditioning/vaughan-comfort-services-inc-0221-80000274,BBB,yes
"VIP Remodeling, LLC",(267) 934-2566,2409 Tremont St,Philadelphia,PA,19115,,,"Remodeling, General Contractor, Bathroom Remodel",,,,,A+,,,https://www.bbb.org/us/pa/philadelphia/profile/remodeling/vip-remodeling-llc-0241-236096556,BBB,yes
