name,phone,address,city,state,zip_code,email,website,category,license_number,license_type,license_expiry,types_of_work,bbb_rating,google_rating,review_count,bbb_profile_url,source
MillenniumMechanical,(510) 921-8627,PO Box 2797,Castro Valley,CA,94546,,,Mechanical Contractors,,,,,,,,https://www.bbb.org/us/ca/castro-valley/profile/mechanical-contractors/millennium-mechanical-1116-903318,BBB
"Miller'sAirConditioning& Heating, Inc.",(925) 447-3000,4749 Bennett Dr Ste N,Livermore,CA,94551,,,"Heating Contractors, Air Conditioning Contractors, Air Duct Cleaning",,,,,A+,,,https://www.bbb.org/us/ca/livermore/profile/heating-contractors/millers-air-conditioning-heating-inc-1116-11122,BBB
Mission Home Remodeling,(415) 813-0440,475 Gough St,San Francisco,CA,94102,,,"General Contractor, Roofing Contractors, Drywall Contractors",,,,,A+,,,https://www.bbb.org/us/ca/san-francisco/profile/general-contractor/mission-home-remodeling-1116-936857,BBB
"MJMechanicalServices, Inc.",(650) 592-5634,PO Box 289,San Carlos,CA,94070,,,Commercial Air Conditioning Contractors,,,,,A+,,,https://www.bbb.org/us/ca/san-carlos/profile/commercial-air-conditioning-contractors/mj-mechanical-services-inc-1116-73160,BBB
"Montclair Construction & Structural, Inc.",(510) 547-2457,Oakland,Oakland,CA,,,,"Building Contractors, General Contractor, Concrete Contractors",,,,,A+,,,https://www.bbb.org/us/ca/oakland/profile/building-contractors/montclair-construction-structural-inc-1116-11144,BBB
"MonzoHVACConsulting, Inc.",(925) 324-7662,PO Box 5070,Concord,CA,94524,,,"Air Conditioning Contractors, Heating and Air Conditioning, Air Conditioning Repair",,,,,A-,,,https://www.bbb.org/us/ca/concord/profile/air-conditioning-contractor/monzo-hvac-consulting-inc-1116-974828/addressId/206936,BBB
"Moore Mechanical, Inc.",(925) 560-1505,6575 Trinity Ct Ste D,Dublin,CA,94568,,,"Heating Contractors, General Contractor, Air Conditioning Contractors",,,,,A+,,,https://www.bbb.org/us/ca/dublin/profile/heating-contractors/moore-mechanical-inc-1116-31811,BBB
Moss Industries Conveyance Solutions,(205) 956-1122,1349 San Mateo Ave,South San Francisco,CA,94080,,,Mechanical Contractors,,,,,A-,,,https://www.bbb.org/us/ca/south-san-francisco/profile/mechanical-contractors/moss-industries-conveyance-solutions-1116-964441,BBB
Mountain HouseMechanical,(707) 484-9388,Hopland,Oakland,CA,,,,"Heating and Air Conditioning, Air Conditioning Contractors, Air Conditioning Repair",,,,,A+,,,https://www.bbb.org/us/ca/hopland/profile/heating-and-air-conditioning/mountain-house-mechanical-1116-948710,BBB
Mr. PetersPlumbing,(415) 282-5485,930 Shotwell St,San Francisco,CA,94110,,,"Plumber, Heating and Air Conditioning",,,,,,,,https://www.bbb.org/us/ca/san-francisco/profile/plumber/mr-peters-plumbing-1116-28540,BBB
"Murray Construction Services, Inc.",(510) 581-4960,22358 Meekland Ave,Cherryland,CA,94541,,,"General Contractor, Waterproofing Contractors, Home Additions",,,,,A+,,,https://www.bbb.org/us/ca/cherryland/profile/general-contractor/murray-construction-services-inc-1116-20232,BBB
Musial Heating andAir,(877) 579-3075,Newark,Oakland,CA,,,,"Heating Contractors, Heating and Air Conditioning, Air Conditioning Contractors",,,,,A+,,,https://www.bbb.org/us/ca/newark/profile/heating-contractors/musials-hvac-1116-304765,BBB
Musial'sHVAC,(877) 579-3075,Newark,Oakland,CA,,,,"Heating Contractors, Heating and Air Conditioning, Air Conditioning Contractors",,,,,A+,,,https://www.bbb.org/us/ca/newark/profile/heating-contractors/musials-hvac-1116-304765,BBB
My mechanic,(855) 875-6899,20 park rd ste Burlingane,California,CA,94010,,,Mechanical Contractors,,,,,C,,,https://www.bbb.org/us/ca/california/profile/mechanical-contractors/my-mechanic-1116-959243,BBB
"Nabi Construction & Engineering, Inc.",(415) 552-2215,340 Division St,San Francisco,CA,94103,,,"Building Contractors, General Contractor, Construction Services",,,,,A+,,,https://www.bbb.org/us/ca/san-francisco/profile/building-contractors/nabi-construction-engineering-inc-1116-49600,BBB
Nahaman Construction,(650) 389-3297,San Mateo,Oakland,CA,,,,"General Contractor, Roofing Contractors, Painting Contractors",,,,,A+,,,https://www.bbb.org/us/ca/san-mateo/profile/general-contractor/nahaman-construction-1116-951609,BBB
New Age Heating & Cooling,(707) 654-7676,Fairfield,Oakland,CA,,,,"Heating and Air Conditioning, Air Conditioning Contractors, Air Conditioning Repair",,,,,A,,,https://www.bbb.org/us/ca/fairfield/profile/heating-and-air-conditioning/new-age-heating-cooling-1116-966080,BBB
NewarkMechanical,(510) 796-4272,PO Box 820,Newark,CA,94560,,,"Building Contractors, Residential Air Conditioning Contractors",,,,,,,,https://www.bbb.org/us/ca/newark/profile/building-contractors/newark-mechanical-1116-369015,BBB
"Nielson Mechanical, Inc.",(707) 437-5020,4987 Noonan Ln,Fairfield,CA,94533,,,"Air conditioning & Heating Contractors - Commercial, Heating and Air Conditioning, Air Conditioning Contractors",,,,,A+,,,https://www.bbb.org/us/ca/fairfield/profile/air-conditioning-heating-contractors-commercial/nielson-mechanical-inc-1116-970073,BBB
Nino Company,(650) 869-9200,South San Francisco,Oakland,CA,,,,"General Contractor, Bathroom Remodel, Kitchen Remodel",,,,,A,,,https://www.bbb.org/us/ca/south-san-francisco/profile/general-contractor/nino-company-1116-962060,BBB
"NK Construction and Real Estate Development, LLC",(415) 613-1677,San Francisco,Oakland,CA,,,,"Real Estate Development, General Contractor, Building Contractors",,,,,A,,,https://www.bbb.org/us/ca/san-francisco/profile/real-estate-development/nk-construction-and-real-estate-development-llc-1116-967346,BBB
"NK Heating &AirConditioning, Inc.",(925) 766-6044,1112 Springfield Court,Antioch,CA,94531,,,"Heating Contractors, Air Conditioning Contractors, Residential Air Conditioning Contractors",,,,,A+,,,https://www.bbb.org/us/ca/antioch/profile/heating-contractors/nk-heating-air-conditioning-inc-1116-52863,BBB
"Noek Heating andAir, Inc.",(408) 824-4342,Sunnyvale,Oakland,CA,,,,Air Conditioning Contractors,,,,,A+,,,https://www.bbb.org/us/ca/sunnyvale/profile/air-conditioning-contractor/noek-heating-and-air-inc-1216-1000025461,BBB
"Noni Homes, Inc.",(415) 275-1884,Sausalito,Oakland,CA,,,,"General Contractor, Bathroom Remodel, Remodel Contractors",,,,,A-,,,https://www.bbb.org/us/ca/sausalito/profile/general-contractor/noni-homes-inc-1116-976467,BBB
North Bay Construction,(415) 341-5199,488 Frederick St,San Francisco,CA,94117,,,"General Contractor, Heating and Air Conditioning, Bathroom Remodel",,,,,A+,,,https://www.bbb.org/us/ca/san-francisco/profile/general-contractor/north-bay-construction-1116-878833,BBB
North Cal Heating and Air,(408) 483-8455,546 W Fremont Ave,Sunnyvale,CA,94087,,,"Commercial Air Conditioning Contractors, Heating and Air Conditioning, Heating Contractors",,,,,A+,,,https://www.bbb.org/us/ca/sunnyvale/profile/commercial-air-conditioning-contractors/north-cal-heating-and-air-1216-241582,BBB
North Fence and Deck Company,(650) 615-0694,251 Station Ave,Daly City,CA,94014,,,"Fence Contractors, General Contractor, Deck Builder",,,,,A+,,,https://www.bbb.org/us/ca/daly-city/profile/fence-contractors/north-fence-and-deck-company-1116-66523,BBB
"Northshore Build, LLC",(949) 244-7937,1160 Battery St Ste 100,San Francisco,CA,94111,,,"General Contractor, Construction Services, Building Contractors",,,,,A+,,,https://www.bbb.org/us/ca/san-francisco/profile/general-contractor/northshore-build-llc-1116-939463,BBB
"NRG Clean Power, Inc.",(800) 698-6627,75 E Santa Clara St,San Jose,CA,95113,,,"Electric Vehicle Charging Stations, Roofing Contractors, Heating and Air Conditioning",,,,,A+,,,https://www.bbb.org/us/ca/san-jose/profile/electric-vehicle-charging-stations/nrg-clean-power-inc-1216-892145,BBB
NWP Heating and Air,(800) 622-7780,4740 E 2nd St Ste 26,Benicia,CA,94510,,,"Heating Contractors, Heating and Air Conditioning, Air Conditioning Contractors",,,,,A+,,,https://www.bbb.org/us/ca/benicia/profile/heating-contractors/nwp-heating-and-air-1116-31711,BBB
Occidental Power Solar & Cogen,(415) 681-8861,5982 Mission Street,San Francisco,CA,94112,,,"Solar Energy Equipment Dealers, General Contractor, Electrician",,,,,A+,,,https://www.bbb.org/us/ca/san-francisco/profile/solar-energy-equipment-dealers/occidental-power-solar-cogen-1116-29394,BBB
"OCD Plan and Build, Inc.",(510) 910-2256,1900 Powell St Ste 600,Emeryville,CA,94608,,,"General Contractor, Bathroom Remodel, Remodel Contractors",,,,,A-,,,https://www.bbb.org/us/ca/emeryville/profile/general-contractor/ocd-plan-and-build-inc-1116-974932,BBB
"Ocean Remodel, Inc.",(310) 744-5575,2811 Castro Valley Blvd Ste 111,Castro Valley,CA,94546,,,"General Contractor, Roofing Contractors, Painting Contractors",,,,,A,,,https://www.bbb.org/us/ca/castro-valley/profile/general-contractor/ocean-remodel-inc-1116-960621,BBB
"Olives Construction, LLC.",(628) 224-7955,San Francisco,Oakland,CA,,,,"Building Contractors, General Contractor, Construction Services",,,,,A,,,https://www.bbb.org/us/ca/san-francisco/profile/building-contractors/olives-construction-llc-1116-962893,BBB
Olsson Plumbing Company,(510) 522-2442,1650 Abram Ct,San Leandro,CA,94577,,,"Plumber, Heating and Air Conditioning, Sewer Cleaning",,,,,A+,,,https://www.bbb.org/us/ca/san-leandro/profile/plumber/olsson-plumbing-company-1116-526649,BBB
On Shore Construction andMechanical,,Oakland,Oakland,CA,,,,"Building Contractors, Plumber, Home Builders",,,,,A+,,,https://www.bbb.org/us/ca/oakland/profile/building-contractors/on-shore-construction-and-mechanical-1116-373326,BBB
One Hour Heating and Air Conditioning of Pleasant Hill,(925) 323-7402,2100 Monument Blvd Ste 11,Pleasant Hill,CA,94523,,,"Air Conditioning Contractors, Heating and Air Conditioning, Air Duct Cleaning",,,,,A-,,,https://www.bbb.org/us/ca/pleasant-hill/profile/air-conditioning-contractor/one-hour-heating-and-air-conditioning-of-pleasant-hill-1116-906374,BBB
One Roofing,(415) 740-9940,1160 Battery St,San Francisco,CA,94111,,,"Roofing Contractors, General Contractor, Siding Contractors",,,,,A+,,,https://www.bbb.org/us/ca/san-francisco/profile/roofing-contractors/one-roofing-1116-976499,BBB
Ongaro & Sons,(415) 454-7400,11 Ross Ave,San Anselmo,CA,94960,,,"Heating and Air Conditioning, Plumber, Air Conditioning Contractors",,,,,A+,,,https://www.bbb.org/us/ca/san-anselmo/profile/heating-and-air-conditioning/ongaro-sons-1116-11624/addressId/147751,BBB
Onyx Insulation,,8055 Collins Dr Ste 202,Oakland,CA,94621,,,"Insulation Contractors, Mechanical Insulation Contractors",,,,,A+,,,https://www.bbb.org/us/ca/oakland/profile/insulation-contractors/onyx-insulation-1116-923916/addressId/140973,BBB
Onyx Insulation,,275 5th St Ste 405,San Francisco,CA,94103,,,"Insulation Contractors, Mechanical Insulation Contractors",,,,,A+,,,https://www.bbb.org/us/ca/san-francisco/profile/insulation-contractors/onyx-insulation-1116-923916,BBB
Oren's Services,(800) 974-5349,Oakland,Oakland,CA,,,,"Heating and Air Conditioning, Cleaning Services, Air Duct Cleaning",,,,,A+,,,https://www.bbb.org/us/ca/oakland/profile/heating-and-air-conditioning/orens-services-1116-449481,BBB
Ortiz Heating & Air Conditioning,(650) 758-4900,833 Mahler Rd Ste 14,Burlingame,CA,94010,,,"Heating Contractors, Heating and Air Conditioning, Air Conditioning Contractors",,,,,A+,,,https://www.bbb.org/us/ca/burlingame/profile/heating-contractors/ortiz-heating-air-conditioning-1116-71325,BBB
OS Heating and Cooling,(510) 395-2895,Pinole,Oakland,CA,,,,"Heating and Air Conditioning, Air Conditioning Contractors, Air Conditioning Repair",,,,,A+,,,https://www.bbb.org/us/ca/pinole/profile/heating-and-air-conditioning/os-heating-and-cooling-1116-955002,BBB
Ozone Service,(669) 212-1470,San Jose,Oakland,CA,,,,"Heating and Air Conditioning, Air conditioning & Heating Contractors - Commercial",,,,,A-,,,https://www.bbb.org/us/ca/san-jose/profile/heating-and-air-conditioning/ozone-service-1216-1000061631,BBB
Pac-AtlanticPlumbingInc.,(510) 255-5284,1002 View Dr,El Sobrante,CA,94803,,,Heating and Air Conditioning,,,,,A+,,,https://www.bbb.org/us/ca/el-sobrante/profile/heating-and-air-conditioning/pac-atlantic-plumbing-inc-1116-945699,BBB
Pacific Bay Construction,(925) 698-8552,Walnut Creek,Oakland,CA,,,,"General Contractor, Bathroom Remodel, Remodel Contractors",,,,,A+,,,https://www.bbb.org/us/ca/walnut-creek/profile/general-contractor/pacific-bay-construction-1116-941831,BBB
Palma Super ColdHVAC,(805) 806-8150,Antioch,Oakland,CA,,,,"Heating and Air Conditioning, Air Conditioning Contractors, Air Duct Cleaning",,,,,A-,,,https://www.bbb.org/us/ca/antioch/profile/heating-and-air-conditioning/palma-super-cold-hvac-1116-942426,BBB
PDLGeneralConstruction,(510) 837-8078,Richmond,Oakland,CA,,,,"General Contractor, Kitchen Remodel, Remodeling",,,,,A+,,,https://www.bbb.org/us/ca/richmond/profile/general-contractor/pdl-general-construction-1116-928200,BBB
Pearl CityPlumbingInc.,(415) 279-5312,6748 Mission Street #517,Daly City,CA,94014,,,Heating and Air Conditioning,,,,,A+,,,https://www.bbb.org/us/ca/daly-city/profile/heating-and-air-conditioning/pearl-city-plumbing-inc-1116-946016,BBB
"Perfect Star Heating andAirConditioning, Inc.",(925) 550-0505,4415 Cowell Rd Ste 210B,Concord,CA,94518,,,"Residential Air Conditioning Contractors, Electrician, Heating and Air Conditioning",,,,,A+,,,https://www.bbb.org/us/ca/concord/profile/residential-air-conditioning-contractors/perfect-star-heating-cooling-electrical-1116-876629,BBB
"Perfect Star Heating, Cooling, & Electrical",(925) 550-0505,4415 Cowell Rd Ste 210B,Concord,CA,94518,,,"Residential Air Conditioning Contractors, Electrician, Heating and Air Conditioning",,,,,A+,,,https://www.bbb.org/us/ca/concord/profile/residential-air-conditioning-contractors/perfect-star-heating-cooling-electrical-1116-876629,BBB
"Peter Downey Construction Company, Inc.",(510) 913-6107,1224 Carleton St,Berkeley,CA,94702,,,"General Contractor, Building Contractors",,,,,A+,,,https://www.bbb.org/us/ca/berkeley/profile/general-contractor/peter-downey-construction-company-inc-1116-211806,BBB
"Peter Levi Plumbing, Inc.",(415) 275-3145,24 Digital Dr,Novato,CA,94949,,,"Plumber, Heating and Air Conditioning, Drainage Contractors",,,,,A+,,,https://www.bbb.org/us/ca/novato/profile/plumber/peter-levi-plumbing-inc-1116-56211,BBB
PetersenDean,(800) 564-0362,25018 Viking Street #120,Hayward,CA,94545,,,"Roofing Contractors, Plumber, Heating and Air Conditioning",,,,,,,,https://www.bbb.org/us/ca/hayward/profile/roofing-contractors/petersendean-1116-15359/addressId/92489,BBB
PetersonMechanicalIncorporated,(707) 938-8481,21819 8th St E,Sonoma,CA,95476,,,Mechanical Contractors,,,,,A+,,,https://www.bbb.org/us/ca/sonoma/profile/mechanical-contractors/peterson-mechanical-incorporated-1116-29479,BBB
"Planchon Roofing, Inc.",(510) 235-4056,2207 Emeric Ave,San Pablo,CA,94806,,,"Roofing Contractors, General Contractor, Metal Roofing Contractors",,,,,A+,,,https://www.bbb.org/us/ca/san-pablo/profile/roofing-contractors/planchon-roofing-inc-1116-11261,BBB
PlotkePlumbing&HeatingInc.,(760) 632-0461,2925 Crocker Ave,Redwood City,CA,94063,,,Heating and Air Conditioning,,,,,A,,,https://www.bbb.org/us/ca/redwood-city/profile/heating-and-air-conditioning/plotke-plumbing-heating-inc-1116-955439,BBB
PlumbingAaron Sunset Dstrctt,(415) 830-3155,3007 San Bruno Ave,San Francisco,CA,94134,,,Heating and Air Conditioning,,,,,,,,https://www.bbb.org/us/ca/san-francisco/profile/heating-and-air-conditioning/plumbing-aaron-sunset-dstrctt-1116-480701,BBB
Power Pro Landscape Construction,(321) 272-0885,1044 Liberty St,El Cerrito,CA,94530,,,"Landscape Contractors, Landscape Design, Lawn and Garden",,,,,A,,,https://www.bbb.org/us/ca/el-cerrito/profile/landscape-contractors/power-pro-landscape-construction-1116-976257,BBB
Precise Climate Solutions,(650) 272-7001,Redwood City,Oakland,CA,,,,"Heating and Air Conditioning, Air Conditioning Contractors, Air Duct Cleaning",,,,,A+,,,https://www.bbb.org/us/ca/redwood-city/profile/heating-and-air-conditioning/precise-climate-solutions-1116-951950,BBB
Precision Building and Design,(925) 478-6613,PO Box 4818,Walnut Creek,CA,94596,,,"General Contractor, Heating and Air Conditioning, Bathroom Remodel",,,,,A+,,,https://www.bbb.org/us/ca/walnut-creek/profile/general-contractor/precision-building-and-design-1116-52017,BBB
Pro Attic Restoration,(510) 514-7108,1340 A St,Hayward,CA,94541,,,"Pest Control Services, Heating and Air Conditioning, Insulation Contractors",,,,,A+,,,https://www.bbb.org/us/ca/hayward/profile/pest-control/pro-attic-restoration-1116-919639,BBB
"ProtempMechanical, Inc.",(888) 687-1924,3350 Scott Blvd Bldg #3,Santa Clara,CA,95054,,,Heating Contractors,,,,,A+,,,https://www.bbb.org/us/ca/santa-clara/profile/heating-contractors/protemp-mechanical-inc-1216-222298,BBB
"Pulido'sGeneralConstruction, Inc.",(510) 760-6018,Oakland,Oakland,CA,,,,"General Contractor, Fence Contractors, Mason Contractors",,,,,A+,,,https://www.bbb.org/us/ca/oakland/profile/general-contractor/pulidos-general-construction-inc-1116-946061,BBB
Qualtech Heating & Cooling,(925) 831-2444,4115 Blackhawk Plaza Cir Ste 100,Danville,CA,94506,,,"Heating Contractors, Air Conditioning Contractors, Air Duct Cleaning",,,,,A+,,,https://www.bbb.org/us/ca/danville/profile/heating-contractors/qualtech-heating-cooling-1116-200850,BBB
Quick Heating Cooling,(650) 333-5145,Sunnyvale,Oakland,CA,,,,"Residential Air Conditioning Contractors, Air Conditioning Repair, Heating Contractors",,,,,A+,,,https://www.bbb.org/us/ca/sunnyvale/profile/residential-air-conditioning-contractors/quick-heating-cooling-1216-226613,BBB
"R & R Refrigeration and AirConditioning, Inc.",(408) 297-0383,1775 Monterey Hwy #66A,San Jose,CA,95112,,,"Refrigeration, Heating and Air Conditioning, Air Conditioning Contractors",,,,,A+,,,https://www.bbb.org/us/ca/san-jose/profile/refrigeration/r-r-refrigeration-and-air-conditioning-inc-1216-1000005930,BBB
R C'sMechanicalServices,(510) 438-8806,4161 Ingot St,Fremont,CA,94538,,,"Heating Contractors, Refrigerator Repair",,,,,,,,https://www.bbb.org/us/ca/fremont/profile/heating-contractors/r-cs-mechanical-services-1116-225106,BBB
"R J Construction Pros, Inc.",(510) 200-3096,Hayward,Oakland,CA,,,,"General Contractor, Construction Services, Bathroom Remodel",,,,,A-,,,https://www.bbb.org/us/ca/hayward/profile/general-contractor/r-j-construction-pros-inc-1116-970000,BBB
"R&D Construction Company, Inc.",(415) 710-3828,224 Elmira St,San Francisco,CA,94124,,,"General Contractor, Bathroom Remodel, Remodeling",,,,,A+,,,https://www.bbb.org/us/ca/san-francisco/profile/general-contractor/rd-construction-company-inc-1116-77968,BBB
Rabboni Mechanical,(510) 682-8449,33429 5th St,Union City,CA,94587,,,"Heating Contractors, Heating and Air Conditioning, Air Conditioning Contractors",,,,,A+,,,https://www.bbb.org/us/ca/union-city/profile/heating-contractors/rabboni-mechanical-1116-302734,BBB
Raven Heating & Air Conditioning,(415) 328-7701,Novato,Oakland,CA,,,,"Heating Contractors, Heating and Air Conditioning, Air Conditioning Contractors",,,,,A+,,,https://www.bbb.org/us/ca/novato/profile/heating-contractors/raven-heating-air-conditioning-1116-381545,BBB
Raxe Construction,(925) 232-1325,Walnut Creek,Oakland,CA,,,,"General Contractor, Roofing Contractors, Painting Contractors",,,,,A,,,https://www.bbb.org/us/ca/walnut-creek/profile/general-contractor/raxe-construction-1116-962938,BBB
RB TravisPlumbing,(866) 397-3787,575 Leisure St,Livermore,CA,94551,,,"Heating and Air Conditioning, Plumber, Air Conditioning Contractors",,,,,A+,,,https://www.bbb.org/us/ca/livermore/profile/heating-and-air-conditioning/rb-travis-plumbing-1116-39304/addressId/209147,BBB
Reactic Restoration,(510) 275-3708,2632 International Blvd Ste 155b,Oakland,CA,94601,,,"Fire and Water Damage Restoration, General Contractor, Mold Removal",,,,,A+,,,https://www.bbb.org/us/ca/oakland/profile/fire-water-damage-restoration/reactic-restoration-1116-314128/addressId/112962,BBB
"Red Mountain Heating and Air, Inc.",(707) 704-6357,625 Rowland Blvd,Novato,CA,94947,,,"Heating and Air Conditioning, Heating Contractors",,,,,A+,,,https://www.bbb.org/us/ca/novato/profile/heating-and-air-conditioning/red-mountain-heating-and-air-inc-1116-928052,BBB
Redwood Mechanical,(650) 369-1793,1590 Tacoma Way,Redwood City,CA,94063,,,"Heating and Air Conditioning, Plumber",,,,,,,,https://www.bbb.org/us/ca/redwood-city/profile/heating-and-air-conditioning/redwood-mechanical-1116-63010,BBB
Refreshed Heating and Cooling,(925) 755-4440,2010 Crow Canyon Pl Ste 100,San Ramon,CA,94583,,,"Heating and Air Conditioning, Furnace Repair, Heat Pumps",,,,,A+,,,https://www.bbb.org/us/ca/san-ramon/profile/heating-and-air-conditioning/refreshed-heating-and-cooling-1116-928442,BBB
"Reliable Refrigeration, Inc.",(707) 252-7227,4405 Solano Ave,Napa,CA,94558,,,"Commercial Refrigeration, Heating and Air Conditioning, Air Conditioning Contractors",,,,,A+,,,https://www.bbb.org/us/ca/napa/profile/commercial-refrigeration/reliable-refrigeration-inc-1116-30198,BBB
Retail Solutions Now,(877) 624-9640,611 Gateway Blvd Ste 102,South San Francisco,CA,94080,,,"Facility Maintenance, General Contractor, Handyman",,,,,A+,,,https://www.bbb.org/us/ca/south-san-francisco/profile/facility-maintenance/retail-solutions-now-1116-876125,BBB
Ric's Kitchen & Bath,(510) 733-5543,3664 Castro Valley Blvd,Castro Valley,CA,94546,,,"General Contractor, Construction Services, Bathroom Remodel",,,,,A+,,,https://www.bbb.org/us/ca/castro-valley/profile/general-contractor/rics-kitchen-bath-1116-47342,BBB
"Rich Cortez & Sons, Inc.",(925) 455-0720,Livermore,Oakland,CA,,,,"Heating and Air Conditioning, Appliance Repair",,,,,A+,,,https://www.bbb.org/us/ca/livermore/profile/heating-and-air-conditioning/rich-cortez-sons-inc-1116-13979,BBB
"Richard's Heating & Air Repair, Inc",(925) 456-0688,410 Longfellow Ct Ste A,Livermore,CA,94550,,,"Heating Contractors, Heating and Air Conditioning, Air Conditioning Contractors",,,,,A+,,,https://www.bbb.org/us/ca/livermore/profile/heating-contractors/richards-heating-air-repair-inc-1116-62464,BBB
"Richard's Heating & Air Repair, Inc",(925) 846-9397,410 Longfellow Ct Ste A,Livermore,CA,94550,,,"Heating Contractors, Heating and Air Conditioning, Air Conditioning Contractors",,,,,A+,,,https://www.bbb.org/us/ca/livermore/profile/heating-contractors/richards-heating-air-repair-inc-1116-62464/addressId/199044,BBB
Richards Best Builders,(510) 318-2463,1606 80th Ave,Oakland,CA,94621,,,"General Contractor, Commercial Contractors",,,,,A+,,,https://www.bbb.org/us/ca/oakland/profile/general-contractor/richards-best-builders-1116-874375,BBB
Ridgeback Mechanical,(707) 666-5056,Sonoma,Oakland,CA,,,,"Heating and Air Conditioning, Residential Air Conditioning Contractors, Heating Contractors",,,,,A,,,https://www.bbb.org/us/ca/sonoma/profile/heating-and-air-conditioning/ridgeback-mechanical-1116-964372,BBB
"Rivera's Heating and Air Conditioning, Inc.",(510) 735-7206,703 Castro St Ste 11,San Leandro,CA,94577,,,"Heating Contractors, Heating and Air Conditioning, Air Conditioning Contractors",,,,,A+,,,https://www.bbb.org/us/ca/san-leandro/profile/heating-contractors/riveras-heating-and-air-conditioning-inc-1116-24058,BBB
RiversPlumbingHeating& Air,(925) 951-0792,3958 Valley Ave Ste G,Pleasanton,CA,94566,,,"Heating Contractors, Plumber, Heating and Air Conditioning",,,,,A+,,,https://www.bbb.org/us/ca/pleasanton/profile/heating-contractors/rivers-plumbing-heating-air-1116-27398/addressId/7685,BBB
RjdMechanical& Construction,(510) 703-2466,505 Mcbride Dr,Lafayette,CA,94549,,,Mechanical Contractors,,,,,,,,https://www.bbb.org/us/ca/lafayette/profile/mechanical-contractors/rjd-mechanical-construction-1116-903319,BBB
"RMIMechanicalContractors, Inc.",(650) 583-6200,1385 Lowrie Ave,South San Francisco,CA,94080,,,Heating and Air Conditioning,,,,,A+,,,https://www.bbb.org/us/ca/south-san-francisco/profile/heating-and-air-conditioning/rmi-mechanical-contractors-inc-1116-82377,BBB
"Robert Kennedy Construction, Inc.",(415) 713-8104,Emeryville,Oakland,CA,,,,"General Contractor, Remodel Contractors",,,,,A+,,,https://www.bbb.org/us/ca/emeryville/profile/general-contractor/robert-kennedy-construction-inc-1116-923924,BBB
Rockridge Builders,(510) 535-1682,1730 10th Ave,Oakland,CA,94606,,,"General Contractor, Bathroom Remodel, Remodel Contractors",,,,,A+,,,https://www.bbb.org/us/ca/oakland/profile/general-contractor/rockridge-builders-1116-11332,BBB
Rocky'sPlumbingAnd Rooter,(510) 857-4327,35823 Bettencourt St,Newark,CA,94560,,,Heating and Air Conditioning,,,,,C,,,https://www.bbb.org/us/ca/newark/profile/heating-and-air-conditioning/rockys-plumbing-and-rooter-1116-946372,BBB
Romero's Hvac INC,(925) 686-4289,4425 Treat Blvd # 224,Concord,CA,94521,,,Mechanical Contractors,,,,,,,,https://www.bbb.org/us/ca/concord/profile/mechanical-contractors/romeros-hvac-inc-1116-900423,BBB
"Ryan & Ryan Construction, Inc.",(650) 588-0547,390 Swift Ave Ste 22,South San Francisco,CA,94080,,,"Building Contractors, General Contractor, Construction Services",,,,,A+,,,https://www.bbb.org/us/ca/south-san-francisco/profile/building-contractors/ryan-ryan-construction-inc-1116-192352,BBB
S And A Pacific Construction,(510) 932-1955,Richmond,Oakland,CA,,,,"General Engineering Contractor, Concrete Contractors, Retaining Wall Contractors",,,,,A+,,,https://www.bbb.org/us/ca/richmond/profile/general-engineering-contractor/s-and-a-pacific-construction-1116-950897,BBB
S LMechanicalContractorsCo,(415) 706-1767,422 Plymouth Ave,San Francisco,CA,94112,,,Heating and Air Conditioning,,,,,,,,https://www.bbb.org/us/ca/san-francisco/profile/heating-and-air-conditioning/s-l-mechanical-contractors-co-1116-178428,BBB
